aiter/configs/model_configs/dsv4_a8w8_blockscale_bpreshuffle_tuned_gemm.csv
gfx,cu_num,M,N,K,libtype,kernelId,splitK,us,kernelName,tflops,bw,errRatio
gfx950,256,1,768,7168,asm,5,6,8.8256,_ZN5aiter42fp8gemm_bf16_blockscale_BpreShuffle_32x128E,1.25,624.74,0.0013
gfx950,256,2,768,7168,asm,30,7,8.9844,_ZN5aiter42fp8gemm_bf16_blockscale_BpreShuffle_80x128E,2.45,614.67,0.0052
gfx950,256,4,768,7168,asm,7,8,10.171,_ZN5aiter42fp8gemm_bf16_blockscale_BpreShuffle_32x128E,4.33,544.67,0.0117
gfx950,256,8,768,7168,asm,31,8,10.8073,_ZN5aiter42fp8gemm_bf16_blockscale_BpreShuffle_80x128E,8.15,515.82,0.0104
gfx950,256,16,768,7168,asm,14,7,10.1285,_ZN5aiter42fp8gemm_bf16_blockscale_BpreShuffle_48x128E,17.39,557.27,0.0042
gfx950,256,32,768,7168,asm,15,8,9.8549,_ZN5aiter42fp8gemm_bf16_blockscale_BpreShuffle_48x128E,35.75,586.87,0.0089
gfx950,256,48,768,7168,asm,31,8,10.5365,_ZN5aiter42fp8gemm_bf16_blockscale_BpreShuffle_80x128E,50.16,562.12,0.0109
gfx950,256,64,768,7168,asm,15,8,9.3817,_ZN5aiter42fp8gemm_bf16_blockscale_BpreShuffle_48x128E,75.11,646.16,0.0098
gfx950,256,80,768,7168,asm,22,7,10.4599,_ZN5aiter42fp8gemm_bf16_blockscale_BpreShuffle_64x128E,84.21,592.87,0.0057
gfx950,256,96,768,7168,asm,7,8,9.4429,_ZN5aiter42fp8gemm_bf16_blockscale_BpreShuffle_32x128E,111.93,671.47,0.0098
gfx950,256,112,768,7168,asm,7,8,9.2873,_ZN5aiter42fp8gemm_bf16_blockscale_BpreShuffle_32x128E,132.78,697.71,0.0107
gfx950,256,128,768,7168,asm,7,8,9.3831,_ZN5aiter42fp8gemm_bf16_blockscale_BpreShuffle_32x128E,150.19,705.43,0.0096
gfx950,256,144,768,7168,asm,21,6,10.3695,_ZN5aiter42fp8gemm_bf16_blockscale_BpreShuffle_64x128E,152.9,651.76,0.0041
gfx950,256,160,768,7168,asm,13,6,10.9385,_ZN5aiter42fp8gemm_bf16_blockscale_BpreShuffle_48x128E,161.05,630.59,0.0039
gfx950,256,176,768,7168,asm,14,7,9.7451,_ZN5aiter42fp8gemm_bf16_blockscale_BpreShuffle_48x128E,198.85,722.1,0.0048
gfx950,256,192,768,7168,asm,15,8,9.096,_ZN5aiter42fp8gemm_bf16_blockscale_BpreShuffle_48x128E,232.4,788.94,0.0091
gfx950,256,208,768,7168,asm,5,6,9.4424,_ZN5aiter42fp8gemm_bf16_blockscale_BpreShuffle_32x128E,242.53,774.75,0.0041
gfx950,256,224,768,7168,asm,15,8,9.2572,_ZN5aiter42fp8gemm_bf16_blockscale_BpreShuffle_48x128E,266.41,805.29,0.0068
gfx950,256,240,768,7168,asm,31,8,10.8125,_ZN5aiter42fp8gemm_bf16_blockscale_BpreShuffle_80x128E,244.38,702.33,0.006
gfx950,256,256,768,7168,asm,23,8,10.9153,_ZN5aiter42fp8gemm_bf16_blockscale_BpreShuffle_64x128E,258.22,708.48,0.0088
gfx950,256,288,768,7168,asm,23,8,11.3761,_ZN5aiter42fp8gemm_bf16_blockscale_BpreShuffle_64x128E,278.73,704.26,0.0075
gfx950,256,320,768,7168,ck,7,0,17.2727,a8w8_blockscale_bpreshuffle_1x128x128_256x16x64x256_16x16_16x16_16x16x1_16x16x1_1x16x1x16_4_1x1_intrawave_v1,203.98,479.97,0.0
gfx950,256,352,768,7168,ck,7,0,17.6303,a8w8_blockscale_bpreshuffle_1x128x128_256x16x64x256_16x16_16x16_16x16x1_16x16x1_1x16x1x16_4_1x1_intrawave_v1,219.82,486.03,0.0
gfx950,256,384,768,7168,ck,7,0,17.5131,a8w8_blockscale_bpreshuffle_1x128x128_256x16x64x256_16x16_16x16_16x16x1_16x16x1_1x16x1x16_4_1x1_intrawave_v1,241.41,505.19,0.0
gfx950,256,416,768,7168,ck,7,0,17.9933,a8w8_blockscale_bpreshuffle_1x128x128_256x16x64x256_16x16_16x16_16x16x1_16x16x1_1x16x1x16_4_1x1_intrawave_v1,254.55,507.18,0.0
gfx950,256,448,768,7168,ck,7,0,17.7769,a8w8_blockscale_bpreshuffle_1x128x128_256x16x64x256_16x16_16x16_16x16x1_16x16x1_1x16x1x16_4_1x1_intrawave_v1,277.47,529.02,0.0
gfx950,256,480,768,7168,ck,12,0,18.4399,a8w8_blockscale_bpreshuffle_1x128x128_256x32x64x256_16x16_16x16_16x16x1_16x16x1_1x32x1x8_8_2x1_intrawave_v1,286.6,525.11,0.0
gfx950,256,512,768,7168,ck,12,0,18.4448,a8w8_blockscale_bpreshuffle_1x128x128_256x32x64x256_16x16_16x16_16x16x1_16x16x1_1x32x1x8_8_2x1_intrawave_v1,305.62,540.07,0.0
gfx950,256,544,768,7168,ck,12,0,18.4836,a8w8_blockscale_bpreshuffle_1x128x128_256x32x64x256_16x16_16x16_16x16x1_16x16x1_1x32x1x8_8_2x1_intrawave_v1,324.04,554.0,0.0
gfx950,256,576,768,7168,ck,7,0,18.5259,a8w8_blockscale_bpreshuffle_1x128x128_256x16x64x256_16x16_16x16_16x16x1_16x16x1_1x16x1x16_4_1x1_intrawave_v1,342.32,567.77,0.0
gfx950,256,608,768,7168,ck,12,0,18.8067,a8w8_blockscale_bpreshuffle_1x128x128_256x32x64x256_16x16_16x16_16x16x1_16x16x1_1x32x1x8_8_2x1_intrawave_v1,355.94,574.11,0.0
gfx950,256,640,768,7168,ck,12,0,18.7839,a8w8_blockscale_bpreshuffle_1x128x128_256x32x64x256_16x16_16x16_16x16x1_16x16x1_1x32x1x8_8_2x1_intrawave_v1,375.13,589.63,0.0
gfx950,256,672,768,7168,ck,12,0,18.8503,a8w8_blockscale_bpreshuffle_1x128x128_256x32x64x256_16x16_16x16_16x16x1_16x16x1_1x32x1x8_8_2x1_intrawave_v1,392.5,602.33,0.0
gfx950,256,704,768,7168,ck,12,0,19.5508,a8w8_blockscale_bpreshuffle_1x128x128_256x32x64x256_16x16_16x16_16x16x1_16x16x1_1x32x1x8_8_2x1_intrawave_v1,396.46,595.0,0.0
gfx950,256,736,768,7168,ck,12,0,20.0064,a8w8_blockscale_bpreshuffle_1x128x128_256x32x64x256_16x16_16x16_16x16x1_16x16x1_1x32x1x8_8_2x1_intrawave_v1,405.04,595.37,0.0
gfx950,256,768,768,7168,ck,12,0,19.2396,a8w8_blockscale_bpreshuffle_1x128x128_256x32x64x256_16x16_16x16_16x16x1_16x16x1_1x32x1x8_8_2x1_intrawave_v1,439.5,633.57,0.0
gfx950,256,800,768,7168,ck,12,0,19.6412,a8w8_blockscale_bpreshuffle_1x128x128_256x32x64x256_16x16_16x16_16x16x1_16x16x1_1x32x1x8_8_2x1_intrawave_v1,448.45,634.8,0.0
gfx950,256,832,768,7168,ck,12,0,19.5136,a8w8_blockscale_bpreshuffle_1x128x128_256x32x64x256_16x16_16x16_16x16x1_16x16x1_1x32x1x8_8_2x1_intrawave_v1,469.43,653.22,0.0
gfx950,256,864,768,7168,ck,12,0,19.8179,a8w8_blockscale_bpreshuffle_1x128x128_256x32x64x256_16x16_16x16_16x16x1_16x16x1_1x32x1x8_8_2x1_intrawave_v1,480.0,657.25,0.0
gfx950,256,896,768,7168,ck,12,0,19.7766,a8w8_blockscale_bpreshuffle_1x128x128_256x32x64x256_16x16_16x16_16x16x1_16x16x1_1x32x1x8_8_2x1_intrawave_v1,498.82,672.7,0.0
gfx950,256,928,768,7168,ck,12,0,20.1133,a8w8_blockscale_bpreshuffle_1x128x128_256x32x64x256_16x16_16x16_16x16x1_16x16x1_1x32x1x8_8_2x1_intrawave_v1,507.99,675.29,0.0
gfx950,256,960,768,7168,ck,17,0,21.0451,a8w8_blockscale_bpreshuffle_1x128x128_256x64x64x256_16x16_16x16_16x16x1_16x16x1_1x32x1x8_8_2x1_intrawave_v1,502.24,658.63,0.0
gfx950,256,992,768,7168,asm,9,2,18.5298,_ZN5aiter42fp8gemm_bf16_blockscale_BpreShuffle_48x128E,589.43,763.06,0.0
gfx950,256,1024,768,7168,ck,17,0,21.0256,a8w8_blockscale_bpreshuffle_1x128x128_256x64x64x256_16x16_16x16_16x16x1_16x16x1_1x32x1x8_8_2x1_intrawave_v1,536.22,685.73,0.0
gfx950,256,1088,768,7168,ck,17,0,21.2531,a8w8_blockscale_bpreshuffle_1x128x128_256x64x64x256_16x16_16x16_16x16x1_16x16x1_1x32x1x8_8_2x1_intrawave_v1,563.63,704.6,0.0
gfx950,256,1152,768,7168,ck,12,0,21.1225,a8w8_blockscale_bpreshuffle_1x128x128_256x32x64x256_16x16_16x16_16x16x1_16x16x1_1x32x1x8_8_2x1_intrawave_v1,600.48,735.33,0.0
gfx950,256,1216,768,7168,ck,17,0,21.9912,a8w8_blockscale_bpreshuffle_1x128x128_256x64x64x256_16x16_16x16_16x16x1_16x16x1_1x32x1x8_8_2x1_intrawave_v1,608.8,731.61,0.0
gfx950,256,1280,768,7168,ck,17,0,21.6302,a8w8_blockscale_bpreshuffle_1x128x128_256x64x64x256_16x16_16x16_16x16x1_16x16x1_1x32x1x8_8_2x1_intrawave_v1,651.54,769.58,0.0
gfx950,256,1344,768,7168,ck,17,0,21.6757,a8w8_blockscale_bpreshuffle_1x128x128_256x64x64x256_16x16_16x16_16x16x1_16x16x1_1x32x1x8_8_2x1_intrawave_v1,682.68,793.66,0.0
gfx950,256,1408,768,7168,ck,11,0,28.2316,a8w8_blockscale_bpreshuffle_1x128x128_256x32x128x256_16x16_16x16_16x16x1_16x16x1_1x32x1x8_8_2x1_intrawave_v1,549.11,629.09,0.0
gfx950,256,1472,768,7168,ck,17,0,28.5916,a8w8_blockscale_bpreshuffle_1x128x128_256x64x64x256_16x16_16x16_16x16x1_16x16x1_1x32x1x8_8_2x1_intrawave_v1,566.84,640.65,0.0
gfx950,256,1536,768,7168,ck,11,0,28.4924,a8w8_blockscale_bpreshuffle_1x128x128_256x32x128x256_16x16_16x16_16x16x1_16x16x1_1x32x1x8_8_2x1_intrawave_v1,593.54,662.44,0.0
gfx950,256,1600,768,7168,ck,11,0,28.9544,a8w8_blockscale_bpreshuffle_1x128x128_256x32x128x256_16x16_16x16_16x16x1_16x16x1_1x32x1x8_8_2x1_intrawave_v1,608.41,671.1,0.0
gfx950,256,1664,768,7168,ck,11,0,28.9792,a8w8_blockscale_bpreshuffle_1x128x128_256x32x128x256_16x16_16x16_16x16x1_16x16x1_1x32x1x8_8_2x1_intrawave_v1,632.2,689.75,0.0
gfx950,256,1728,768,7168,ck,11,0,28.8859,a8w8_blockscale_bpreshuffle_1x128x128_256x32x128x256_16x16_16x16_16x16x1_16x16x1_1x32x1x8_8_2x1_intrawave_v1,658.64,711.27,0.0
gfx950,256,1792,768,7168,ck,11,0,29.2369,a8w8_blockscale_bpreshuffle_1x128x128_256x32x128x256_16x16_16x16_16x16x1_16x16x1_1x32x1x8_8_2x1_intrawave_v1,674.83,721.78,0.0
gfx950,256,1856,768,7168,ck,17,0,29.5228,a8w8_blockscale_bpreshuffle_1x128x128_256x64x64x256_16x16_16x16_16x16x1_16x16x1_1x32x1x8_8_2x1_intrawave_v1,692.17,733.66,0.0
gfx950,256,1920,768,7168,asm,1,1,29.8089,_ZN5aiter42fp8gemm_bf16_blockscale_BpreShuffle_48x128E,709.16,745.3,0.0
gfx950,256,1984,768,7168,asm,1,1,30.0462,_ZN5aiter42fp8gemm_bf16_blockscale_BpreShuffle_48x128E,727.01,757.96,0.0
gfx950,256,2048,768,7168,asm,2,1,30.9433,_ZN5aiter42fp8gemm_bf16_blockscale_BpreShuffle_64x128E,728.71,753.99,0.0
gfx950,256,4096,768,7168,ck,14,0,44.8557,a8w8_blockscale_bpreshuffle_1x128x128_256x64x128x128_16x16_16x16_8x32x1_8x32x1_1x32x1x8_8_2x1_intrawave_v1,1005.38,917.53,0.0001
gfx950,256,6144,768,7168,ck,14,0,61.348,a8w8_blockscale_bpreshuffle_1x128x128_256x64x128x128_16x16_16x16_8x32x1_8x32x1_1x32x1x8_8_2x1_intrawave_v1,1102.66,961.44,0.0001
gfx950,256,8192,768,7168,ck,14,0,70.1503,a8w8_blockscale_bpreshuffle_1x128x128_256x64x128x128_16x16_16x16_8x32x1_8x32x1_1x32x1x8_8_2x1_intrawave_v1,1285.73,1094.91,0.0002
gfx950,256,10240,768,7168,ck,13,1,76.7087,a8w8_blockscale_bpreshuffle_1x128x128_256x64x256x128_16x16_16x16_8x32x1_8x32x1_1x32x1x8_8_2x1_intrawave_v1,1469.75,1233.68,0.0
gfx950,256,12288,768,7168,cktile,29,0,91.8604,a8w8_blockscale_cktile_192x256x128_4x2x1_16x16x128_intrawave_0x1x0_4,1472.79,1224.25,0.0
gfx950,256,14336,768,7168,cktile,28,0,94.252,a8w8_blockscale_cktile_192x256x128_4x2x1_16x16x128_intrawave_0x1x0_3,1674.66,1382.31,0.0
gfx950,256,16384,768,7168,ck,13,2,117.3184,a8w8_blockscale_bpreshuffle_1x128x128_256x64x256x128_16x16_16x16_8x32x1_8x32x1_1x32x1x8_8_2x1_intrawave_v1,1537.6,1262.47,0.0
gfx950,256,32768,768,7168,ck,13,2,216.586,a8w8_blockscale_bpreshuffle_1x128x128_256x64x256x128_16x16_16x16_8x32x1_8x32x1_1x32x1x8_8_2x1_intrawave_v1,1665.75,1342.27,0.0
gfx950,256,1,2048,7168,asm,22,7,8.6312,_ZN5aiter42fp8gemm_bf16_blockscale_BpreShuffle_64x128E,3.4,1702.12,0.0107
gfx950,256,2,2048,7168,asm,23,8,10.1745,_ZN5aiter42fp8gemm_bf16_blockscale_BpreShuffle_64x128E,5.77,1445.04,0.0134
gfx950,256,4,2048,7168,asm,7,8,10.9339,_ZN5aiter42fp8gemm_bf16_blockscale_BpreShuffle_32x128E,10.74,1346.74,0.0077
gfx950,256,8,2048,7168,asm,31,8,9.1144,_ZN5aiter42fp8gemm_bf16_blockscale_BpreShuffle_80x128E,25.77,1620.53,0.007
gfx950,256,16,2048,7168,asm,15,8,9.4925,_ZN5aiter42fp8gemm_bf16_blockscale_BpreShuffle_48x128E,49.49,1565.48,0.0073
gfx950,256,32,2048,7168,asm,39,8,10.021,_ZN5aiter42fp8gemm_bf16_blockscale_BpreShuffle_96x128E,93.76,1500.9,0.0105
gfx950,256,48,2048,7168,asm,7,8,9.2481,_ZN5aiter42fp8gemm_bf16_blockscale_BpreShuffle_32x128E,152.39,1645.82,0.009
gfx950,256,64,2048,7168,asm,6,7,8.888,_ZN5aiter42fp8gemm_bf16_blockscale_BpreShuffle_32x128E,211.41,1732.78,0.006
gfx950,256,80,2048,7168,asm,12,5,11.3253,_ZN5aiter42fp8gemm_bf16_blockscale_BpreShuffle_48x128E,207.39,1375.79,0.0023
gfx950,256,96,2048,7168,asm,15,8,10.2348,_ZN5aiter42fp8gemm_bf16_blockscale_BpreShuffle_48x128E,275.39,1539.98,0.008
gfx950,256,112,2048,7168,asm,22,7,11.0851,_ZN5aiter42fp8gemm_bf16_blockscale_BpreShuffle_64x128E,296.64,1438.11,0.0064
gfx950,256,128,2048,7168,ck,7,0,16.9241,a8w8_blockscale_bpreshuffle_1x128x128_256x16x64x256_16x16_16x16_16x16x1_16x16x1_1x16x1x16_4_1x1_intrawave_v1,222.06,952.6,0.0
gfx950,256,144,2048,7168,ck,7,0,17.5557,a8w8_blockscale_bpreshuffle_1x128x128_256x16x64x256_16x16_16x16_16x16x1_16x16x1_1x16x1x16_4_1x1_intrawave_v1,240.83,928.59,0.0
gfx950,256,160,2048,7168,ck,12,0,18.3143,a8w8_blockscale_bpreshuffle_1x128x128_256x32x64x256_16x16_16x16_16x16x1_16x16x1_1x32x1x8_8_2x1_intrawave_v1,256.5,899.97,0.0
gfx950,256,176,2048,7168,ck,7,0,19.3451,a8w8_blockscale_bpreshuffle_1x128x128_256x16x64x256_16x16_16x16_16x16x1_16x16x1_1x16x1x16_4_1x1_intrawave_v1,267.12,861.33,0.0
gfx950,256,192,2048,7168,ck,7,0,18.0822,a8w8_blockscale_bpreshuffle_1x128x128_256x16x64x256_16x16_16x16_16x16x1_16x16x1_1x16x1x16_4_1x1_intrawave_v1,311.75,931.45,0.0
gfx950,256,208,2048,7168,ck,7,0,19.7053,a8w8_blockscale_bpreshuffle_1x128x128_256x16x64x256_16x16_16x16_16x16x1_16x16x1_1x16x1x16_4_1x1_intrawave_v1,309.91,863.88,0.0
gfx950,256,224,2048,7168,ck,12,0,18.2391,a8w8_blockscale_bpreshuffle_1x128x128_256x32x64x256_16x16_16x16_16x16x1_16x16x1_1x32x1x8_8_2x1_intrawave_v1,360.58,943.2,0.0
gfx950,256,240,2048,7168,ck,7,0,20.1157,a8w8_blockscale_bpreshuffle_1x128x128_256x16x64x256_16x16_16x16_16x16x1_16x16x1_1x16x1x16_4_1x1_intrawave_v1,350.3,864.17,0.0
gfx950,256,256,2048,7168,ck,12,0,18.1473,a8w8_blockscale_bpreshuffle_1x128x128_256x32x64x256_16x16_16x16_16x16x1_16x16x1_1x32x1x8_8_2x1_intrawave_v1,414.18,967.84,0.0
gfx950,256,288,2048,7168,ck,12,0,19.7809,a8w8_blockscale_bpreshuffle_1x128x128_256x32x64x256_16x16_16x16_16x16x1_16x16x1_1x32x1x8_8_2x1_intrawave_v1,427.47,906.13,0.0
gfx950,256,320,2048,7168,ck,17,0,21.2286,a8w8_blockscale_bpreshuffle_1x128x128_256x64x64x256_16x16_16x16_16x16x1_16x16x1_1x32x1x8_8_2x1_intrawave_v1,442.57,861.32,0.0
gfx950,256,352,2048,7168,asm,26,3,17.261,_ZN5aiter42fp8gemm_bf16_blockscale_BpreShuffle_80x128E,598.74,1080.18,0.0004
gfx950,256,384,2048,7168,ck,12,0,20.0287,a8w8_blockscale_bpreshuffle_1x128x128_256x32x64x256_16x16_16x16_16x16x1_16x16x1_1x32x1x8_8_2x1_intrawave_v1,562.91,948.91,0.0
gfx950,256,416,2048,7168,asm,34,3,21.9182,_ZN5aiter42fp8gemm_bf16_blockscale_BpreShuffle_96x128E,557.25,883.55,0.0004
gfx950,256,448,2048,7168,ck,17,0,21.426,a8w8_blockscale_bpreshuffle_1x128x128_256x64x64x256_16x16_16x16_16x16x1_16x16x1_1x32x1x8_8_2x1_intrawave_v1,613.9,920.67,0.0
gfx950,256,480,2048,7168,asm,17,2,20.811,_ZN5aiter42fp8gemm_bf16_blockscale_BpreShuffle_64x128E,677.18,965.2,0.0
gfx950,256,512,2048,7168,ck,17,0,21.5277,a8w8_blockscale_bpreshuffle_1x128x128_256x64x64x256_16x16_16x16_16x16x1_16x16x1_1x32x1x8_8_2x1_intrawave_v1,698.28,949.81,0.0
gfx950,256,544,2048,7168,asm,1,1,28.3354,_ZN5aiter42fp8gemm_bf16_blockscale_BpreShuffle_48x128E,563.67,734.34,0.0
gfx950,256,576,2048,7168,asm,1,1,28.1725,_ZN5aiter42fp8gemm_bf16_blockscale_BpreShuffle_48x128E,600.28,751.38,0.0
gfx950,256,608,2048,7168,asm,1,1,28.4078,_ZN5aiter42fp8gemm_bf16_blockscale_BpreShuffle_48x128E,628.38,757.84,0.0
gfx950,256,640,2048,7168,asm,1,1,28.3564,_ZN5aiter42fp8gemm_bf16_blockscale_BpreShuffle_48x128E,662.65,771.93,0.0
gfx950,256,672,2048,7168,asm,1,1,28.8011,_ZN5aiter42fp8gemm_bf16_blockscale_BpreShuffle_48x128E,685.04,772.52,0.0
gfx950,256,704,2048,7168,asm,1,1,28.6853,_ZN5aiter42fp8gemm_bf16_blockscale_BpreShuffle_48x128E,720.56,788.21,0.0
gfx950,256,736,2048,7168,asm,1,1,29.6191,_ZN5aiter42fp8gemm_bf16_blockscale_BpreShuffle_48x128E,729.56,775.53,0.0
gfx950,256,768,2048,7168,asm,1,1,29.2753,_ZN5aiter42fp8gemm_bf16_blockscale_BpreShuffle_48x128E,770.23,796.95,0.0
gfx950,256,800,2048,7168,asm,2,1,29.7216,_ZN5aiter42fp8gemm_bf16_blockscale_BpreShuffle_64x128E,790.27,797.11,0.0
gfx950,256,832,2048,7168,asm,2,1,30.5083,_ZN5aiter42fp8gemm_bf16_blockscale_BpreShuffle_64x128E,800.69,788.37,0.0
gfx950,256,864,2048,7168,asm,2,1,30.518,_ZN5aiter42fp8gemm_bf16_blockscale_BpreShuffle_64x128E,831.22,799.93,0.0
gfx950,256,896,2048,7168,asm,2,1,30.6425,_ZN5aiter42fp8gemm_bf16_blockscale_BpreShuffle_64x128E,858.5,808.44,0.0
gfx950,256,928,2048,7168,asm,2,1,31.6357,_ZN5aiter42fp8gemm_bf16_blockscale_BpreShuffle_64x128E,861.25,794.45,0.0
gfx950,256,960,2048,7168,asm,2,1,31.0177,_ZN5aiter42fp8gemm_bf16_blockscale_BpreShuffle_64x128E,908.7,821.9,0.0
gfx950,256,992,2048,7168,asm,2,1,31.4917,_ZN5aiter42fp8gemm_bf16_blockscale_BpreShuffle_64x128E,924.85,820.98,0.0
gfx950,256,1024,2048,7168,asm,2,1,32.0753,_ZN5aiter42fp8gemm_bf16_blockscale_BpreShuffle_64x128E,937.32,817.28,0.0
gfx950,256,1088,2048,7168,asm,3,1,33.9358,_ZN5aiter42fp8gemm_bf16_blockscale_BpreShuffle_80x128E,941.3,793.71,0.0
gfx950,256,1152,2048,7168,asm,3,1,34.5233,_ZN5aiter42fp8gemm_bf16_blockscale_BpreShuffle_80x128E,979.71,801.09,0.0
gfx950,256,1216,2048,7168,asm,3,1,35.2966,_ZN5aiter42fp8gemm_bf16_blockscale_BpreShuffle_80x128E,1011.48,803.96,0.0
gfx950,256,1280,2048,7168,asm,3,1,35.5694,_ZN5aiter42fp8gemm_bf16_blockscale_BpreShuffle_80x128E,1056.55,818.06,0.0
gfx950,256,1344,2048,7168,asm,4,1,38.7934,_ZN5aiter42fp8gemm_bf16_blockscale_BpreShuffle_96x128E,1017.18,768.66,0.0
gfx950,256,1408,2048,7168,asm,4,1,40.4834,_ZN5aiter42fp8gemm_bf16_blockscale_BpreShuffle_96x128E,1021.14,754.38,0.0
gfx950,256,1472,2048,7168,asm,4,1,40.8826,_ZN5aiter42fp8gemm_bf16_blockscale_BpreShuffle_96x128E,1057.13,764.64,0.0
gfx950,256,1536,2048,7168,asm,4,1,40.293,_ZN5aiter42fp8gemm_bf16_blockscale_BpreShuffle_96x128E,1119.23,793.73,0.0
gfx950,256,1600,2048,7168,ck,14,0,45.3446,a8w8_blockscale_bpreshuffle_1x128x128_256x64x128x128_16x16_16x16_8x32x1_8x32x1_1x32x1x8_8_2x1_intrawave_v1,1035.98,721.2,0.0001
gfx950,256,1664,2048,7168,ck,14,0,45.6554,a8w8_blockscale_bpreshuffle_1x128x128_256x64x128x128_16x16_16x16_8x32x1_8x32x1_1x32x1x8_8_2x1_intrawave_v1,1070.09,732.08,0.0001
gfx950,256,1728,2048,7168,ck,14,0,44.3914,a8w8_blockscale_bpreshuffle_1x128x128_256x64x128x128_16x16_16x16_8x32x1_8x32x1_1x32x1x8_8_2x1_intrawave_v1,1142.89,769.16,0.0001
gfx950,256,1792,2048,7168,ck,14,0,45.0226,a8w8_blockscale_bpreshuffle_1x128x128_256x64x128x128_16x16_16x16_8x32x1_8x32x1_1x32x1x8_8_2x1_intrawave_v1,1168.6,774.39,0.0001
gfx950,256,1856,2048,7168,asm,5,1,48.5511,_ZN5aiter43fp8gemm_bf16_blockscale_BpreShuffle_128x128E,1122.37,732.96,0.0
gfx950,256,1920,2048,7168,ck,14,0,48.5047,a8w8_blockscale_bpreshuffle_1x128x128_256x64x128x128_16x16_16x16_8x32x1_8x32x1_1x32x1x8_8_2x1_intrawave_v1,1162.19,748.52,0.0001
gfx950,256,1984,2048,7168,asm,5,1,49.7611,_ZN5aiter43fp8gemm_bf16_blockscale_BpreShuffle_128x128E,1170.6,744.11,0.0
gfx950,256,2048,2048,7168,ck,13,0,50.1298,a8w8_blockscale_bpreshuffle_1x128x128_256x64x256x128_16x16_16x16_8x32x1_8x32x1_1x32x1x8_8_2x1_intrawave_v1,1199.48,753.02,0.0
gfx950,256,4096,2048,7168,ck,13,0,79.0202,a8w8_blockscale_bpreshuffle_1x128x128_256x64x256x128_16x16_16x16_8x32x1_8x32x1_1x32x1x8_8_2x1_intrawave_v1,1521.88,769.64,0.0
gfx950,256,6144,2048,7168,cktile,29,0,95.4626,a8w8_blockscale_cktile_192x256x128_4x2x1_16x16x128_intrawave_0x1x0_4,1889.63,878.73,0.0
gfx950,256,8192,2048,7168,ck,13,0,145.3655,a8w8_blockscale_bpreshuffle_1x128x128_256x64x256x128_16x16_16x16_8x32x1_8x32x1_1x32x1x8_8_2x1_intrawave_v1,1654.58,735.76,0.0
gfx950,256,10240,2048,7168,cktile,28,0,176.7076,a8w8_blockscale_cktile_192x256x128_4x2x1_16x16x128_intrawave_0x1x0_3,1701.39,735.81,0.0
gfx950,256,12288,2048,7168,cktile,27,0,184.0324,a8w8_blockscale_cktile_192x256x128_4x2x1_16x16x128_intrawave_0x1x0_2,1960.4,831.88,0.0
gfx950,256,14336,2048,7168,ck,13,0,240.0047,a8w8_blockscale_bpreshuffle_1x128x128_256x64x256x128_16x16_16x16_8x32x1_8x32x1_1x32x1x8_8_2x1_intrawave_v1,1753.74,733.99,0.0
gfx950,256,16384,2048,7168,cktile,28,0,263.6644,a8w8_blockscale_cktile_192x256x128_4x2x1_16x16x128_intrawave_0x1x0_3,1824.43,755.62,0.0
gfx950,256,32768,2048,7168,cktile,11,0,521.6939,a8w8_blockscale_cktile_192x256x128_4x2x1_16x16x128_intrawave_0x1x0_1,1844.13,735.64,0.0
gfx950,256,1,6144,7168,asm,4,5,12.1066,_ZN5aiter42fp8gemm_bf16_blockscale_BpreShuffle_32x128E,7.28,3639.31,0.0052
gfx950,256,2,6144,7168,asm,4,5,13.6415,_ZN5aiter42fp8gemm_bf16_blockscale_BpreShuffle_32x128E,12.91,3231.25,0.004
gfx950,256,4,6144,7168,asm,19,4,13.2827,_ZN5aiter42fp8gemm_bf16_blockscale_BpreShuffle_64x128E,26.52,3321.46,0.0016
gfx950,256,8,6144,7168,asm,4,5,14.1563,_ZN5aiter42fp8gemm_bf16_blockscale_BpreShuffle_32x128E,49.78,3121.99,0.0022
gfx950,256,16,6144,7168,asm,3,4,13.7668,_ZN5aiter42fp8gemm_bf16_blockscale_BpreShuffle_32x128E,102.37,3221.63,0.002
gfx950,256,32,6144,7168,asm,12,5,14.8058,_ZN5aiter42fp8gemm_bf16_blockscale_BpreShuffle_48x128E,190.37,3016.57,0.0024
gfx950,256,48,6144,7168,asm,36,5,16.0527,_ZN5aiter42fp8gemm_bf16_blockscale_BpreShuffle_96x128E,263.37,2801.65,0.0027
gfx950,256,64,6144,7168,asm,20,5,14.9877,_ZN5aiter42fp8gemm_bf16_blockscale_BpreShuffle_64x128E,376.12,3021.5,0.0027
gfx950,256,80,6144,7168,asm,27,4,17.9025,_ZN5aiter42fp8gemm_bf16_blockscale_BpreShuffle_80x128E,393.6,2546.94,0.0016
gfx950,256,96,6144,7168,asm,36,5,19.9946,_ZN5aiter42fp8gemm_bf16_blockscale_BpreShuffle_96x128E,422.9,2296.02,0.0026
gfx950,256,112,6144,7168,asm,20,5,21.3762,_ZN5aiter42fp8gemm_bf16_blockscale_BpreShuffle_64x128E,461.49,2162.18,0.0027
gfx950,256,128,6144,7168,asm,44,5,19.1896,_ZN5aiter43fp8gemm_bf16_blockscale_BpreShuffle_128x128E,587.52,2424.78,0.0027
gfx950,256,144,6144,7168,asm,25,2,24.0492,_ZN5aiter42fp8gemm_bf16_blockscale_BpreShuffle_80x128E,527.4,1947.75,0.0
gfx950,256,160,6144,7168,ck,11,0,24.717,a8w8_blockscale_bpreshuffle_1x128x128_256x32x128x256_16x16_16x16_16x16x1_16x16x1_1x32x1x8_8_2x1_intrawave_v1,570.17,1907.72,0.0
gfx950,256,176,6144,7168,asm,33,2,27.3793,_ZN5aiter42fp8gemm_bf16_blockscale_BpreShuffle_96x128E,566.2,1733.59,0.0
gfx950,256,192,6144,7168,asm,33,2,27.5859,_ZN5aiter42fp8gemm_bf16_blockscale_BpreShuffle_96x128E,613.05,1731.89,0.0
gfx950,256,208,6144,7168,asm,8,1,28.5755,_ZN5aiter42fp8gemm_bf16_blockscale_BpreShuffle_48x128E,641.13,1682.81,0.0
gfx950,256,224,6144,7168,asm,8,1,28.7748,_ZN5aiter42fp8gemm_bf16_blockscale_BpreShuffle_48x128E,685.67,1681.97,0.0
gfx950,256,240,6144,7168,asm,8,1,29.296,_ZN5aiter42fp8gemm_bf16_blockscale_BpreShuffle_48x128E,721.58,1662.67,0.0
gfx950,256,256,6144,7168,asm,16,1,30.6157,_ZN5aiter42fp8gemm_bf16_blockscale_BpreShuffle_64x128E,736.5,1601.17,0.0
gfx950,256,288,6144,7168,asm,16,1,31.3014,_ZN5aiter42fp8gemm_bf16_blockscale_BpreShuffle_64x128E,810.42,1585.98,0.0
gfx950,256,320,6144,7168,asm,16,1,31.8919,_ZN5aiter42fp8gemm_bf16_blockscale_BpreShuffle_64x128E,883.79,1576.14,0.0
gfx950,256,352,6144,7168,asm,24,1,34.4828,_ZN5aiter42fp8gemm_bf16_blockscale_BpreShuffle_80x128E,899.12,1475.77,0.0
gfx950,256,384,6144,7168,asm,24,1,34.5225,_ZN5aiter42fp8gemm_bf16_blockscale_BpreShuffle_80x128E,979.73,1492.11,0.0
gfx950,256,416,6144,7168,asm,32,1,39.9528,_ZN5aiter42fp8gemm_bf16_blockscale_BpreShuffle_96x128E,917.12,1304.89,0.0
gfx950,256,448,6144,7168,asm,32,1,38.5212,_ZN5aiter42fp8gemm_bf16_blockscale_BpreShuffle_96x128E,1024.37,1369.54,0.0
gfx950,256,480,6144,7168,asm,32,1,41.5772,_ZN5aiter42fp8gemm_bf16_blockscale_BpreShuffle_96x128E,1016.87,1283.85,0.0
gfx950,256,512,6144,7168,ck,14,0,47.3122,a8w8_blockscale_bpreshuffle_1x128x128_256x64x128x128_16x16_16x16_8x32x1_8x32x1_1x32x1x8_8_2x1_intrawave_v1,953.18,1141.39,0.0001
gfx950,256,544,6144,7168,asm,40,1,48.086,_ZN5aiter43fp8gemm_bf16_blockscale_BpreShuffle_128x128E,996.46,1135.97,0.0
gfx950,256,576,6144,7168,ck,14,0,48.4454,a8w8_blockscale_bpreshuffle_1x128x128_256x64x128x128_16x16_16x16_8x32x1_8x32x1_1x32x1x8_8_2x1_intrawave_v1,1047.25,1140.39,0.0001
gfx950,256,608,6144,7168,ck,14,0,50.0905,a8w8_blockscale_bpreshuffle_1x128x128_256x64x128x128_16x16_16x16_8x32x1_8x32x1_1x32x1x8_8_2x1_intrawave_v1,1069.12,1115.37,0.0001
gfx950,256,640,6144,7168,asm,40,1,49.8385,_ZN5aiter43fp8gemm_bf16_blockscale_BpreShuffle_128x128E,1131.08,1133.5,0.0
gfx950,256,672,6144,7168,ck,13,0,61.9257,a8w8_blockscale_bpreshuffle_1x128x128_256x64x256x128_16x16_16x16_8x32x1_8x32x1_1x32x1x8_8_2x1_intrawave_v1,955.82,922.31,0.0
gfx950,256,704,6144,7168,ck,13,0,61.0642,a8w8_blockscale_bpreshuffle_1x128x128_256x64x256x128_16x16_16x16_8x32x1_8x32x1_1x32x1x8_8_2x1_intrawave_v1,1015.47,945.52,0.0
gfx950,256,736,6144,7168,ck,13,0,62.3918,a8w8_blockscale_bpreshuffle_1x128x128_256x64x256x128_16x16_16x16_8x32x1_8x32x1_1x32x1x8_8_2x1_intrawave_v1,1039.03,935.38,0.0
gfx950,256,768,6144,7168,ck,13,0,61.7775,a8w8_blockscale_bpreshuffle_1x128x128_256x64x256x128_16x16_16x16_8x32x1_8x32x1_1x32x1x8_8_2x1_intrawave_v1,1094.99,954.76,0.0
gfx950,256,800,6144,7168,ck,13,0,66.1904,a8w8_blockscale_bpreshuffle_1x128x128_256x64x256x128_16x16_16x16_8x32x1_8x32x1_1x32x1x8_8_2x1_intrawave_v1,1064.57,900.51,0.0
gfx950,256,832,6144,7168,ck,13,0,67.0061,a8w8_blockscale_bpreshuffle_1x128x128_256x64x256x128_16x16_16x16_8x32x1_8x32x1_1x32x1x8_8_2x1_intrawave_v1,1093.67,898.84,0.0
gfx950,256,864,6144,7168,ck,13,0,65.6668,a8w8_blockscale_bpreshuffle_1x128x128_256x64x256x128_16x16_16x16_8x32x1_8x32x1_1x32x1x8_8_2x1_intrawave_v1,1158.9,926.65,0.0
gfx950,256,896,6144,7168,ck,13,0,64.0993,a8w8_blockscale_bpreshuffle_1x128x128_256x64x256x128_16x16_16x16_8x32x1_8x32x1_1x32x1x8_8_2x1_intrawave_v1,1231.22,959.02,0.0
gfx950,256,928,6144,7168,ck,14,0,70.3214,a8w8_blockscale_bpreshuffle_1x128x128_256x64x128x128_16x16_16x16_8x32x1_8x32x1_1x32x1x8_8_2x1_intrawave_v1,1162.36,883.02,0.0001
gfx950,256,960,6144,7168,ck,14,0,71.9294,a8w8_blockscale_bpreshuffle_1x128x128_256x64x128x128_16x16_16x16_8x32x1_8x32x1_1x32x1x8_8_2x1_intrawave_v1,1175.56,871.94,0.0002
gfx950,256,992,6144,7168,ck,14,0,72.1971,a8w8_blockscale_bpreshuffle_1x128x128_256x64x128x128_16x16_16x16_8x32x1_8x32x1_1x32x1x8_8_2x1_intrawave_v1,1210.24,877.33,0.0001
gfx950,256,1024,6144,7168,ck,13,0,73.7129,a8w8_blockscale_bpreshuffle_1x128x128_256x64x256x128_16x16_16x16_8x32x1_8x32x1_1x32x1x8_8_2x1_intrawave_v1,1223.59,867.73,0.0
gfx950,256,1088,6144,7168,ck,13,0,76.2455,a8w8_blockscale_bpreshuffle_1x128x128_256x64x256x128_16x16_16x16_8x32x1_8x32x1_1x32x1x8_8_2x1_intrawave_v1,1256.88,855.24,0.0
gfx950,256,1152,6144,7168,ck,13,0,76.1546,a8w8_blockscale_bpreshuffle_1x128x128_256x64x256x128_16x16_16x16_8x32x1_8x32x1_1x32x1x8_8_2x1_intrawave_v1,1332.4,872.61,0.0
gfx950,256,1216,6144,7168,ck,13,0,79.511,a8w8_blockscale_bpreshuffle_1x128x128_256x64x256x128_16x16_16x16_8x32x1_8x32x1_1x32x1x8_8_2x1_intrawave_v1,1347.06,851.44,0.0
gfx950,256,1280,6144,7168,ck,13,0,77.2334,a8w8_blockscale_bpreshuffle_1x128x128_256x64x256x128_16x16_16x16_8x32x1_8x32x1_1x32x1x8_8_2x1_intrawave_v1,1459.77,892.67,0.0
gfx950,256,1344,6144,7168,ck,13,0,82.2982,a8w8_blockscale_bpreshuffle_1x128x128_256x64x256x128_16x16_16x16_8x32x1_8x32x1_1x32x1x8_8_2x1_intrawave_v1,1438.43,852.86,0.0
gfx950,256,1408,6144,7168,cktile,28,0,87.0945,a8w8_blockscale_cktile_192x256x128_4x2x1_16x16x128_intrawave_0x1x0_3,1423.94,820.19,0.0
gfx950,256,1472,6144,7168,cktile,29,0,87.2862,a8w8_blockscale_cktile_192x256x128_4x2x1_16x16x128_intrawave_0x1x0_4,1485.39,832.66,0.0
gfx950,256,1536,6144,7168,cktile,29,0,87.2706,a8w8_blockscale_cktile_192x256x128_4x2x1_16x16x128_intrawave_0x1x0_4,1550.25,847.07,0.0
gfx950,256,1600,6144,7168,cktile,11,0,88.2254,a8w8_blockscale_cktile_192x256x128_4x2x1_16x16x128_intrawave_0x1x0_1,1597.37,852.02,0.0
gfx950,256,1664,6144,7168,cktile,11,0,88.895,a8w8_blockscale_cktile_192x256x128_4x2x1_16x16x128_intrawave_0x1x0_1,1648.75,859.61,0.0
gfx950,256,1728,6144,7168,cktile,29,0,89.5599,a8w8_blockscale_cktile_192x256x128_4x2x1_16x16x128_intrawave_0x1x0_4,1699.45,867.13,0.0
gfx950,256,1792,6144,7168,cktile,27,0,90.2277,a8w8_blockscale_cktile_192x256x128_4x2x1_16x16x128_intrawave_0x1x0_2,1749.35,874.51,0.0
gfx950,256,1856,6144,7168,cktile,11,0,91.1191,a8w8_blockscale_cktile_192x256x128_4x2x1_16x16x128_intrawave_0x1x0_1,1794.1,879.62,0.0
gfx950,256,1920,6144,7168,cktile,28,0,90.924,a8w8_blockscale_cktile_192x256x128_4x2x1_16x16x128_intrawave_0x1x0_3,1859.95,895.21,0.0
gfx950,256,1984,6144,7168,ck,13,0,121.8121,a8w8_blockscale_bpreshuffle_1x128x128_256x64x256x128_16x16_16x16_8x32x1_8x32x1_1x32x1x8_8_2x1_intrawave_v1,1434.6,678.43,0.0
gfx950,256,2048,6144,7168,ck,13,0,121.1249,a8w8_blockscale_bpreshuffle_1x128x128_256x64x256x128_16x16_16x16_8x32x1_8x32x1_1x32x1x8_8_2x1_intrawave_v1,1489.28,692.56,0.0
gfx950,256,4096,6144,7168,ck,13,0,208.2576,a8w8_blockscale_bpreshuffle_1x128x128_256x64x256x128_16x16_16x16_8x32x1_8x32x1_1x32x1x8_8_2x1_intrawave_v1,1732.36,594.13,0.0
gfx950,256,6144,6144,7168,cktile,28,0,261.7996,a8w8_blockscale_cktile_192x256x128_4x2x1_16x16x128_intrawave_0x1x0_3,2067.1,624.82,0.0
gfx950,256,8192,6144,7168,cktile,29,0,363.7742,a8w8_blockscale_cktile_192x256x128_4x2x1_16x16x128_intrawave_0x1x0_4,1983.52,559.2,0.0
gfx950,256,10240,6144,7168,cktile,28,0,450.2533,a8w8_blockscale_cktile_192x256x128_4x2x1_16x16x128_intrawave_0x1x0_3,2003.19,540.3,0.0
gfx950,256,12288,6144,7168,cktile,29,0,514.1811,a8w8_blockscale_cktile_192x256x128_4x2x1_16x16x128_intrawave_0x1x0_4,2104.96,550.61,0.0
gfx950,256,14336,6144,7168,cktile,27,0,602.1856,a8w8_blockscale_cktile_192x256x128_4x2x1_16x16x128_intrawave_0x1x0_2,2096.9,536.32,0.0
gfx950,256,16384,6144,7168,cktile,27,0,685.7402,a8w8_blockscale_cktile_192x256x128_4x2x1_16x16x128_intrawave_0x1x0_2,2104.45,529.07,0.0
gfx950,256,20480,6144,7168,cktile,28,0,855.8253,a8w8_blockscale_cktile_192x256x128_4x2x1_16x16x128_intrawave_0x1x0_3,2107.77,517.04,0.0
gfx950,256,24576,6144,7168,cktile,11,0,1029.0566,a8w8_blockscale_cktile_192x256x128_4x2x1_16x16x128_intrawave_0x1x0_1,2103.54,507.45,0.0
gfx950,256,28672,6144,7168,cktile,28,0,1195.3275,a8w8_blockscale_cktile_192x256x128_4x2x1_16x16x128_intrawave_0x1x0_3,2112.76,503.53,0.0
gfx950,256,32768,6144,7168,cktile,11,0,1368.1245,a8w8_blockscale_cktile_192x256x128_4x2x1_16x16x128_intrawave_0x1x0_1,2109.62,498.18,0.0
gfx950,256,40960,6144,7168,cktile,11,0,1709.468,a8w8_blockscale_cktile_192x256x128_4x2x1_16x16x128_intrawave_0x1x0_1,2110.47,491.94,0.0
gfx950,256,49152,6144,7168,cktile,27,0,2053.1356,a8w8_blockscale_cktile_192x256x128_4x2x1_16x16x128_intrawave_0x1x0_2,2108.64,487.23,0.0
gfx950,256,57344,6144,7168,cktile,27,0,2389.4546,a8w8_blockscale_cktile_192x256x128_4x2x1_16x16x128_intrawave_0x1x0_2,2113.82,485.35,0.0
gfx950,256,65536,6144,7168,cktile,29,0,2727.8049,a8w8_blockscale_cktile_192x256x128_4x2x1_16x16x128_intrawave_0x1x0_4,2116.15,483.58,0.0
gfx950,256,1,7168,384,ck,10,0,4.4519,a8w8_blockscale_bpreshuffle_1x128x128_256x32x64x128_16x16_16x16_8x32x1_8x32x1_1x32x1x8_8_2x1_intrawave_v1,1.24,621.58,0.0
gfx950,256,1,7168,3072,asm,2,3,8.0549,_ZN5aiter42fp8gemm_bf16_blockscale_BpreShuffle_32x128E,5.47,2735.91,0.0
gfx950,256,1,7168,7168,ck,7,0,21.0136,a8w8_blockscale_bpreshuffle_1x128x128_256x16x64x256_16x16_16x16_16x16x1_16x16x1_1x16x1x16_4_1x1_intrawave_v1,4.89,2446.12,0.0
gfx950,256,1,7168,16384,asm,10,3,28.3454,_ZN5aiter42fp8gemm_bf16_blockscale_BpreShuffle_48x128E,8.29,4144.28,0.0017
gfx950,256,2,7168,384,ck,5,0,4.9124,a8w8_blockscale_bpreshuffle_1x128x128_256x16x64x128_8x16_16x16_16x16x1_8x32x1_1x16x1x16_4_1x1_intrawave_v1,2.24,566.31,0.0
gfx950,256,2,7168,3072,asm,16,3,10.6149,_ZN5aiter42fp8gemm_bf16_blockscale_BpreShuffle_64x128E,8.3,2077.73,0.0
gfx950,256,2,7168,7168,ck,7,0,20.807,a8w8_blockscale_bpreshuffle_1x128x128_256x16x64x256_16x16_16x16_16x16x1_16x16x1_1x16x1x16_4_1x1_intrawave_v1,9.88,2471.44,0.0
gfx950,256,2,7168,16384,asm,23,8,26.7282,_ZN5aiter42fp8gemm_bf16_blockscale_BpreShuffle_64x128E,17.58,4396.18,0.0227
gfx950,256,4,7168,384,ck,5,0,4.3595,a8w8_blockscale_bpreshuffle_1x128x128_256x16x64x128_8x16_16x16_16x16x1_8x32x1_1x16x1x16_4_1x1_intrawave_v1,5.05,644.89,0.0
gfx950,256,4,7168,3072,asm,3,4,10.1661,_ZN5aiter42fp8gemm_bf16_blockscale_BpreShuffle_32x128E,17.33,2172.88,0.0
gfx950,256,4,7168,7168,ck,7,0,20.8785,a8w8_blockscale_bpreshuffle_1x128x128_256x16x64x256_16x16_16x16_16x16x1_16x16x1_1x16x1x16_4_1x1_intrawave_v1,19.69,2465.04,0.0
gfx950,256,4,7168,16384,asm,7,8,28.3487,_ZN5aiter42fp8gemm_bf16_blockscale_BpreShuffle_32x128E,33.14,4147.05,0.0259
gfx950,256,8,7168,384,ck,10,0,4.5093,a8w8_blockscale_bpreshuffle_1x128x128_256x32x64x128_16x16_16x16_8x32x1_8x32x1_1x32x1x8_8_2x1_intrawave_v1,9.77,636.52,0.0
gfx950,256,8,7168,3072,ck,7,0,10.1419,a8w8_blockscale_bpreshuffle_1x128x128_256x16x64x256_16x16_16x16_16x16x1_16x16x1_1x16x1x16_4_1x1_intrawave_v1,34.74,2184.93,0.0
gfx950,256,8,7168,7168,ck,7,0,20.9046,a8w8_blockscale_bpreshuffle_1x128x128_256x16x64x256_16x16_16x16_16x16x1_16x16x1_1x16x1x16_4_1x1_intrawave_v1,39.33,2466.07,0.0
gfx950,256,8,7168,16384,asm,7,8,28.7086,_ZN5aiter42fp8gemm_bf16_blockscale_BpreShuffle_32x128E,65.45,4099.34,0.0243
gfx950,256,16,7168,384,ck,5,0,4.9415,a8w8_blockscale_bpreshuffle_1x128x128_256x16x64x128_8x16_16x16_16x16x1_8x32x1_1x16x1x16_4_1x1_intrawave_v1,17.82,604.68,0.0
gfx950,256,16,7168,3072,ck,7,0,10.0172,a8w8_blockscale_bpreshuffle_1x128x128_256x16x64x256_16x16_16x16_16x16x1_16x16x1_1x16x1x16_4_1x1_intrawave_v1,70.34,2226.03,0.0
gfx950,256,16,7168,7168,ck,7,0,18.626,a8w8_blockscale_bpreshuffle_1x128x128_256x16x64x256_16x16_16x16_16x16x1_16x16x1_1x16x1x16_4_1x1_intrawave_v1,88.27,2776.99,0.0
gfx950,256,16,7168,16384,asm,7,8,28.9118,_ZN5aiter42fp8gemm_bf16_blockscale_BpreShuffle_32x128E,129.98,4079.03,0.0252
gfx950,256,32,7168,384,ck,10,0,4.5334,a8w8_blockscale_bpreshuffle_1x128x128_256x32x64x128_16x16_16x16_8x32x1_8x32x1_1x32x1x8_8_2x1_intrawave_v1,38.86,711.07,0.0
gfx950,256,32,7168,3072,ck,7,0,9.8372,a8w8_blockscale_bpreshuffle_1x128x128_256x16x64x256_16x16_16x16_16x16x1_16x16x1_1x16x1x16_4_1x1_intrawave_v1,143.26,2295.08,0.0
gfx950,256,32,7168,7168,ck,7,0,18.7345,a8w8_blockscale_bpreshuffle_1x128x128_256x16x64x256_16x16_16x16_16x16x1_16x16x1_1x16x1x16_4_1x1_intrawave_v1,175.52,2779.28,0.0
gfx950,256,32,7168,16384,asm,3,4,29.9553,_ZN5aiter42fp8gemm_bf16_blockscale_BpreShuffle_32x128E,250.91,3953.34,0.007
gfx950,256,48,7168,384,ck,5,0,4.7591,a8w8_blockscale_bpreshuffle_1x128x128_256x16x64x128_8x16_16x16_16x16x1_8x32x1_1x16x1x16_4_1x1_intrawave_v1,55.52,726.83,0.0
gfx950,256,48,7168,3072,ck,6,0,10.825,a8w8_blockscale_bpreshuffle_1x128x128_256x16x128x256_16x16_16x16_16x16x1_16x16x1_1x16x1x16_8_1x2_intrawave_v1,195.28,2111.38,0.0
gfx950,256,48,7168,7168,ck,6,0,21.4511,a8w8_blockscale_bpreshuffle_1x128x128_256x16x128x256_16x16_16x16_16x16x1_16x16x1_1x16x1x16_8_1x2_intrawave_v1,229.94,2443.34,0.0
gfx950,256,48,7168,16384,asm,11,4,30.5746,_ZN5aiter42fp8gemm_bf16_blockscale_BpreShuffle_48x128E,368.75,3889.34,0.0071
gfx950,256,64,7168,384,ck,10,0,4.7549,a8w8_blockscale_bpreshuffle_1x128x128_256x32x64x128_16x16_16x16_8x32x1_8x32x1_1x32x1x8_8_2x1_intrawave_v1,74.1,777.01,0.0
gfx950,256,64,7168,3072,ck,12,0,10.3433,a8w8_blockscale_bpreshuffle_1x128x128_256x32x64x256_16x16_16x16_16x16x1_16x16x1_1x32x1x8_8_2x1_intrawave_v1,272.5,2236.64,0.0
gfx950,256,64,7168,7168,ck,12,0,19.9679,a8w8_blockscale_bpreshuffle_1x128x128_256x32x64x256_16x16_16x16_16x16x1_16x16x1_1x32x1x8_8_2x1_intrawave_v1,329.36,2642.06,0.0
gfx950,256,64,7168,16384,asm,19,4,31.4726,_ZN5aiter42fp8gemm_bf16_blockscale_BpreShuffle_64x128E,477.63,3793.99,0.0077
gfx950,256,80,7168,384,ck,10,0,5.0686,a8w8_blockscale_bpreshuffle_1x128x128_256x32x64x128_16x16_16x16_8x32x1_8x32x1_1x32x1x8_8_2x1_intrawave_v1,86.89,775.38,0.0
gfx950,256,80,7168,3072,ck,17,0,12.1563,a8w8_blockscale_bpreshuffle_1x128x128_256x64x64x256_16x16_16x16_16x16x1_16x16x1_1x32x1x8_8_2x1_intrawave_v1,289.83,1925.98,0.0
gfx950,256,80,7168,7168,ck,17,0,23.5989,a8w8_blockscale_bpreshuffle_1x128x128_256x64x64x256_16x16_16x16_16x16x1_16x16x1_1x32x1x8_8_2x1_intrawave_v1,348.36,2250.13,0.0
gfx950,256,80,7168,16384,asm,27,4,32.6454,_ZN5aiter42fp8gemm_bf16_blockscale_BpreShuffle_80x128E,575.59,3672.74,0.0078
gfx950,256,96,7168,384,asm,0,1,5.3807,_ZN5aiter42fp8gemm_bf16_blockscale_BpreShuffle_32x128E,98.22,774.18,0.0
gfx950,256,96,7168,3072,ck,17,0,12.1977,a8w8_blockscale_bpreshuffle_1x128x128_256x64x64x256_16x16_16x16_16x16x1_16x16x1_1x32x1x8_8_2x1_intrawave_v1,346.61,1942.27,0.0
gfx950,256,96,7168,7168,ck,17,0,23.2427,a8w8_blockscale_bpreshuffle_1x128x128_256x64x64x256_16x16_16x16_16x16x1_16x16x1_1x32x1x8_8_2x1_intrawave_v1,424.43,2299.41,0.0
gfx950,256,96,7168,16384,asm,35,4,34.2026,_ZN5aiter42fp8gemm_bf16_blockscale_BpreShuffle_96x128E,659.27,3519.9,0.0077
gfx950,256,112,7168,384,ck,4,0,5.2778,a8w8_blockscale_bpreshuffle_1x128x128_256x16x128x128_8x16_16x16_16x16x1_8x32x1_1x16x1x16_8_1x2_intrawave_v1,116.82,833.9,0.0
gfx950,256,112,7168,3072,ck,17,0,12.1297,a8w8_blockscale_bpreshuffle_1x128x128_256x64x64x256_16x16_16x16_16x16x1_16x16x1_1x32x1x8_8_2x1_intrawave_v1,406.65,1976.12,0.0
gfx950,256,112,7168,7168,ck,17,0,23.798,a8w8_blockscale_bpreshuffle_1x128x128_256x64x64x256_16x16_16x16_16x16x1_16x16x1_1x32x1x8_8_2x1_intrawave_v1,483.62,2260.22,0.0
gfx950,256,112,7168,16384,asm,43,4,39.8582,_ZN5aiter43fp8gemm_bf16_blockscale_BpreShuffle_128x128E,660.01,3032.78,0.0075
gfx950,256,128,7168,384,ck,4,0,5.0215,a8w8_blockscale_bpreshuffle_1x128x128_256x16x128x128_8x16_16x16_16x16x1_8x32x1_1x16x1x16_8_1x2_intrawave_v1,140.33,923.36,0.0
gfx950,256,128,7168,3072,ck,17,0,12.0869,a8w8_blockscale_bpreshuffle_1x128x128_256x64x64x256_16x16_16x16_16x16x1_16x16x1_1x32x1x8_8_2x1_intrawave_v1,466.38,2006.17,0.0
gfx950,256,128,7168,7168,ck,17,0,22.9222,a8w8_blockscale_bpreshuffle_1x128x128_256x64x64x256_16x16_16x16_16x16x1_16x16x1_1x32x1x8_8_2x1_intrawave_v1,573.83,2361.59,0.0
gfx950,256,128,7168,16384,asm,43,4,39.6992,_ZN5aiter43fp8gemm_bf16_blockscale_BpreShuffle_128x128E,757.31,3057.31,0.0077
gfx950,256,144,7168,384,ck,4,0,5.2391,a8w8_blockscale_bpreshuffle_1x128x128_256x16x128x128_8x16_16x16_16x16x1_8x32x1_1x16x1x16_8_1x2_intrawave_v1,151.31,929.97,0.0
gfx950,256,144,7168,3072,asm,7,1,14.5281,_ZN5aiter42fp8gemm_bf16_blockscale_BpreShuffle_48x128E,436.52,1688.24,0.0
gfx950,256,144,7168,7168,asm,1,1,28.547,_ZN5aiter42fp8gemm_bf16_blockscale_BpreShuffle_48x128E,518.36,1908.32,0.0
gfx950,256,144,7168,16384,asm,25,2,44.2498,_ZN5aiter42fp8gemm_bf16_blockscale_BpreShuffle_80x128E,764.36,2754.01,0.0
gfx950,256,160,7168,384,ck,4,0,5.6828,a8w8_blockscale_bpreshuffle_1x128x128_256x16x128x128_8x16_16x16_16x16x1_8x32x1_1x16x1x16_8_1x2_intrawave_v1,154.99,898.8,0.0
gfx950,256,160,7168,3072,asm,7,1,14.7027,_ZN5aiter42fp8gemm_bf16_blockscale_BpreShuffle_48x128E,479.26,1687.13,0.0
gfx950,256,160,7168,7168,asm,1,1,29.0974,_ZN5aiter42fp8gemm_bf16_blockscale_BpreShuffle_48x128E,565.06,1884.05,0.0
gfx950,256,160,7168,16384,asm,25,2,44.5438,_ZN5aiter42fp8gemm_bf16_blockscale_BpreShuffle_80x128E,843.69,2746.86,0.0
gfx950,256,176,7168,384,ck,10,0,5.5692,a8w8_blockscale_bpreshuffle_1x128x128_256x32x64x128_16x16_16x16_8x32x1_8x32x1_1x32x1x8_8_2x1_intrawave_v1,173.97,959.43,0.0001
gfx950,256,176,7168,3072,asm,7,1,14.8842,_ZN5aiter42fp8gemm_bf16_blockscale_BpreShuffle_48x128E,520.76,1685.27,0.0
gfx950,256,176,7168,7168,asm,1,1,29.1359,_ZN5aiter42fp8gemm_bf16_blockscale_BpreShuffle_48x128E,620.74,1893.37,0.0
gfx950,256,176,7168,16384,asm,33,2,48.5542,_ZN5aiter42fp8gemm_bf16_blockscale_BpreShuffle_96x128E,851.4,2530.11,0.0
gfx950,256,192,7168,384,ck,10,0,5.583,a8w8_blockscale_bpreshuffle_1x128x128_256x32x64x128_16x16_16x16_8x32x1_8x32x1_1x32x1x8_8_2x1_intrawave_v1,189.32,999.24,0.0
gfx950,256,192,7168,3072,asm,7,1,14.6504,_ZN5aiter42fp8gemm_bf16_blockscale_BpreShuffle_48x128E,577.17,1731.18,0.0
gfx950,256,192,7168,7168,asm,1,1,29.4402,_ZN5aiter42fp8gemm_bf16_blockscale_BpreShuffle_48x128E,670.17,1885.48,0.0
gfx950,256,192,7168,16384,asm,33,2,48.5354,_ZN5aiter42fp8gemm_bf16_blockscale_BpreShuffle_96x128E,929.16,2541.21,0.0
gfx950,256,208,7168,384,ck,4,0,6.0222,a8w8_blockscale_bpreshuffle_1x128x128_256x16x128x128_8x16_16x16_16x16x1_8x32x1_1x16x1x16_8_1x2_intrawave_v1,190.14,965.47,0.0
gfx950,256,208,7168,3072,asm,14,1,15.6859,_ZN5aiter42fp8gemm_bf16_blockscale_BpreShuffle_64x128E,583.99,1634.65,0.0
gfx950,256,208,7168,7168,asm,2,1,31.0722,_ZN5aiter42fp8gemm_bf16_blockscale_BpreShuffle_64x128E,687.89,1797.52,0.0
gfx950,256,208,7168,16384,asm,41,2,59.9879,_ZN5aiter43fp8gemm_bf16_blockscale_BpreShuffle_128x128E,814.42,2064.25,0.0
gfx950,256,224,7168,384,ck,2,0,5.9902,a8w8_blockscale_bpreshuffle_1x128x128_256x64x64x128_16x16_16x16_8x32x1_8x32x1_1x32x1x8_8_2x1_intrawave_v3,205.86,1009.95,0.0
gfx950,256,224,7168,3072,asm,14,1,15.5859,_ZN5aiter42fp8gemm_bf16_blockscale_BpreShuffle_64x128E,632.94,1663.01,0.0
gfx950,256,224,7168,7168,asm,2,1,31.2014,_ZN5aiter42fp8gemm_bf16_blockscale_BpreShuffle_64x128E,737.73,1801.11,0.0
gfx950,256,224,7168,16384,asm,41,2,59.3959,_ZN5aiter43fp8gemm_bf16_blockscale_BpreShuffle_128x128E,885.81,2093.1,0.0
gfx950,256,240,7168,384,ck,10,0,6.1141,a8w8_blockscale_bpreshuffle_1x128x128_256x32x64x128_16x16_16x16_8x32x1_8x32x1_1x32x1x8_8_2x1_intrawave_v1,216.09,1028.0,0.0005
gfx950,256,240,7168,3072,asm,14,1,16.1235,_ZN5aiter42fp8gemm_bf16_blockscale_BpreShuffle_64x128E,655.54,1624.83,0.0
gfx950,256,240,7168,7168,asm,2,1,31.2656,_ZN5aiter42fp8gemm_bf16_blockscale_BpreShuffle_64x128E,788.81,1808.42,0.0
gfx950,256,240,7168,16384,asm,26,3,61.0439,_ZN5aiter42fp8gemm_bf16_blockscale_BpreShuffle_80x128E,923.46,2044.65,0.0011
gfx950,256,256,7168,384,ck,4,0,5.8007,a8w8_blockscale_bpreshuffle_1x128x128_256x16x128x128_8x16_16x16_16x16x1_8x32x1_1x16x1x16_8_1x2_intrawave_v1,242.95,1124.15,0.0
gfx950,256,256,7168,3072,asm,14,1,16.3648,_ZN5aiter42fp8gemm_bf16_blockscale_BpreShuffle_64x128E,688.94,1617.9,0.0
gfx950,256,256,7168,7168,asm,2,1,30.8956,_ZN5aiter42fp8gemm_bf16_blockscale_BpreShuffle_64x128E,851.47,1841.21,0.0
gfx950,256,256,7168,16384,asm,41,2,61.9231,_ZN5aiter43fp8gemm_bf16_blockscale_BpreShuffle_128x128E,971.04,2023.56,0.0
gfx950,256,288,7168,384,ck,8,0,6.3655,a8w8_blockscale_bpreshuffle_1x128x128_256x32x256x128_16x16_16x16_8x32x1_8x32x1_1x32x1x8_8_2x1_intrawave_v1,249.07,1098.4,0.0
gfx950,256,288,7168,3072,asm,21,1,17.3917,_ZN5aiter42fp8gemm_bf16_blockscale_BpreShuffle_80x128E,729.29,1554.4,0.0
gfx950,256,288,7168,7168,asm,3,1,33.4059,_ZN5aiter42fp8gemm_bf16_blockscale_BpreShuffle_80x128E,885.92,1723.45,0.0
gfx950,256,288,7168,16384,asm,34,3,69.4003,_ZN5aiter42fp8gemm_bf16_blockscale_BpreShuffle_96x128E,974.72,1819.7,0.001
gfx950,256,320,7168,384,ck,9,0,6.4468,a8w8_blockscale_bpreshuffle_1x128x128_256x32x128x128_16x16_16x16_8x32x1_8x32x1_1x32x1x8_8_2x1_intrawave_v1,273.25,1157.61,0.0
gfx950,256,320,7168,3072,asm,21,1,17.2359,_ZN5aiter42fp8gemm_bf16_blockscale_BpreShuffle_80x128E,817.65,1600.77,0.0
gfx950,256,320,7168,7168,asm,3,1,34.0678,_ZN5aiter42fp8gemm_bf16_blockscale_BpreShuffle_80x128E,965.23,1710.16,0.0
gfx950,256,320,7168,16384,asm,24,1,71.8858,_ZN5aiter42fp8gemm_bf16_blockscale_BpreShuffle_80x128E,1045.57,1770.46,0.0
gfx950,256,352,7168,384,ck,15,0,6.8424,a8w8_blockscale_bpreshuffle_1x128x128_256x64x64x128_16x16_16x16_8x32x1_8x32x1_1x32x1x8_8_2x1_intrawave_v1,283.2,1159.53,0.0007
gfx950,256,352,7168,3072,asm,28,1,19.9287,_ZN5aiter42fp8gemm_bf16_blockscale_BpreShuffle_96x128E,777.88,1412.42,0.0
gfx950,256,352,7168,7168,asm,4,1,38.5304,_ZN5aiter42fp8gemm_bf16_blockscale_BpreShuffle_96x128E,938.78,1529.95,0.0
gfx950,256,352,7168,16384,asm,32,1,78.4826,_ZN5aiter42fp8gemm_bf16_blockscale_BpreShuffle_96x128E,1053.46,1634.17,0.0
gfx950,256,384,7168,384,ck,9,0,6.5405,a8w8_blockscale_bpreshuffle_1x128x128_256x32x128x128_16x16_16x16_8x32x1_8x32x1_1x32x1x8_8_2x1_intrawave_v1,323.21,1285.07,0.0
gfx950,256,384,7168,3072,asm,28,1,19.3973,_ZN5aiter42fp8gemm_bf16_blockscale_BpreShuffle_96x128E,871.84,1479.83,0.0
gfx950,256,384,7168,7168,asm,4,1,40.1326,_ZN5aiter42fp8gemm_bf16_blockscale_BpreShuffle_96x128E,983.24,1486.02,0.0
gfx950,256,384,7168,16384,asm,32,1,77.9566,_ZN5aiter42fp8gemm_bf16_blockscale_BpreShuffle_96x128E,1156.98,1657.81,0.0
gfx950,256,416,7168,384,ck,9,0,7.7057,a8w8_blockscale_bpreshuffle_1x128x128_256x32x128x128_16x16_16x16_8x32x1_8x32x1_1x32x1x8_8_2x1_intrawave_v1,297.19,1151.88,0.0
gfx950,256,416,7168,3072,ck,14,0,23.3761,a8w8_blockscale_bpreshuffle_1x128x128_256x64x128x128_16x16_16x16_8x32x1_8x32x1_1x32x1x8_8_2x1_intrawave_v1,783.74,1251.78,0.0001
gfx950,256,416,7168,7168,asm,5,1,47.1144,_ZN5aiter43fp8gemm_bf16_blockscale_BpreShuffle_128x128E,907.33,1280.41,0.0
gfx950,256,416,7168,16384,asm,40,1,94.9783,_ZN5aiter43fp8gemm_bf16_blockscale_BpreShuffle_128x128E,1028.77,1371.05,0.0
gfx950,256,448,7168,384,ck,9,0,7.8193,a8w8_blockscale_bpreshuffle_1x128x128_256x32x128x128_16x16_16x16_8x32x1_8x32x1_1x32x1x8_8_2x1_intrawave_v1,315.41,1195.38,0.0
gfx950,256,448,7168,3072,ck,14,0,23.9363,a8w8_blockscale_bpreshuffle_1x128x128_256x64x128x128_16x16_16x16_8x32x1_8x32x1_1x32x1x8_8_2x1_intrawave_v1,824.27,1245.76,0.0001
gfx950,256,448,7168,7168,ck,14,0,46.9169,a8w8_blockscale_bpreshuffle_1x128x128_256x64x128x128_16x16_16x16_8x32x1_8x32x1_1x32x1x8_8_2x1_intrawave_v1,981.24,1300.47,0.0001
gfx950,256,448,7168,16384,ck,14,0,99.1679,a8w8_blockscale_bpreshuffle_1x128x128_256x64x128x128_16x16_16x16_8x32x1_8x32x1_1x32x1x8_8_2x1_intrawave_v1,1061.1,1323.04,0.0001
gfx950,256,480,7168,384,ck,14,0,8.1762,a8w8_blockscale_bpreshuffle_1x128x128_256x64x128x128_16x16_16x16_8x32x1_8x32x1_1x32x1x8_8_2x1_intrawave_v1,323.18,1200.82,0.0
gfx950,256,480,7168,3072,ck,14,0,24.0859,a8w8_blockscale_bpreshuffle_1x128x128_256x64x128x128_16x16_16x16_8x32x1_8x32x1_1x32x1x8_8_2x1_intrawave_v1,877.66,1261.15,0.0001
gfx950,256,480,7168,7168,ck,14,0,48.4232,a8w8_blockscale_bpreshuffle_1x128x128_256x64x128x128_16x16_16x16_8x32x1_8x32x1_1x32x1x8_8_2x1_intrawave_v1,1018.62,1274.23,0.0001
gfx950,256,480,7168,16384,asm,40,1,99.9895,_ZN5aiter43fp8gemm_bf16_blockscale_BpreShuffle_128x128E,1127.55,1322.0,0.0
gfx950,256,512,7168,384,ck,14,0,7.8651,a8w8_blockscale_bpreshuffle_1x128x128_256x64x128x128_16x16_16x16_8x32x1_8x32x1_1x32x1x8_8_2x1_intrawave_v1,358.36,1308.2,0.0
gfx950,256,512,7168,3072,ck,14,0,24.0417,a8w8_blockscale_bpreshuffle_1x128x128_256x64x128x128_16x16_16x16_8x32x1_8x32x1_1x32x1x8_8_2x1_intrawave_v1,937.89,1286.64,0.0002
gfx950,256,512,7168,7168,ck,13,0,48.9252,a8w8_blockscale_bpreshuffle_1x128x128_256x64x256x128_16x16_16x16_8x32x1_8x32x1_1x32x1x8_8_2x1_intrawave_v1,1075.38,1275.22,0.0
gfx950,256,512,7168,16384,ck,14,0,98.3706,a8w8_blockscale_bpreshuffle_1x128x128_256x64x128x128_16x16_16x16_8x32x1_8x32x1_1x32x1x8_8_2x1_intrawave_v1,1222.51,1353.75,0.0001
gfx950,256,544,7168,384,ck,9,0,8.3895,a8w8_blockscale_bpreshuffle_1x128x128_256x32x128x128_16x16_16x16_8x32x1_8x32x1_1x32x1x8_8_2x1_intrawave_v1,356.96,1282.58,0.0
gfx950,256,544,7168,3072,ck,14,0,25.4623,a8w8_blockscale_bpreshuffle_1x128x128_256x64x128x128_16x16_16x16_8x32x1_8x32x1_1x32x1x8_8_2x1_intrawave_v1,940.92,1236.73,0.0001
gfx950,256,544,7168,7168,ck,14,0,51.3141,a8w8_blockscale_bpreshuffle_1x128x128_256x64x128x128_16x16_16x16_8x32x1_8x32x1_1x32x1x8_8_2x1_intrawave_v1,1089.4,1229.26,0.0001
gfx950,256,544,7168,16384,ck,14,0,107.4367,a8w8_blockscale_bpreshuffle_1x128x128_256x64x128x128_16x16_16x16_8x32x1_8x32x1_1x32x1x8_8_2x1_intrawave_v1,1189.31,1248.66,0.0
gfx950,256,576,7168,384,ck,13,0,8.9716,a8w8_blockscale_bpreshuffle_1x128x128_256x64x256x128_16x16_16x16_8x32x1_8x32x1_1x32x1x8_8_2x1_intrawave_v1,353.44,1251.86,0.0
gfx950,256,576,7168,3072,ck,14,0,24.9911,a8w8_blockscale_bpreshuffle_1x128x128_256x64x128x128_16x16_16x16_8x32x1_8x32x1_1x32x1x8_8_2x1_intrawave_v1,1015.05,1282.34,0.0002
gfx950,256,576,7168,7168,ck,14,0,50.4894,a8w8_blockscale_bpreshuffle_1x128x128_256x64x128x128_16x16_16x16_8x32x1_8x32x1_1x32x1x8_8_2x1_intrawave_v1,1172.33,1262.97,0.0001
gfx950,256,576,7168,16384,ck,14,0,104.4563,a8w8_blockscale_bpreshuffle_1x128x128_256x64x128x128_16x16_16x16_8x32x1_8x32x1_1x32x1x8_8_2x1_intrawave_v1,1295.2,1293.7,0.0
gfx950,256,608,7168,384,ck,10,0,9.8199,a8w8_blockscale_bpreshuffle_1x128x128_256x32x64x128_16x16_16x16_8x32x1_8x32x1_1x32x1x8_8_2x1_intrawave_v1,340.84,1191.69,0.0014
gfx950,256,608,7168,3072,ck,14,0,31.0992,a8w8_blockscale_bpreshuffle_1x128x128_256x64x128x128_16x16_16x16_8x32x1_8x32x1_1x32x1x8_8_2x1_intrawave_v1,861.0,1048.39,0.0001
gfx950,256,608,7168,7168,ck,14,0,62.2214,a8w8_blockscale_bpreshuffle_1x128x128_256x64x128x128_16x16_16x16_8x32x1_8x32x1_1x32x1x8_8_2x1_intrawave_v1,1004.13,1035.89,0.0001
gfx950,256,608,7168,16384,asm,24,1,129.2325,_ZN5aiter42fp8gemm_bf16_blockscale_BpreShuffle_80x128E,1105.04,1053.28,0.0
gfx950,256,640,7168,384,ck,10,0,9.9283,a8w8_blockscale_bpreshuffle_1x128x128_256x32x64x128_16x16_16x16_8x32x1_8x32x1_1x32x1x8_8_2x1_intrawave_v1,354.87,1226.12,0.0012
gfx950,256,640,7168,3072,ck,14,0,31.3519,a8w8_blockscale_bpreshuffle_1x128x128_256x64x128x128_16x16_16x16_8x32x1_8x32x1_1x32x1x8_8_2x1_intrawave_v1,899.01,1057.71,0.0002
gfx950,256,640,7168,7168,ck,14,0,62.2407,a8w8_blockscale_bpreshuffle_1x128x128_256x64x128x128_16x16_16x16_8x32x1_8x32x1_1x32x1x8_8_2x1_intrawave_v1,1056.65,1046.63,0.0001
gfx950,256,640,7168,16384,ck,14,0,129.4033,a8w8_blockscale_bpreshuffle_1x128x128_256x64x128x128_16x16_16x16_8x32x1_8x32x1_1x32x1x8_8_2x1_intrawave_v1,1161.67,1059.49,0.0
gfx950,256,672,7168,384,ck,9,0,9.8369,a8w8_blockscale_bpreshuffle_1x128x128_256x32x128x128_16x16_16x16_8x32x1_8x32x1_1x32x1x8_8_2x1_intrawave_v1,376.07,1285.4,0.0
gfx950,256,672,7168,3072,ck,14,0,31.6323,a8w8_blockscale_bpreshuffle_1x128x128_256x64x128x128_16x16_16x16_8x32x1_8x32x1_1x32x1x8_8_2x1_intrawave_v1,935.59,1065.94,0.0001
gfx950,256,672,7168,7168,ck,13,0,65.2683,a8w8_blockscale_bpreshuffle_1x128x128_256x64x256x128_16x16_16x16_8x32x1_8x32x1_1x32x1x8_8_2x1_intrawave_v1,1058.02,1008.62,0.0
gfx950,256,672,7168,16384,asm,24,1,133.3989,_ZN5aiter42fp8gemm_bf16_blockscale_BpreShuffle_80x128E,1183.22,1035.12,0.0
gfx950,256,704,7168,384,ck,9,0,9.789,a8w8_blockscale_bpreshuffle_1x128x128_256x32x128x128_16x16_16x16_8x32x1_8x32x1_1x32x1x8_8_2x1_intrawave_v1,395.91,1339.81,0.0
gfx950,256,704,7168,3072,ck,14,0,31.5824,a8w8_blockscale_bpreshuffle_1x128x128_256x64x128x128_16x16_16x16_8x32x1_8x32x1_1x32x1x8_8_2x1_intrawave_v1,981.7,1085.27,0.0002
gfx950,256,704,7168,7168,ck,13,0,64.8418,a8w8_blockscale_bpreshuffle_1x128x128_256x64x256x128_16x16_16x16_8x32x1_8x32x1_1x32x1x8_8_2x1_intrawave_v1,1115.69,1025.87,0.0
gfx950,256,704,7168,16384,asm,24,1,135.3313,_ZN5aiter42fp8gemm_bf16_blockscale_BpreShuffle_80x128E,1221.86,1027.61,0.0
gfx950,256,736,7168,384,ck,9,1,11.2632,a8w8_blockscale_bpreshuffle_1x128x128_256x32x128x128_16x16_16x16_8x32x1_8x32x1_1x32x1x8_8_2x1_intrawave_v1,359.73,1206.27,0.0
gfx950,256,736,7168,3072,ck,14,0,32.7148,a8w8_blockscale_bpreshuffle_1x128x128_256x64x128x128_16x16_16x16_8x32x1_8x32x1_1x32x1x8_8_2x1_intrawave_v1,990.79,1064.73,0.0002
gfx950,256,736,7168,7168,ck,13,0,67.6229,a8w8_blockscale_bpreshuffle_1x128x128_256x64x256x128_16x16_16x16_8x32x1_8x32x1_1x32x1x8_8_2x1_intrawave_v1,1118.43,993.85,0.0
gfx950,256,736,7168,16384,ck,13,0,138.4289,a8w8_blockscale_bpreshuffle_1x128x128_256x64x256x128_16x16_16x16_8x32x1_8x32x1_1x32x1x8_8_2x1_intrawave_v1,1248.82,1011.71,0.0
gfx950,256,768,7168,384,ck,14,0,10.633,a8w8_blockscale_bpreshuffle_1x128x128_256x64x128x128_16x16_16x16_8x32x1_8x32x1_1x32x1x8_8_2x1_intrawave_v1,397.62,1322.06,0.0
gfx950,256,768,7168,3072,ck,14,0,32.7716,a8w8_blockscale_bpreshuffle_1x128x128_256x64x128x128_16x16_16x16_8x32x1_8x32x1_1x32x1x8_8_2x1_intrawave_v1,1032.08,1079.88,0.0002
gfx950,256,768,7168,7168,ck,13,0,64.1411,a8w8_blockscale_bpreshuffle_1x128x128_256x64x256x128_16x16_16x16_8x32x1_8x32x1_1x32x1x8_8_2x1_intrawave_v1,1230.41,1058.53,0.0
gfx950,256,768,7168,16384,ck,13,0,133.7547,a8w8_blockscale_bpreshuffle_1x128x128_256x64x256x128_16x16_16x16_8x32x1_8x32x1_1x32x1x8_8_2x1_intrawave_v1,1348.65,1054.42,0.0
gfx950,256,800,7168,384,ck,9,0,10.783,a8w8_blockscale_bpreshuffle_1x128x128_256x32x128x128_16x16_16x16_8x32x1_8x32x1_1x32x1x8_8_2x1_intrawave_v1,408.42,1347.35,0.0
gfx950,256,800,7168,3072,ck,13,0,33.2583,a8w8_blockscale_bpreshuffle_1x128x128_256x64x256x128_16x16_16x16_8x32x1_8x32x1_1x32x1x8_8_2x1_intrawave_v1,1059.35,1080.83,0.0
gfx950,256,800,7168,7168,ck,13,0,69.0192,a8w8_blockscale_bpreshuffle_1x128x128_256x64x256x128_16x16_16x16_8x32x1_8x32x1_1x32x1x8_8_2x1_intrawave_v1,1191.09,993.69,0.0
gfx950,256,800,7168,16384,ck,13,0,141.3488,a8w8_blockscale_bpreshuffle_1x128x128_256x64x256x128_16x16_16x16_8x32x1_8x32x1_1x32x1x8_8_2x1_intrawave_v1,1329.37,1004.72,0.0
gfx950,256,832,7168,384,ck,14,0,10.7452,a8w8_blockscale_bpreshuffle_1x128x128_256x64x128x128_16x16_16x16_8x32x1_8x32x1_1x32x1x8_8_2x1_intrawave_v1,426.25,1395.93,0.0
gfx950,256,832,7168,3072,ck,13,0,32.327,a8w8_blockscale_bpreshuffle_1x128x128_256x64x256x128_16x16_16x16_8x32x1_8x32x1_1x32x1x8_8_2x1_intrawave_v1,1133.46,1129.2,0.0
gfx950,256,832,7168,7168,ck,13,0,70.1573,a8w8_blockscale_bpreshuffle_1x128x128_256x64x256x128_16x16_16x16_8x32x1_8x32x1_1x32x1x8_8_2x1_intrawave_v1,1218.64,987.37,0.0
gfx950,256,832,7168,16384,ck,13,0,141.4845,a8w8_blockscale_bpreshuffle_1x128x128_256x64x256x128_16x16_16x16_8x32x1_8x32x1_1x32x1x8_8_2x1_intrawave_v1,1381.22,1010.71,0.0
gfx950,256,864,7168,384,ck,9,0,10.9624,a8w8_blockscale_bpreshuffle_1x128x128_256x32x128x128_16x16_16x16_8x32x1_8x32x1_1x32x1x8_8_2x1_intrawave_v1,433.88,1411.24,0.0
gfx950,256,864,7168,3072,ck,13,0,35.2642,a8w8_blockscale_bpreshuffle_1x128x128_256x64x256x128_16x16_16x16_8x32x1_8x32x1_1x32x1x8_8_2x1_intrawave_v1,1079.02,1050.94,0.0
gfx950,256,864,7168,7168,ck,13,0,75.8732,a8w8_blockscale_bpreshuffle_1x128x128_256x64x256x128_16x16_16x16_8x32x1_8x32x1_1x32x1x8_8_2x1_intrawave_v1,1170.18,922.06,0.0
gfx950,256,864,7168,16384,asm,32,1,151.4096,_ZN5aiter42fp8gemm_bf16_blockscale_BpreShuffle_96x128E,1340.32,950.95,0.0
gfx950,256,896,7168,384,ck,9,0,11.3587,a8w8_blockscale_bpreshuffle_1x128x128_256x32x128x128_16x16_16x16_8x32x1_8x32x1_1x32x1x8_8_2x1_intrawave_v1,434.25,1403.47,0.0
gfx950,256,896,7168,3072,ck,13,0,34.2653,a8w8_blockscale_bpreshuffle_1x128x128_256x64x256x128_16x16_16x16_8x32x1_8x32x1_1x32x1x8_8_2x1_intrawave_v1,1151.6,1097.84,0.0
gfx950,256,896,7168,7168,ck,13,0,72.8489,a8w8_blockscale_bpreshuffle_1x128x128_256x64x256x128_16x16_16x16_8x32x1_8x32x1_1x32x1x8_8_2x1_intrawave_v1,1263.9,969.79,0.0
gfx950,256,896,7168,16384,ck,13,0,153.3112,a8w8_blockscale_bpreshuffle_1x128x128_256x64x256x128_16x16_16x16_8x32x1_8x32x1_1x32x1x8_8_2x1_intrawave_v1,1372.72,945.56,0.0
gfx950,256,928,7168,384,ck,9,0,11.4791,a8w8_blockscale_bpreshuffle_1x128x128_256x32x128x128_16x16_16x16_8x32x1_8x32x1_1x32x1x8_8_2x1_intrawave_v1,445.04,1429.79,0.0
gfx950,256,928,7168,3072,ck,13,0,38.5288,a8w8_blockscale_bpreshuffle_1x128x128_256x64x256x128_16x16_16x16_8x32x1_8x32x1_1x32x1x8_8_2x1_intrawave_v1,1060.75,990.81,0.0
gfx950,256,928,7168,7168,ck,0,0,76.3922,a8w8_blockscale_bpreshuffle_1x128x128_256x128x128x128_16x16_16x16_8x32x1_8x32x1_1x32x1x8_8_2x1_intrawave_v3,1248.32,933.81,0.0
gfx950,256,928,7168,16384,ck,0,0,158.9736,a8w8_blockscale_bpreshuffle_1x128x128_256x128x128x128_16x16_16x16_8x32x1_8x32x1_1x32x1x8_8_2x1_intrawave_v3,1371.11,918.07,0.0
gfx950,256,960,7168,384,ck,9,0,11.8232,a8w8_blockscale_bpreshuffle_1x128x128_256x32x128x128_16x16_16x16_8x32x1_8x32x1_1x32x1x8_8_2x1_intrawave_v1,446.99,1428.02,0.0
gfx950,256,960,7168,3072,ck,13,0,38.1392,a8w8_blockscale_bpreshuffle_1x128x128_256x64x256x128_16x16_16x16_8x32x1_8x32x1_1x32x1x8_8_2x1_intrawave_v1,1108.53,1015.54,0.0
gfx950,256,960,7168,7168,ck,13,0,75.3989,a8w8_blockscale_bpreshuffle_1x128x128_256x64x256x128_16x16_16x16_8x32x1_8x32x1_1x32x1x8_8_2x1_intrawave_v1,1308.37,955.24,0.0
gfx950,256,960,7168,16384,ck,13,0,157.0398,a8w8_blockscale_bpreshuffle_1x128x128_256x64x256x128_16x16_16x16_8x32x1_8x32x1_1x32x1x8_8_2x1_intrawave_v1,1435.85,935.63,0.0
gfx950,256,992,7168,384,ck,9,0,13.3779,a8w8_blockscale_bpreshuffle_1x128x128_256x32x128x128_16x16_16x16_8x32x1_8x32x1_1x32x1x8_8_2x1_intrawave_v1,408.21,1297.27,0.0
gfx950,256,992,7168,3072,ck,13,0,38.328,a8w8_blockscale_bpreshuffle_1x128x128_256x64x256x128_16x16_16x16_8x32x1_8x32x1_1x32x1x8_8_2x1_intrawave_v1,1139.84,1025.07,0.0
gfx950,256,992,7168,7168,ck,13,0,76.8077,a8w8_blockscale_bpreshuffle_1x128x128_256x64x256x128_16x16_16x16_8x32x1_8x32x1_1x32x1x8_8_2x1_intrawave_v1,1327.19,946.68,0.0
gfx950,256,992,7168,16384,ck,0,0,156.4214,a8w8_blockscale_bpreshuffle_1x128x128_256x128x128x128_16x16_16x16_8x32x1_8x32x1_1x32x1x8_8_2x1_intrawave_v3,1489.58,945.62,0.0
gfx950,256,1024,7168,384,ck,13,0,12.9508,a8w8_blockscale_bpreshuffle_1x128x128_256x64x256x128_16x16_16x16_8x32x1_8x32x1_1x32x1x8_8_2x1_intrawave_v1,435.27,1376.42,0.0
gfx950,256,1024,7168,3072,ck,13,0,38.2496,a8w8_blockscale_bpreshuffle_1x128x128_256x64x256x128_16x16_16x16_8x32x1_8x32x1_1x32x1x8_8_2x1_intrawave_v1,1179.02,1041.73,0.0
gfx950,256,1024,7168,7168,ck,13,0,76.9649,a8w8_blockscale_bpreshuffle_1x128x128_256x64x256x128_16x16_16x16_8x32x1_8x32x1_1x32x1x8_8_2x1_intrawave_v1,1367.2,953.69,0.0
gfx950,256,1024,7168,16384,ck,0,0,159.2855,a8w8_blockscale_bpreshuffle_1x128x128_256x128x128x128_16x16_16x16_8x32x1_8x32x1_1x32x1x8_8_2x1_intrawave_v3,1509.98,934.79,0.0
gfx950,256,1088,7168,384,ck,9,0,12.4426,a8w8_blockscale_bpreshuffle_1x128x128_256x32x128x128_16x16_16x16_8x32x1_8x32x1_1x32x1x8_8_2x1_intrawave_v1,481.37,1508.36,0.0
gfx950,256,1088,7168,3072,ck,13,0,38.3276,a8w8_blockscale_bpreshuffle_1x128x128_256x64x256x128_16x16_16x16_8x32x1_8x32x1_1x32x1x8_8_2x1_intrawave_v1,1250.16,1068.68,0.0
gfx950,256,1088,7168,7168,ck,13,0,78.3802,a8w8_blockscale_bpreshuffle_1x128x128_256x64x256x128_16x16_16x16_8x32x1_8x32x1_1x32x1x8_8_2x1_intrawave_v1,1426.42,954.02,0.0
gfx950,256,1088,7168,16384,ck,13,0,165.3111,a8w8_blockscale_bpreshuffle_1x128x128_256x64x256x128_16x16_16x16_8x32x1_8x32x1_1x32x1x8_8_2x1_intrawave_v1,1545.88,912.61,0.0
gfx950,256,1152,7168,384,ck,9,0,12.5595,a8w8_blockscale_bpreshuffle_1x128x128_256x32x128x128_16x16_16x16_8x32x1_8x32x1_1x32x1x8_8_2x1_intrawave_v1,504.94,1569.33,0.0
gfx950,256,1152,7168,3072,ck,13,0,41.1468,a8w8_blockscale_bpreshuffle_1x128x128_256x64x256x128_16x16_16x16_8x32x1_8x32x1_1x32x1x8_8_2x1_intrawave_v1,1233.01,1022.54,0.0
gfx950,256,1152,7168,7168,ck,13,0,80.7938,a8w8_blockscale_bpreshuffle_1x128x128_256x64x256x128_16x16_16x16_8x32x1_8x32x1_1x32x1x8_8_2x1_intrawave_v1,1465.21,942.56,0.0
gfx950,256,1152,7168,16384,ck,0,0,168.6731,a8w8_blockscale_bpreshuffle_1x128x128_256x128x128x128_16x16_16x16_8x32x1_8x32x1_1x32x1x8_8_2x1_intrawave_v3,1604.19,906.07,0.0
gfx950,256,1216,7168,384,ck,9,0,13.4297,a8w8_blockscale_bpreshuffle_1x128x128_256x32x128x128_16x16_16x16_8x32x1_8x32x1_1x32x1x8_8_2x1_intrawave_v1,498.46,1537.79,0.0
gfx950,256,1216,7168,3072,cktile,27,0,46.8037,a8w8_blockscale_cktile_192x256x128_4x2x1_16x16x128_intrawave_0x1x0_2,1144.2,922.75,0.0
gfx950,256,1216,7168,7168,cktile,28,0,87.0523,a8w8_blockscale_cktile_192x256x128_4x2x1_16x16x128_intrawave_0x1x0_3,1435.42,890.6,0.0
gfx950,256,1216,7168,16384,cktile,27,0,177.3028,a8w8_blockscale_cktile_192x256x128_4x2x1_16x16x128_intrawave_0x1x0_2,1610.89,873.06,0.0
gfx950,256,1280,7168,384,ck,9,0,13.8774,a8w8_blockscale_bpreshuffle_1x128x128_256x32x128x128_16x16_16x16_8x32x1_8x32x1_1x32x1x8_8_2x1_intrawave_v1,507.76,1556.06,0.0
gfx950,256,1280,7168,3072,cktile,29,0,47.2069,a8w8_blockscale_cktile_192x256x128_4x2x1_16x16x128_intrawave_0x1x0_4,1194.14,938.47,0.0
gfx950,256,1280,7168,7168,cktile,27,0,87.9119,a8w8_blockscale_cktile_192x256x128_4x2x1_16x16x128_intrawave_0x1x0_2,1496.2,897.55,0.0
gfx950,256,1280,7168,16384,cktile,11,0,178.156,a8w8_blockscale_cktile_192x256x128_4x2x1_16x16x128_intrawave_0x1x0_1,1687.55,879.91,0.0
gfx950,256,1344,7168,384,ck,9,0,14.2723,a8w8_blockscale_bpreshuffle_1x128x128_256x32x128x128_16x16_16x16_8x32x1_8x32x1_1x32x1x8_8_2x1_intrawave_v1,518.4,1579.02,0.0
gfx950,256,1344,7168,3072,cktile,28,0,47.3643,a8w8_blockscale_cktile_192x256x128_4x2x1_16x16x128_intrawave_0x1x0_3,1249.68,958.88,0.0
gfx950,256,1344,7168,7168,cktile,28,0,88.0382,a8w8_blockscale_cktile_192x256x128_4x2x1_16x16x128_intrawave_0x1x0_3,1568.75,911.9,0.0
gfx950,256,1344,7168,16384,cktile,28,0,177.456,a8w8_blockscale_cktile_192x256x128_4x2x1_16x16x128_intrawave_0x1x0_3,1778.92,894.47,0.0
gfx950,256,1408,7168,384,ck,9,0,14.6469,a8w8_blockscale_bpreshuffle_1x128x128_256x32x128x128_16x16_16x16_8x32x1_8x32x1_1x32x1x8_8_2x1_intrawave_v1,529.2,1602.95,0.0
gfx950,256,1408,7168,3072,cktile,29,0,48.7357,a8w8_blockscale_cktile_192x256x128_4x2x1_16x16x128_intrawave_0x1x0_4,1272.34,954.75,0.0
gfx950,256,1408,7168,7168,cktile,28,0,89.9503,a8w8_blockscale_cktile_192x256x128_4x2x1_16x16x128_intrawave_0x1x0_3,1608.52,907.81,0.0
gfx950,256,1408,7168,16384,cktile,11,0,179.7188,a8w8_blockscale_cktile_192x256x128_4x2x1_16x16x128_intrawave_0x1x0_1,1840.17,894.14,0.0
gfx950,256,1472,7168,384,ck,9,0,15.1377,a8w8_blockscale_bpreshuffle_1x128x128_256x32x128x128_16x16_16x16_8x32x1_8x32x1_1x32x1x8_8_2x1_intrawave_v1,535.31,1613.21,0.0
gfx950,256,1472,7168,3072,cktile,28,0,48.5541,a8w8_blockscale_cktile_192x256x128_4x2x1_16x16x128_intrawave_0x1x0_3,1335.15,981.27,0.0
gfx950,256,1472,7168,7168,cktile,29,0,89.6557,a8w8_blockscale_cktile_192x256x128_4x2x1_16x16x128_intrawave_0x1x0_4,1687.16,926.14,0.0
gfx950,256,1472,7168,16384,cktile,28,0,179.5078,a8w8_blockscale_cktile_192x256x128_4x2x1_16x16x128_intrawave_0x1x0_3,1926.07,906.15,0.0
gfx950,256,1536,7168,384,ck,9,0,15.7955,a8w8_blockscale_bpreshuffle_1x128x128_256x32x128x128_16x16_16x16_8x32x1_8x32x1_1x32x1x8_8_2x1_intrawave_v1,535.32,1605.67,0.0
gfx950,256,1536,7168,3072,cktile,28,0,48.3445,a8w8_blockscale_cktile_192x256x128_4x2x1_16x16x128_intrawave_0x1x0_3,1399.24,1008.57,0.0
gfx950,256,1536,7168,7168,cktile,11,0,89.8275,a8w8_blockscale_cktile_192x256x128_4x2x1_16x16x128_intrawave_0x1x0_1,1757.15,939.69,0.0
gfx950,256,1536,7168,16384,cktile,11,0,180.0393,a8w8_blockscale_cktile_192x256x128_4x2x1_16x16x128_intrawave_0x1x0_1,2003.88,914.39,0.0
gfx950,256,1600,7168,384,ck,9,0,16.0454,a8w8_blockscale_bpreshuffle_1x128x128_256x32x128x128_16x16_16x16_8x32x1_8x32x1_1x32x1x8_8_2x1_intrawave_v1,548.94,1639.38,0.0
gfx950,256,1600,7168,3072,cktile,28,0,49.5047,a8w8_blockscale_cktile_192x256x128_4x2x1_16x16x128_intrawave_0x1x0_3,1423.39,1007.44,0.0
gfx950,256,1600,7168,7168,cktile,29,0,92.4801,a8w8_blockscale_cktile_192x256x128_4x2x1_16x16x128_intrawave_0x1x0_4,1777.86,927.62,0.0
gfx950,256,1600,7168,16384,cktile,27,0,182.6633,a8w8_blockscale_cktile_192x256x128_4x2x1_16x16x128_intrawave_0x1x0_2,2057.39,912.02,0.0
gfx950,256,1664,7168,384,ck,9,0,16.4508,a8w8_blockscale_bpreshuffle_1x128x128_256x32x128x128_16x16_16x16_8x32x1_8x32x1_1x32x1x8_8_2x1_intrawave_v1,556.83,1656.25,0.0
gfx950,256,1664,7168,3072,cktile,27,0,49.5209,a8w8_blockscale_cktile_192x256x128_4x2x1_16x16x128_intrawave_0x1x0_2,1479.84,1029.61,0.0
gfx950,256,1664,7168,7168,cktile,27,0,91.9074,a8w8_blockscale_cktile_192x256x128_4x2x1_16x16x128_intrawave_0x1x0_2,1860.5,948.38,0.0
gfx950,256,1664,7168,16384,cktile,11,0,183.5933,a8w8_blockscale_cktile_192x256x128_4x2x1_16x16x128_intrawave_0x1x0_1,2128.85,918.11,0.0
gfx950,256,1728,7168,384,ck,9,0,16.71,a8w8_blockscale_bpreshuffle_1x128x128_256x32x128x128_16x16_16x16_8x32x1_8x32x1_1x32x1x8_8_2x1_intrawave_v1,569.28,1686.93,0.0
gfx950,256,1728,7168,3072,cktile,27,0,50.1365,a8w8_blockscale_cktile_192x256x128_4x2x1_16x16x128_intrawave_0x1x0_2,1517.89,1039.19,0.0
gfx950,256,1728,7168,7168,cktile,28,0,91.8376,a8w8_blockscale_cktile_192x256x128_4x2x1_16x16x128_intrawave_0x1x0_3,1933.52,964.08,0.0
gfx950,256,1728,7168,16384,cktile,29,0,183.7145,a8w8_blockscale_cktile_192x256x128_4x2x1_16x16x128_intrawave_0x1x0_4,2209.27,928.2,0.0
gfx950,256,1792,7168,384,ck,9,0,17.4433,a8w8_blockscale_bpreshuffle_1x128x128_256x32x128x128_16x16_16x16_8x32x1_8x32x1_1x32x1x8_8_2x1_intrawave_v1,565.55,1670.03,0.0
gfx950,256,1792,7168,3072,ck,13,0,64.0662,a8w8_blockscale_bpreshuffle_1x128x128_256x64x256x128_16x16_16x16_8x32x1_8x32x1_1x32x1x8_8_2x1_intrawave_v1,1231.85,830.63,0.0
gfx950,256,1792,7168,7168,ck,13,0,127.9586,a8w8_blockscale_bpreshuffle_1x128x128_256x64x256x128_16x16_16x16_8x32x1_8x32x1_1x32x1x8_8_2x1_intrawave_v1,1439.11,702.69,0.0
gfx950,256,1792,7168,16384,ck,13,0,273.2903,a8w8_blockscale_bpreshuffle_1x128x128_256x64x256x128_16x16_16x16_8x32x1_8x32x1_1x32x1x8_8_2x1_intrawave_v1,1540.15,631.16,0.0
gfx950,256,1856,7168,384,ck,9,0,17.56,a8w8_blockscale_bpreshuffle_1x128x128_256x32x128x128_16x16_16x16_8x32x1_8x32x1_1x32x1x8_8_2x1_intrawave_v1,581.85,1712.58,0.0
gfx950,256,1856,7168,3072,ck,14,0,65.4214,a8w8_blockscale_bpreshuffle_1x128x128_256x64x128x128_16x16_16x16_8x32x1_8x32x1_1x32x1x8_8_2x1_intrawave_v1,1249.42,830.45,0.0003
gfx950,256,1856,7168,7168,ck,14,0,138.8947,a8w8_blockscale_bpreshuffle_1x128x128_256x64x128x128_16x16_16x16_8x32x1_8x32x1_1x32x1x8_8_2x1_intrawave_v1,1373.15,657.27,0.0002
gfx950,256,1856,7168,16384,ck,0,0,283.6719,a8w8_blockscale_bpreshuffle_1x128x128_256x128x128x128_16x16_16x16_8x32x1_8x32x1_1x32x1x8_8_2x1_intrawave_v3,1536.77,615.0,0.0
gfx950,256,1920,7168,384,ck,9,0,18.6074,a8w8_blockscale_bpreshuffle_1x128x128_256x32x128x128_16x16_16x16_8x32x1_8x32x1_1x32x1x8_8_2x1_intrawave_v1,568.03,1666.81,0.0
gfx950,256,1920,7168,3072,ck,13,0,66.0434,a8w8_blockscale_bpreshuffle_1x128x128_256x64x256x128_16x16_16x16_8x32x1_8x32x1_1x32x1x8_8_2x1_intrawave_v1,1280.33,839.5,0.0
gfx950,256,1920,7168,7168,ck,0,0,137.9438,a8w8_blockscale_bpreshuffle_1x128x128_256x128x128x128_16x16_16x16_8x32x1_8x32x1_1x32x1x8_8_2x1_intrawave_v3,1430.29,671.78,0.0
gfx950,256,1920,7168,16384,ck,13,0,287.7806,a8w8_blockscale_bpreshuffle_1x128x128_256x64x256x128_16x16_16x16_8x32x1_8x32x1_1x32x1x8_8_2x1_intrawave_v1,1567.07,613.05,0.0
gfx950,256,1984,7168,384,ck,9,0,19.0684,a8w8_blockscale_bpreshuffle_1x128x128_256x32x128x128_16x16_16x16_8x32x1_8x32x1_1x32x1x8_8_2x1_intrawave_v1,572.78,1675.91,0.0
gfx950,256,1984,7168,3072,ck,13,0,68.9374,a8w8_blockscale_bpreshuffle_1x128x128_256x64x256x128_16x16_16x16_8x32x1_8x32x1_1x32x1x8_8_2x1_intrawave_v1,1267.46,820.42,0.0
gfx950,256,1984,7168,7168,ck,13,0,137.5165,a8w8_blockscale_bpreshuffle_1x128x128_256x64x256x128_16x16_16x16_8x32x1_8x32x1_1x32x1x8_8_2x1_intrawave_v1,1482.56,683.88,0.0
gfx950,256,1984,7168,16384,ck,13,0,282.1276,a8w8_blockscale_bpreshuffle_1x128x128_256x64x256x128_16x16_16x16_8x32x1_8x32x1_1x32x1x8_8_2x1_intrawave_v1,1651.75,632.3,0.0
gfx950,256,2048,7168,384,ck,8,0,20.428,a8w8_blockscale_bpreshuffle_1x128x128_256x32x256x128_16x16_16x16_8x32x1_8x32x1_1x32x1x8_8_2x1_intrawave_v1,551.9,1610.49,0.0
gfx950,256,2048,7168,3072,ck,13,0,68.7097,a8w8_blockscale_bpreshuffle_1x128x128_256x64x256x128_16x16_16x16_8x32x1_8x32x1_1x32x1x8_8_2x1_intrawave_v1,1312.69,839.35,0.0
gfx950,256,2048,7168,7168,ck,13,0,140.9867,a8w8_blockscale_bpreshuffle_1x128x128_256x64x256x128_16x16_16x16_8x32x1_8x32x1_1x32x1x8_8_2x1_intrawave_v1,1492.72,676.8,0.0
gfx950,256,2048,7168,16384,ck,0,0,288.9947,a8w8_blockscale_bpreshuffle_1x128x128_256x128x128x128_16x16_16x16_8x32x1_8x32x1_1x32x1x8_8_2x1_intrawave_v3,1664.52,624.08,0.0
gfx950,256,4096,7168,384,ck,13,0,35.046,a8w8_blockscale_bpreshuffle_1x128x128_256x64x256x128_16x16_16x16_8x32x1_8x32x1_1x32x1x8_8_2x1_intrawave_v1,643.4,1798.94,0.0
gfx950,256,4096,7168,3072,ck,13,0,120.225,a8w8_blockscale_bpreshuffle_1x128x128_256x64x256x128_16x16_16x16_8x32x1_8x32x1_1x32x1x8_8_2x1_intrawave_v1,1500.43,776.24,0.0
gfx950,256,4096,7168,7168,ck,13,0,235.8502,a8w8_blockscale_bpreshuffle_1x128x128_256x64x256x128_16x16_16x16_8x32x1_8x32x1_1x32x1x8_8_2x1_intrawave_v1,1784.64,591.31,0.0
gfx950,256,4096,7168,16384,cktile,28,0,516.216,a8w8_blockscale_cktile_192x256x128_4x2x1_16x16x128_intrawave_0x1x0_3,1863.7,471.26,0.0
gfx950,256,6144,7168,384,ck,14,0,48.1595,a8w8_blockscale_bpreshuffle_1x128x128_256x64x128x128_16x16_16x16_8x32x1_8x32x1_1x32x1x8_8_2x1_intrawave_v1,702.31,1935.07,0.0
gfx950,256,6144,7168,3072,ck,13,0,178.7687,a8w8_blockscale_bpreshuffle_1x128x128_256x64x256x128_16x16_16x16_8x32x1_8x32x1_1x32x1x8_8_2x1_intrawave_v1,1513.59,721.46,0.0
gfx950,256,6144,7168,7168,cktile,11,0,339.9621,a8w8_blockscale_cktile_192x256x128_4x2x1_16x16x128_intrawave_0x1x0_1,1857.15,539.77,0.0
gfx950,256,6144,7168,16384,cktile,11,0,700.4577,a8w8_blockscale_cktile_192x256x128_4x2x1_16x16x128_intrawave_0x1x0_1,2060.24,437.12,0.0
gfx950,256,8192,7168,384,ck,14,0,62.5092,a8w8_blockscale_bpreshuffle_1x128x128_256x64x128x128_16x16_16x16_8x32x1_8x32x1_1x32x1x8_8_2x1_intrawave_v1,721.45,1973.13,0.0
gfx950,256,8192,7168,3072,ck,13,0,217.9024,a8w8_blockscale_bpreshuffle_1x128x128_256x64x256x128_16x16_16x16_8x32x1_8x32x1_1x32x1x8_8_2x1_intrawave_v1,1655.68,755.51,0.0
gfx950,256,8192,7168,7168,cktile,28,0,424.7753,a8w8_blockscale_cktile_192x256x128_4x2x1_16x16x128_intrawave_0x1x0_3,1981.79,535.67,0.0
gfx950,256,8192,7168,16384,cktile,29,0,881.6464,a8w8_blockscale_cktile_192x256x128_4x2x1_16x16x128_intrawave_0x1x0_4,2182.45,418.65,0.0
gfx950,256,10240,7168,384,ck,13,0,75.3559,a8w8_blockscale_bpreshuffle_1x128x128_256x64x256x128_16x16_16x16_8x32x1_8x32x1_1x32x1x8_8_2x1_intrawave_v1,748.07,2036.81,0.0
gfx950,256,10240,7168,3072,ck,13,0,268.5386,a8w8_blockscale_bpreshuffle_1x128x128_256x64x256x128_16x16_16x16_8x32x1_8x32x1_1x32x1x8_8_2x1_intrawave_v1,1679.35,745.81,0.0
gfx950,256,10240,7168,7168,cktile,27,0,513.3196,a8w8_blockscale_cktile_192x256x128_4x2x1_16x16x128_intrawave_0x1x0_2,2049.93,529.07,0.0
gfx950,256,10240,7168,16384,cktile,29,0,1072.2898,a8w8_blockscale_cktile_192x256x128_4x2x1_16x16x128_intrawave_0x1x0_4,2243.03,402.89,0.0
gfx950,256,12288,7168,384,ck,13,0,88.2037,a8w8_blockscale_bpreshuffle_1x128x128_256x64x256x128_16x16_16x16_8x32x1_8x32x1_1x32x1x8_8_2x1_intrawave_v1,766.93,2081.91,0.0
gfx950,256,12288,7168,3072,ck,13,0,316.7107,a8w8_blockscale_bpreshuffle_1x128x128_256x64x256x128_16x16_16x16_8x32x1_8x32x1_1x32x1x8_8_2x1_intrawave_v1,1708.71,744.94,0.0
gfx950,256,12288,7168,7168,cktile,27,0,601.0522,a8w8_blockscale_cktile_192x256x128_4x2x1_16x16x128_intrawave_0x1x0_2,2100.85,525.11,0.0
gfx950,256,12288,7168,16384,cktile,27,0,1254.5032,a8w8_blockscale_cktile_192x256x128_4x2x1_16x16x128_intrawave_0x1x0_2,2300.69,394.52,0.0
gfx950,256,14336,7168,384,ck,13,0,101.9592,a8w8_blockscale_bpreshuffle_1x128x128_256x64x256x128_16x16_16x16_8x32x1_8x32x1_1x32x1x8_8_2x1_intrawave_v1,774.04,2096.71,0.0
gfx950,256,14336,7168,3072,ck,13,0,363.4115,a8w8_blockscale_bpreshuffle_1x128x128_256x64x256x128_16x16_16x16_8x32x1_8x32x1_1x32x1x8_8_2x1_intrawave_v1,1737.31,747.31,0.0
gfx950,256,14336,7168,7168,cktile,11,0,693.3656,a8w8_blockscale_cktile_192x256x128_4x2x1_16x16x128_intrawave_0x1x0_1,2124.67,518.72,0.0
gfx950,256,14336,7168,16384,cktile,28,0,1448.6582,a8w8_blockscale_cktile_192x256x128_4x2x1_16x16x128_intrawave_0x1x0_3,2324.4,385.08,0.0
gfx950,256,16384,7168,384,ck,13,0,114.589,a8w8_blockscale_bpreshuffle_1x128x128_256x64x256x128_16x16_16x16_8x32x1_8x32x1_1x32x1x8_8_2x1_intrawave_v1,787.11,2128.69,0.0
gfx950,256,16384,7168,3072,ck,13,0,403.9253,a8w8_blockscale_bpreshuffle_1x128x128_256x64x256x128_16x16_16x16_8x32x1_8x32x1_1x32x1x8_8_2x1_intrawave_v1,1786.36,760.62,0.0
gfx950,256,16384,7168,7168,cktile,28,0,782.4701,a8w8_blockscale_cktile_192x256x128_4x2x1_16x16x128_intrawave_0x1x0_3,2151.68,515.93,0.0
gfx950,256,16384,7168,16384,cktile,11,0,1644.6866,a8w8_blockscale_cktile_192x256x128_4x2x1_16x16x128_intrawave_0x1x0_1,2339.83,377.43,0.0
gfx950,256,20480,7168,3072,ck,13,0,507.2496,a8w8_blockscale_bpreshuffle_1x128x128_256x64x256x128_16x16_16x16_8x32x1_8x32x1_1x32x1x8_8_2x1_intrawave_v1,1778.11,746.25,0.0
gfx950,256,20480,7168,7168,cktile,27,0,977.8092,a8w8_blockscale_cktile_192x256x128_4x2x1_16x16x128_intrawave_0x1x0_2,2152.3,502.94,0.0
gfx950,256,20480,7168,16384,cktile,27,0,2090.2055,a8w8_blockscale_cktile_192x256x128_4x2x1_16x16x128_intrawave_0x1x0_2,2301.38,357.18,0.0
gfx950,256,24576,7168,3072,cktile,29,0,619.3494,a8w8_blockscale_cktile_192x256x128_4x2x1_16x16x128_intrawave_0x1x0_4,1747.53,726.31,0.0
gfx950,256,24576,7168,7168,cktile,11,0,1183.2929,a8w8_blockscale_cktile_192x256x128_4x2x1_16x16x128_intrawave_0x1x0_1,2134.25,490.04,0.0
gfx950,256,24576,7168,16384,cktile,11,0,2519.7634,a8w8_blockscale_cktile_192x256x128_4x2x1_16x16x128_intrawave_0x1x0_1,2290.86,346.23,0.0
gfx950,256,28672,7168,3072,cktile,28,0,732.4157,a8w8_blockscale_cktile_192x256x128_4x2x1_16x16x128_intrawave_0x1x0_3,1724.05,711.54,0.0
gfx950,256,28672,7168,7168,cktile,27,0,1374.3422,a8w8_blockscale_cktile_192x256x128_4x2x1_16x16x128_intrawave_0x1x0_2,2143.82,486.01,0.0
gfx950,256,28672,7168,16384,cktile,28,0,2949.2446,a8w8_blockscale_cktile_192x256x128_4x2x1_16x16x128_intrawave_0x1x0_3,2283.47,338.47,0.0
gfx950,256,32768,7168,384,ck,13,0,219.0743,a8w8_blockscale_bpreshuffle_1x128x128_256x64x256x128_16x16_16x16_8x32x1_8x32x1_1x32x1x8_8_2x1_intrawave_v1,823.41,2214.31,0.0
gfx950,256,32768,7168,3072,ck,13,0,798.8939,a8w8_blockscale_bpreshuffle_1x128x128_256x64x256x128_16x16_16x16_8x32x1_8x32x1_1x32x1x8_8_2x1_intrawave_v1,1806.38,741.58,0.0
gfx950,256,32768,7168,7168,cktile,29,0,1546.2136,a8w8_blockscale_cktile_192x256x128_4x2x1_16x16x128_intrawave_0x1x0_4,2177.74,488.95,0.0
gfx950,256,32768,7168,16384,cktile,11,0,3341.5664,a8w8_blockscale_cktile_192x256x128_4x2x1_16x16x128_intrawave_0x1x0_1,2303.29,336.39,0.0
gfx950,256,40960,7168,3072,ck,13,0,1004.5016,a8w8_blockscale_bpreshuffle_1x128x128_256x64x256x128_16x16_16x16_8x32x1_8x32x1_1x32x1x8_8_2x1_intrawave_v1,1795.8,731.76,0.0
gfx950,256,40960,7168,7168,cktile,27,0,1915.2094,a8w8_blockscale_cktile_192x256x128_4x2x1_16x16x128_intrawave_0x1x0_2,2197.71,486.73,0.0
gfx950,256,40960,7168,16384,cktile,11,0,4182.5138,a8w8_blockscale_cktile_192x256x128_4x2x1_16x16x128_intrawave_0x1x0_1,2300.23,328.92,0.0
gfx950,256,49152,7168,3072,cktile,11,0,1205.1682,a8w8_blockscale_cktile_192x256x128_4x2x1_16x16x128_intrawave_0x1x0_1,1796.15,728.25,0.0
gfx950,256,49152,7168,7168,cktile,11,0,2310.8287,a8w8_blockscale_cktile_192x256x128_4x2x1_16x16x128_intrawave_0x1x0_1,2185.74,479.63,0.0
gfx950,256,49152,7168,16384,cktile,28,0,5061.2319,a8w8_blockscale_cktile_192x256x128_4x2x1_16x16x128_intrawave_0x1x0_3,2281.04,321.54,0.0
gfx950,256,57344,7168,3072,ck,13,0,1394.5495,a8w8_blockscale_bpreshuffle_1x128x128_256x64x256x128_16x16_16x16_8x32x1_8x32x1_1x32x1x8_8_2x1_intrawave_v1,1810.94,731.61,0.0
gfx950,256,57344,7168,7168,cktile,29,0,2679.8626,a8w8_blockscale_cktile_192x256x128_4x2x1_16x16x128_intrawave_0x1x0_4,2198.88,479.32,0.0
gfx950,256,57344,7168,16384,cktile,11,0,5898.9638,a8w8_blockscale_cktile_192x256x128_4x2x1_16x16x128_intrawave_0x1x0_1,2283.29,318.54,0.0
gfx950,256,65536,7168,3072,cktile,29,0,1590.6561,a8w8_blockscale_cktile_192x256x128_4x2x1_16x16x128_intrawave_0x1x0_4,1814.48,731.06,0.0
gfx950,256,65536,7168,7168,cktile,11,0,3042.0038,a8w8_blockscale_cktile_192x256x128_4x2x1_16x16x128_intrawave_0x1x0_1,2213.84,480.17,0.0
gfx950,256,65536,7168,16384,cktile,11,0,6861.8887,a8w8_blockscale_cktile_192x256x128_4x2x1_16x16x128_intrawave_0x1x0_1,2243.28,310.51,0.0
gfx950,256,1,65536,1536,ck,6,0,17.9824,a8w8_blockscale_bpreshuffle_1x128x128_256x16x128x256_16x16_16x16_16x16x1_16x16x1_1x16x1x16_8_1x2_intrawave_v1,11.2,5605.25,0.0
gfx950,256,2,65536,1536,ck,6,0,17.7956,a8w8_blockscale_bpreshuffle_1x128x128_256x16x128x256_16x16_16x16_16x16x1_16x16x1_1x16x1x16_8_1x2_intrawave_v1,22.63,5671.54,0.0
gfx950,256,4,65536,1536,ck,6,0,18.1362,a8w8_blockscale_bpreshuffle_1x128x128_256x16x128x256_16x16_16x16_16x16x1_16x16x1_1x16x1x16_8_1x2_intrawave_v1,44.4,5579.65,0.0
gfx950,256,8,65536,1536,ck,6,0,18.0681,a8w8_blockscale_bpreshuffle_1x128x128_256x16x128x256_16x16_16x16_16x16x1_16x16x1_1x16x1x16_8_1x2_intrawave_v1,89.14,5630.04,0.0
gfx950,256,16,65536,1536,ck,6,0,18.7797,a8w8_blockscale_bpreshuffle_1x128x128_256x16x128x256_16x16_16x16_16x16x1_16x16x1_1x16x1x16_8_1x2_intrawave_v1,171.53,5473.2,0.0
gfx950,256,32,65536,1536,ck,11,0,19.6744,a8w8_blockscale_bpreshuffle_1x128x128_256x32x128x256_16x16_16x16_16x16x1_16x16x1_1x32x1x8_8_2x1_intrawave_v1,327.45,5332.14,0.0
gfx950,256,48,65536,1536,ck,1,0,22.5881,a8w8_blockscale_bpreshuffle_1x128x128_256x64x128x128_16x16_16x16_8x32x1_8x32x1_1x32x1x8_8_2x1_intrawave_v3,427.82,4738.27,0.0
gfx950,256,64,65536,1536,ck,1,0,23.2278,a8w8_blockscale_bpreshuffle_1x128x128_256x64x128x128_16x16_16x16_8x32x1_8x32x1_1x32x1x8_8_2x1_intrawave_v3,554.72,4699.12,0.0
gfx950,256,80,65536,1536,asm,15,1,27.1551,_ZN5aiter42fp8gemm_bf16_blockscale_BpreShuffle_80x128E,593.12,4097.64,0.0
gfx950,256,96,65536,1536,ck,13,0,28.6977,a8w8_blockscale_bpreshuffle_1x128x128_256x64x256x128_16x16_16x16_8x32x1_8x32x1_1x32x1x8_8_2x1_intrawave_v1,673.48,3951.32,0.0
gfx950,256,112,65536,1536,ck,13,0,29.2416,a8w8_blockscale_bpreshuffle_1x128x128_256x64x256x128_16x16_16x16_8x32x1_8x32x1_1x32x1x8_8_2x1_intrawave_v1,771.11,3950.38,0.0
gfx950,256,128,65536,1536,ck,13,0,29.2925,a8w8_blockscale_bpreshuffle_1x128x128_256x64x256x128_16x16_16x16_8x32x1_8x32x1_1x32x1x8_8_2x1_intrawave_v1,879.74,4015.95,0.0
gfx950,256,144,65536,1536,cktile,27,0,37.8192,a8w8_blockscale_cktile_192x256x128_4x2x1_16x16x128_intrawave_0x1x0_2,766.57,3166.62,0.0
gfx950,256,160,65536,1536,ck,13,0,38.6723,a8w8_blockscale_bpreshuffle_1x128x128_256x64x256x128_16x16_16x16_8x32x1_8x32x1_1x32x1x8_8_2x1_intrawave_v1,832.95,3151.62,0.0
gfx950,256,176,65536,1536,cktile,29,0,38.8504,a8w8_blockscale_cktile_192x256x128_4x2x1_16x16x128_intrawave_0x1x0_4,912.05,3191.79,0.0
gfx950,256,192,65536,1536,cktile,27,0,39.5712,a8w8_blockscale_cktile_192x256x128_4x2x1_16x16x128_intrawave_0x1x0_2,976.84,3187.27,0.0
gfx950,256,208,65536,1536,ck,13,0,45.9437,a8w8_blockscale_bpreshuffle_1x128x128_256x64x256x128_16x16_16x16_8x32x1_8x32x1_1x32x1x8_8_2x1_intrawave_v1,911.46,2791.37,0.0
gfx950,256,224,65536,1536,ck,13,0,46.3055,a8w8_blockscale_bpreshuffle_1x128x128_256x64x256x128_16x16_16x16_8x32x1_8x32x1_1x32x1x8_8_2x1_intrawave_v1,973.9,2815.38,0.0
gfx950,256,240,65536,1536,ck,13,0,47.3996,a8w8_blockscale_bpreshuffle_1x128x128_256x64x256x128_16x16_16x16_8x32x1_8x32x1_1x32x1x8_8_2x1_intrawave_v1,1019.38,2795.15,0.0
gfx950,256,256,65536,1536,ck,13,0,48.1176,a8w8_blockscale_bpreshuffle_1x128x128_256x64x256x128_16x16_16x16_8x32x1_8x32x1_1x32x1x8_8_2x1_intrawave_v1,1071.12,2797.54,0.0
gfx950,256,288,65536,1536,ck,13,0,62.6117,a8w8_blockscale_bpreshuffle_1x128x128_256x64x256x128_16x16_16x16_8x32x1_8x32x1_1x32x1x8_8_2x1_intrawave_v1,926.06,2217.71,0.0
gfx950,256,320,65536,1536,ck,13,0,63.4152,a8w8_blockscale_bpreshuffle_1x128x128_256x64x256x128_16x16_16x16_8x32x1_8x32x1_1x32x1x8_8_2x1_intrawave_v1,1015.92,2256.52,0.0
gfx950,256,352,65536,1536,ck,13,0,65.9397,a8w8_blockscale_bpreshuffle_1x128x128_256x64x256x128_16x16_16x16_8x32x1_8x32x1_1x32x1x8_8_2x1_intrawave_v1,1074.72,2234.49,0.0
gfx950,256,384,65536,1536,ck,13,0,67.7869,a8w8_blockscale_bpreshuffle_1x128x128_256x64x256x128_16x16_16x16_8x32x1_8x32x1_1x32x1x8_8_2x1_intrawave_v1,1140.48,2236.2,0.0
gfx950,256,416,65536,1536,ck,13,0,76.6538,a8w8_blockscale_bpreshuffle_1x128x128_256x64x256x128_16x16_16x16_8x32x1_8x32x1_1x32x1x8_8_2x1_intrawave_v1,1092.6,2032.88,0.0
gfx950,256,448,65536,1536,ck,13,0,77.5902,a8w8_blockscale_bpreshuffle_1x128x128_256x64x256x128_16x16_16x16_8x32x1_8x32x1_1x32x1x8_8_2x1_intrawave_v1,1162.44,2063.04,0.0
gfx950,256,480,65536,1536,ck,13,0,83.7332,a8w8_blockscale_bpreshuffle_1x128x128_256x64x256x128_16x16_16x16_8x32x1_8x32x1_1x32x1x8_8_2x1_intrawave_v1,1154.1,1962.37,0.0
gfx950,256,512,65536,1536,ck,13,0,85.239,a8w8_blockscale_bpreshuffle_1x128x128_256x64x256x128_16x16_16x16_8x32x1_8x32x1_1x32x1x8_8_2x1_intrawave_v1,1209.3,1977.48,0.0
gfx950,256,544,65536,1536,ck,13,0,96.6316,a8w8_blockscale_bpreshuffle_1x128x128_256x64x256x128_16x16_16x16_8x32x1_8x32x1_1x32x1x8_8_2x1_intrawave_v1,1133.39,1788.26,0.0
gfx950,256,576,65536,1536,ck,13,0,99.5671,a8w8_blockscale_bpreshuffle_1x128x128_256x64x256x128_16x16_16x16_8x32x1_8x32x1_1x32x1x8_8_2x1_intrawave_v1,1164.68,1778.15,0.0
gfx950,256,608,65536,1536,ck,13,0,102.9427,a8w8_blockscale_bpreshuffle_1x128x128_256x64x256x128_16x16_16x16_8x32x1_8x32x1_1x32x1x8_8_2x1_intrawave_v1,1189.07,1761.07,0.0
gfx950,256,640,65536,1536,ck,13,0,107.4219,a8w8_blockscale_bpreshuffle_1x128x128_256x64x256x128_16x16_16x16_8x32x1_8x32x1_1x32x1x8_8_2x1_intrawave_v1,1199.47,1727.14,0.0
gfx950,256,672,65536,1536,ck,13,0,114.1332,a8w8_blockscale_bpreshuffle_1x128x128_256x64x256x128_16x16_16x16_8x32x1_8x32x1_1x32x1x8_8_2x1_intrawave_v1,1185.38,1662.76,0.0
gfx950,256,704,65536,1536,ck,13,0,113.2512,a8w8_blockscale_bpreshuffle_1x128x128_256x64x256x128_16x16_16x16_8x32x1_8x32x1_1x32x1x8_8_2x1_intrawave_v1,1251.5,1713.18,0.0
gfx950,256,736,65536,1536,ck,13,0,113.275,a8w8_blockscale_bpreshuffle_1x128x128_256x64x256x128_16x16_16x16_8x32x1_8x32x1_1x32x1x8_8_2x1_intrawave_v1,1308.11,1750.28,0.0
gfx950,256,768,65536,1536,ck,13,0,113.7736,a8w8_blockscale_bpreshuffle_1x128x128_256x64x256x128_16x16_16x16_8x32x1_8x32x1_1x32x1x8_8_2x1_intrawave_v1,1359.0,1779.91,0.0
gfx950,256,800,65536,1536,ck,13,0,133.2173,a8w8_blockscale_bpreshuffle_1x128x128_256x64x256x128_16x16_16x16_8x32x1_8x32x1_1x32x1x8_8_2x1_intrawave_v1,1209.01,1551.97,0.0
gfx950,256,832,65536,1536,ck,13,0,136.4445,a8w8_blockscale_bpreshuffle_1x128x128_256x64x256x128_16x16_16x16_8x32x1_8x32x1_1x32x1x8_8_2x1_intrawave_v1,1227.63,1546.37,0.0
gfx950,256,864,65536,1536,ck,13,0,133.2341,a8w8_blockscale_bpreshuffle_1x128x128_256x64x256x128_16x16_16x16_8x32x1_8x32x1_1x32x1x8_8_2x1_intrawave_v1,1305.57,1615.48,0.0
gfx950,256,896,65536,1536,ck,13,0,136.8969,a8w8_blockscale_bpreshuffle_1x128x128_256x64x256x128_16x16_16x16_8x32x1_8x32x1_1x32x1x8_8_2x1_intrawave_v1,1317.7,1603.25,0.0
gfx950,256,928,65536,1536,ck,13,0,150.2074,a8w8_blockscale_bpreshuffle_1x128x128_256x64x256x128_16x16_16x16_8x32x1_8x32x1_1x32x1x8_8_2x1_intrawave_v1,1243.82,1489.43,0.0
gfx950,256,960,65536,1536,ck,13,0,151.3766,a8w8_blockscale_bpreshuffle_1x128x128_256x64x256x128_16x16_16x16_8x32x1_8x32x1_1x32x1x8_8_2x1_intrawave_v1,1276.77,1505.96,0.0
gfx950,256,992,65536,1536,ck,13,0,163.1771,a8w8_blockscale_bpreshuffle_1x128x128_256x64x256x128_16x16_16x16_8x32x1_8x32x1_1x32x1x8_8_2x1_intrawave_v1,1223.92,1423.06,0.0
gfx950,256,1024,65536,1536,ck,13,0,165.9951,a8w8_blockscale_bpreshuffle_1x128x128_256x64x256x128_16x16_16x16_8x32x1_8x32x1_1x32x1x8_8_2x1_intrawave_v1,1241.95,1424.46,0.0
gfx950,256,1088,65536,1536,ck,13,0,182.0016,a8w8_blockscale_bpreshuffle_1x128x128_256x64x256x128_16x16_16x16_8x32x1_8x32x1_1x32x1x8_8_2x1_intrawave_v1,1203.52,1345.82,0.0
gfx950,256,1152,65536,1536,ck,13,0,162.6169,a8w8_blockscale_bpreshuffle_1x128x128_256x64x256x128_16x16_16x16_8x32x1_8x32x1_1x32x1x8_8_2x1_intrawave_v1,1426.22,1558.43,0.0
gfx950,256,1216,65536,1536,ck,13,0,176.0535,a8w8_blockscale_bpreshuffle_1x128x128_256x64x256x128_16x16_16x16_8x32x1_8x32x1_1x32x1x8_8_2x1_intrawave_v1,1390.56,1487.7,0.0
gfx950,256,1280,65536,1536,ck,13,0,180.0387,a8w8_blockscale_bpreshuffle_1x128x128_256x64x256x128_16x16_16x16_8x32x1_8x32x1_1x32x1x8_8_2x1_intrawave_v1,1431.35,1501.91,0.0
gfx950,256,1344,65536,1536,ck,13,0,201.4057,a8w8_blockscale_bpreshuffle_1x128x128_256x64x256x128_16x16_16x16_8x32x1_8x32x1_1x32x1x8_8_2x1_intrawave_v1,1343.47,1384.71,0.0
gfx950,256,1408,65536,1536,ck,13,0,201.7593,a8w8_blockscale_bpreshuffle_1x128x128_256x64x256x128_16x16_16x16_8x32x1_8x32x1_1x32x1x8_8_2x1_intrawave_v1,1404.98,1424.35,0.0
gfx950,256,1472,65536,1536,ck,13,0,208.785,a8w8_blockscale_bpreshuffle_1x128x128_256x64x256x128_16x16_16x16_8x32x1_8x32x1_1x32x1x8_8_2x1_intrawave_v1,1419.42,1417.07,0.0
gfx950,256,1536,65536,1536,ck,13,0,211.5295,a8w8_blockscale_bpreshuffle_1x128x128_256x64x256x128_16x16_16x16_8x32x1_8x32x1_1x32x1x8_8_2x1_intrawave_v1,1461.91,1438.8,0.0
gfx950,256,1600,65536,1536,ck,13,0,226.4383,a8w8_blockscale_bpreshuffle_1x128x128_256x64x256x128_16x16_16x16_8x32x1_8x32x1_1x32x1x8_8_2x1_intrawave_v1,1422.56,1381.55,0.0
gfx950,256,1664,65536,1536,ck,13,0,227.4956,a8w8_blockscale_bpreshuffle_1x128x128_256x64x256x128_16x16_16x16_8x32x1_8x32x1_1x32x1x8_8_2x1_intrawave_v1,1472.59,1412.44,0.0
gfx950,256,1728,65536,1536,ck,13,0,235.3912,a8w8_blockscale_bpreshuffle_1x128x128_256x64x256x128_16x16_16x16_8x32x1_8x32x1_1x32x1x8_8_2x1_intrawave_v1,1477.93,1401.11,0.0
gfx950,256,1792,65536,1536,ck,13,0,245.9946,a8w8_blockscale_bpreshuffle_1x128x128_256x64x256x128_16x16_16x16_8x32x1_8x32x1_1x32x1x8_8_2x1_intrawave_v1,1466.61,1375.22,0.0
gfx950,256,1856,65536,1536,ck,13,0,263.9332,a8w8_blockscale_bpreshuffle_1x128x128_256x64x256x128_16x16_16x16_8x32x1_8x32x1_1x32x1x8_8_2x1_intrawave_v1,1415.75,1313.91,0.0
gfx950,256,1920,65536,1536,ck,13,0,278.5861,a8w8_blockscale_bpreshuffle_1x128x128_256x64x256x128_16x16_16x16_8x32x1_8x32x1_1x32x1x8_8_2x1_intrawave_v1,1387.53,1275.26,0.0
gfx950,256,1984,65536,1536,ck,13,0,286.1291,a8w8_blockscale_bpreshuffle_1x128x128_256x64x256x128_16x16_16x16_8x32x1_8x32x1_1x32x1x8_8_2x1_intrawave_v1,1395.99,1271.31,0.0
gfx950,256,2048,65536,1536,ck,13,0,329.7442,a8w8_blockscale_bpreshuffle_1x128x128_256x64x256x128_16x16_16x16_8x32x1_8x32x1_1x32x1x8_8_2x1_intrawave_v1,1250.41,1128.89,0.0
gfx950,256,4096,65536,1536,ck,13,0,629.476,a8w8_blockscale_bpreshuffle_1x128x128_256x64x256x128_16x16_16x16_8x32x1_8x32x1_1x32x1x8_8_2x1_intrawave_v1,1310.03,1022.8,0.0
gfx950,256,6144,65536,1536,ck,13,0,897.5112,a8w8_blockscale_bpreshuffle_1x128x128_256x64x256x128_16x16_16x16_8x32x1_8x32x1_1x32x1x8_8_2x1_intrawave_v1,1378.2,1019.94,0.0
gfx950,256,8192,65536,1536,ck,13,0,1209.3381,a8w8_blockscale_bpreshuffle_1x128x128_256x64x256x128_16x16_16x16_8x32x1_8x32x1_1x32x1x8_8_2x1_intrawave_v1,1363.78,981.52,0.0
gfx950,256,10240,65536,1536,ck,13,0,1489.8037,a8w8_blockscale_bpreshuffle_1x128x128_256x64x256x128_16x16_16x16_8x32x1_8x32x1_1x32x1x8_8_2x1_intrawave_v1,1383.8,979.03,0.0
gfx950,256,12288,65536,1536,ck,13,0,1779.6911,a8w8_blockscale_bpreshuffle_1x128x128_256x64x256x128_16x16_16x16_8x32x1_8x32x1_1x32x1x8_8_2x1_intrawave_v1,1390.07,972.16,0.0
gfx950,256,14336,65536,1536,ck,13,0,2073.5881,a8w8_blockscale_bpreshuffle_1x128x128_256x64x256x128_16x16_16x16_8x32x1_8x32x1_1x32x1x8_8_2x1_intrawave_v1,1391.9,965.35,0.0
gfx950,256,16384,65536,1536,ck,13,0,2346.8341,a8w8_blockscale_bpreshuffle_1x128x128_256x64x256x128_16x16_16x16_8x32x1_8x32x1_1x32x1x8_8_2x1_intrawave_v1,1405.53,968.67,0.0
gfx950,256,20480,65536,1536,ck,13,0,2945.765,a8w8_blockscale_bpreshuffle_1x128x128_256x64x256x128_16x16_16x16_8x32x1_8x32x1_1x32x1x8_8_2x1_intrawave_v1,1399.69,956.11,0.0
gfx950,256,24576,65536,1536,ck,13,0,3539.3591,a8w8_blockscale_bpreshuffle_1x128x128_256x64x256x128_16x16_16x16_8x32x1_8x32x1_1x32x1x8_8_2x1_intrawave_v1,1397.94,949.22,0.0
gfx950,256,28672,65536,1536,ck,13,0,4134.3781,a8w8_blockscale_bpreshuffle_1x128x128_256x64x256x128_16x16_16x16_8x32x1_8x32x1_1x32x1x8_8_2x1_intrawave_v1,1396.2,943.99,0.0
gfx950,256,32768,65536,1536,asm,25,1,6555.4539,_ZN5aiter43fp8gemm_bf16_blockscale_BpreShuffle_128x128E,1006.35,678.21,0.0
gfx950,256,40960,65536,1536,asm,25,1,8297.9034,_ZN5aiter43fp8gemm_bf16_blockscale_BpreShuffle_128x128E,993.79,666.71,0.0
gfx950,256,49152,65536,1536,asm,25,1,9802.4377,_ZN5aiter43fp8gemm_bf16_blockscale_BpreShuffle_128x128E,1009.5,675.2,0.0
gfx950,256,57344,65536,1536,asm,25,1,11610.4829,_ZN5aiter43fp8gemm_bf16_blockscale_BpreShuffle_128x128E,994.35,663.62,0.0
gfx950,256,65536,65536,1536,asm,25,1,13048.6293,_ZN5aiter43fp8gemm_bf16_blockscale_BpreShuffle_128x128E,1011.15,673.73,0.0
gfx950,256,1,7168,768,ck,7,0,4.8766,a8w8_blockscale_bpreshuffle_1x128x128_256x16x64x256_16x16_16x16_16x16x1_16x16x1_1x16x1x16_4_1x1_intrawave_v1,2.26,1131.96,0.0
gfx950,256,2,7168,768,ck,12,0,5.2648,a8w8_blockscale_bpreshuffle_1x128x128_256x32x64x256_16x16_16x16_16x16x1_16x16x1_1x32x1x8_8_2x1_intrawave_v1,4.18,1051.37,0.0
gfx950,256,4,7168,768,ck,7,0,5.4122,a8w8_blockscale_bpreshuffle_1x128x128_256x16x64x256_16x16_16x16_16x16x1_16x16x1_1x16x1x16_4_1x1_intrawave_v1,8.14,1028.31,0.0
gfx950,256,8,7168,768,ck,7,0,5.4118,a8w8_blockscale_bpreshuffle_1x128x128_256x16x64x256_16x16_16x16_16x16x1_16x16x1_1x16x1x16_4_1x1_intrawave_v1,16.28,1039.55,0.0
gfx950,256,16,7168,768,ck,7,0,4.8698,a8w8_blockscale_bpreshuffle_1x128x128_256x16x64x256_16x16_16x16_16x16x1_16x16x1_1x16x1x16_4_1x1_intrawave_v1,36.17,1180.07,0.0
gfx950,256,32,7168,768,ck,7,0,5.0509,a8w8_blockscale_bpreshuffle_1x128x128_256x16x64x256_16x16_16x16_16x16x1_16x16x1_1x16x1x16_4_1x1_intrawave_v1,69.75,1185.6,0.0
gfx950,256,48,7168,768,ck,7,0,5.4084,a8w8_blockscale_bpreshuffle_1x128x128_256x16x64x256_16x16_16x16_16x16x1_16x16x1_1x16x1x16_4_1x1_intrawave_v1,97.72,1151.91,0.0
gfx950,256,64,7168,768,ck,7,0,6.1026,a8w8_blockscale_bpreshuffle_1x128x128_256x16x64x256_16x16_16x16_16x16x1_16x16x1_1x16x1x16_4_1x1_intrawave_v1,115.47,1060.48,0.0
gfx950,256,80,7168,768,ck,7,0,6.3177,a8w8_blockscale_bpreshuffle_1x128x128_256x16x64x256_16x16_16x16_16x16x1_16x16x1_1x16x1x16_4_1x1_intrawave_v1,139.42,1062.62,0.0
gfx950,256,96,7168,768,ck,7,0,6.5141,a8w8_blockscale_bpreshuffle_1x128x128_256x16x64x256_16x16_16x16_16x16x1_16x16x1_1x16x1x16_4_1x1_intrawave_v1,162.26,1067.69,0.0
gfx950,256,112,7168,768,ck,6,0,6.1142,a8w8_blockscale_bpreshuffle_1x128x128_256x16x128x256_16x16_16x16_16x16x1_16x16x1_1x16x1x16_8_1x2_intrawave_v1,201.68,1177.04,0.0
gfx950,256,128,7168,768,ck,4,0,6.671,a8w8_blockscale_bpreshuffle_1x128x128_256x16x128x128_8x16_16x16_16x16x1_8x32x1_1x16x1x16_8_1x2_intrawave_v1,211.26,1115.03,0.0
gfx950,256,144,7168,768,ck,7,0,6.816,a8w8_blockscale_bpreshuffle_1x128x128_256x16x64x256_16x16_16x16_16x16x1_16x16x1_1x16x1x16_4_1x1_intrawave_v1,232.61,1126.76,0.0
gfx950,256,160,7168,768,ck,12,0,6.8934,a8w8_blockscale_bpreshuffle_1x128x128_256x32x64x256_16x16_16x16_16x16x1_16x16x1_1x32x1x8_8_2x1_intrawave_v1,255.55,1149.17,0.0
gfx950,256,176,7168,768,ck,12,0,6.9278,a8w8_blockscale_bpreshuffle_1x128x128_256x32x64x256_16x16_16x16_16x16x1_16x16x1_1x32x1x8_8_2x1_intrawave_v1,279.71,1178.34,0.0
gfx950,256,192,7168,768,ck,12,0,6.7164,a8w8_blockscale_bpreshuffle_1x128x128_256x32x64x256_16x16_16x16_16x16x1_16x16x1_1x32x1x8_8_2x1_intrawave_v1,314.74,1251.41,0.0
gfx950,256,208,7168,768,ck,4,0,8.0736,a8w8_blockscale_bpreshuffle_1x128x128_256x16x128x128_8x16_16x16_16x16x1_8x32x1_1x16x1x16_8_1x2_intrawave_v1,283.65,1070.98,0.0
gfx950,256,224,7168,768,ck,11,0,8.2633,a8w8_blockscale_bpreshuffle_1x128x128_256x32x128x256_16x16_16x16_16x16x1_16x16x1_1x32x1x8_8_2x1_intrawave_v1,298.46,1075.64,0.0
gfx950,256,240,7168,768,ck,9,0,8.0222,a8w8_blockscale_bpreshuffle_1x128x128_256x32x128x128_16x16_16x16_8x32x1_8x32x1_1x32x1x8_8_2x1_intrawave_v1,329.39,1138.09,0.0
gfx950,256,256,7168,768,asm,2,1,8.6386,_ZN5aiter42fp8gemm_bf16_blockscale_BpreShuffle_64x128E,326.28,1084.86,0.0
gfx950,256,288,7168,768,asm,3,1,9.412,_ZN5aiter42fp8gemm_bf16_blockscale_BpreShuffle_80x128E,336.9,1047.07,0.0
gfx950,256,320,7168,768,asm,3,1,9.6195,_ZN5aiter42fp8gemm_bf16_blockscale_BpreShuffle_80x128E,366.26,1074.72,0.0
gfx950,256,416,7168,768,ck,9,0,10.4811,a8w8_blockscale_bpreshuffle_1x128x128_256x32x128x128_16x16_16x16_8x32x1_8x32x1_1x32x1x8_8_2x1_intrawave_v1,436.99,1124.72,0.0
gfx950,256,448,7168,768,ck,14,0,11.1219,a8w8_blockscale_bpreshuffle_1x128x128_256x64x128x128_16x16_16x16_8x32x1_8x32x1_1x32x1x8_8_2x1_intrawave_v1,443.49,1103.37,0.0
gfx950,256,480,7168,768,ck,14,0,11.6811,a8w8_blockscale_bpreshuffle_1x128x128_256x64x128x128_16x16_16x16_8x32x1_8x32x1_1x32x1x8_8_2x1_intrawave_v1,452.43,1091.93,0.0
gfx950,256,512,7168,768,ck,14,0,11.3255,a8w8_blockscale_bpreshuffle_1x128x128_256x64x128x128_16x16_16x16_8x32x1_8x32x1_1x32x1x8_8_2x1_intrawave_v1,497.74,1168.89,0.0
gfx950,256,544,7168,768,ck,14,0,11.8468,a8w8_blockscale_bpreshuffle_1x128x128_256x64x128x128_16x16_16x16_8x32x1_8x32x1_1x32x1x8_8_2x1_intrawave_v1,505.58,1158.25,0.0
gfx950,256,576,7168,768,ck,14,0,11.564,a8w8_blockscale_bpreshuffle_1x128x128_256x64x128x128_16x16_16x16_8x32x1_8x32x1_1x32x1x8_8_2x1_intrawave_v1,548.41,1228.37,0.0
gfx950,256,672,7168,768,ck,9,0,14.1142,a8w8_blockscale_bpreshuffle_1x128x128_256x32x128x128_16x16_16x16_8x32x1_8x32x1_1x32x1x8_8_2x1_intrawave_v1,524.21,1109.16,0.0
gfx950,256,800,7168,768,ck,9,0,15.5291,a8w8_blockscale_bpreshuffle_1x128x128_256x32x128x128_16x16_16x16_8x32x1_8x32x1_1x32x1x8_8_2x1_intrawave_v1,567.2,1132.6,0.0
gfx950,256,832,7168,768,ck,14,0,14.9381,a8w8_blockscale_bpreshuffle_1x128x128_256x64x128x128_16x16_16x16_8x32x1_8x32x1_1x32x1x8_8_2x1_intrawave_v1,613.22,1209.76,0.0001
gfx950,256,864,7168,768,ck,8,0,15.9322,a8w8_blockscale_bpreshuffle_1x128x128_256x32x256x128_16x16_16x16_8x32x1_8x32x1_1x32x1x8_8_2x1_intrawave_v1,597.07,1164.62,0.0
gfx950,256,896,7168,768,ck,9,0,16.8177,a8w8_blockscale_bpreshuffle_1x128x128_256x32x128x128_16x16_16x16_8x32x1_8x32x1_1x32x1x8_8_2x1_intrawave_v1,586.58,1132.03,0.0
gfx950,256,928,7168,768,ck,9,0,17.3541,a8w8_blockscale_bpreshuffle_1x128x128_256x32x128x128_16x16_16x16_8x32x1_8x32x1_1x32x1x8_8_2x1_intrawave_v1,588.76,1124.89,0.0
gfx950,256,992,7168,768,ck,8,0,18.8528,a8w8_blockscale_bpreshuffle_1x128x128_256x32x256x128_16x16_16x16_8x32x1_8x32x1_1x32x1x8_8_2x1_intrawave_v1,579.33,1086.75,0.0
gfx950,256,1024,7168,768,ck,13,0,18.0391,a8w8_blockscale_bpreshuffle_1x128x128_256x64x256x128_16x16_16x16_8x32x1_8x32x1_1x32x1x8_8_2x1_intrawave_v1,624.99,1162.56,0.0
gfx950,256,1088,7168,768,ck,13,0,17.8751,a8w8_blockscale_bpreshuffle_1x128x128_256x64x256x128_16x16_16x16_8x32x1_8x32x1_1x32x1x8_8_2x1_intrawave_v1,670.15,1227.3,0.0
gfx950,256,1152,7168,768,ck,13,0,18.1418,a8w8_blockscale_bpreshuffle_1x128x128_256x64x256x128_16x16_16x16_8x32x1_8x32x1_1x32x1x8_8_2x1_intrawave_v1,699.14,1262.54,0.0
gfx950,256,1216,7168,768,ck,9,0,20.2122,a8w8_blockscale_bpreshuffle_1x128x128_256x32x128x128_16x16_16x16_8x32x1_8x32x1_1x32x1x8_8_2x1_intrawave_v1,662.38,1181.04,0.0
gfx950,256,1280,7168,768,ck,9,0,20.4691,a8w8_blockscale_bpreshuffle_1x128x128_256x32x128x128_16x16_16x16_8x32x1_8x32x1_1x32x1x8_8_2x1_intrawave_v1,688.49,1213.45,0.0
gfx950,256,1344,7168,768,ck,14,0,20.6783,a8w8_blockscale_bpreshuffle_1x128x128_256x64x128x128_16x16_16x16_8x32x1_8x32x1_1x32x1x8_8_2x1_intrawave_v1,715.61,1247.92,0.0001
gfx950,256,1408,7168,768,ck,14,0,21.2514,a8w8_blockscale_bpreshuffle_1x128x128_256x64x128x128_16x16_16x16_8x32x1_8x32x1_1x32x1x8_8_2x1_intrawave_v1,729.46,1259.75,0.0001
gfx950,256,1472,7168,768,ck,9,0,22.9843,a8w8_blockscale_bpreshuffle_1x128x128_256x32x128x128_16x16_16x16_8x32x1_8x32x1_1x32x1x8_8_2x1_intrawave_v1,705.12,1206.83,0.0
gfx950,256,1536,7168,768,ck,14,0,23.4163,a8w8_blockscale_bpreshuffle_1x128x128_256x64x128x128_16x16_16x16_8x32x1_8x32x1_1x32x1x8_8_2x1_intrawave_v1,722.21,1225.85,0.0001
gfx950,256,1600,7168,768,ck,14,0,23.7083,a8w8_blockscale_bpreshuffle_1x128x128_256x64x128x128_16x16_16x16_8x32x1_8x32x1_1x32x1x8_8_2x1_intrawave_v1,743.03,1251.52,0.0001
gfx950,256,1664,7168,768,ck,14,0,24.0231,a8w8_blockscale_bpreshuffle_1x128x128_256x64x128x128_16x16_16x16_8x32x1_8x32x1_1x32x1x8_8_2x1_intrawave_v1,762.63,1275.36,0.0002
gfx950,256,1728,7168,768,ck,14,0,24.746,a8w8_blockscale_bpreshuffle_1x128x128_256x64x128x128_16x16_16x16_8x32x1_8x32x1_1x32x1x8_8_2x1_intrawave_v1,768.83,1277.17,0.0002
gfx950,256,1792,7168,768,ck,14,0,26.2256,a8w8_blockscale_bpreshuffle_1x128x128_256x64x128x128_16x16_16x16_8x32x1_8x32x1_1x32x1x8_8_2x1_intrawave_v1,752.32,1241.97,0.0002
gfx950,256,1856,7168,768,ck,14,0,26.8292,a8w8_blockscale_bpreshuffle_1x128x128_256x64x128x128_16x16_16x16_8x32x1_8x32x1_1x32x1x8_8_2x1_intrawave_v1,761.66,1250.06,0.0002
gfx950,256,1920,7168,768,ck,9,0,28.8668,a8w8_blockscale_bpreshuffle_1x128x128_256x32x128x128_16x16_16x16_8x32x1_8x32x1_1x32x1x8_8_2x1_intrawave_v1,732.3,1195.31,0.0
gfx950,256,1984,7168,768,ck,8,0,28.9257,a8w8_blockscale_bpreshuffle_1x128x128_256x32x256x128_16x16_16x16_8x32x1_8x32x1_1x32x1x8_8_2x1_intrawave_v1,755.17,1226.29,0.0
gfx950,256,2048,7168,768,ck,1,0,30.4675,a8w8_blockscale_bpreshuffle_1x128x128_256x64x128x128_16x16_16x16_8x32x1_8x32x1_1x32x1x8_8_2x1_intrawave_v3,740.09,1195.96,0.0
gfx950,256,4096,7168,768,ck,13,0,51.0159,a8w8_blockscale_bpreshuffle_1x128x128_256x64x256x128_16x16_16x16_8x32x1_8x32x1_1x32x1x8_8_2x1_intrawave_v1,883.98,1320.59,0.0
gfx950,256,6144,7168,768,ck,13,0,71.5979,a8w8_blockscale_bpreshuffle_1x128x128_256x64x256x128_16x16_16x16_8x32x1_8x32x1_1x32x1x8_8_2x1_intrawave_v1,944.8,1373.0,0.0
gfx950,256,8192,7168,768,ck,13,0,90.4061,a8w8_blockscale_bpreshuffle_1x128x128_256x64x256x128_16x16_16x16_8x32x1_8x32x1_1x32x1x8_8_2x1_intrawave_v1,997.66,1429.52,0.0
gfx950,256,10240,7168,768,ck,13,0,108.0158,a8w8_blockscale_bpreshuffle_1x128x128_256x64x256x128_16x16_16x16_8x32x1_8x32x1_1x32x1x8_8_2x1_intrawave_v1,1043.76,1482.84,0.0
gfx950,256,12288,7168,768,ck,13,0,126.0927,a8w8_blockscale_bpreshuffle_1x128x128_256x64x256x128_16x16_16x16_8x32x1_8x32x1_1x32x1x8_8_2x1_intrawave_v1,1072.95,1515.58,0.0
gfx950,256,14336,7168,768,ck,13,0,144.6057,a8w8_blockscale_bpreshuffle_1x128x128_256x64x256x128_16x16_16x16_8x32x1_8x32x1_1x32x1x8_8_2x1_intrawave_v1,1091.52,1535.46,0.0
gfx950,256,16768,7168,768,ck,13,0,162.865,a8w8_blockscale_bpreshuffle_1x128x128_256x64x256x128_16x16_16x16_8x32x1_8x32x1_1x32x1x8_8_2x1_intrawave_v1,1133.56,1588.86,0.0
gfx950,256,32768,7168,768,ck,13,0,306.7549,a8w8_blockscale_bpreshuffle_1x128x128_256x64x256x128_16x16_16x16_8x32x1_8x32x1_1x32x1x8_8_2x1_intrawave_v1,1176.11,1631.38,0.0
gfx950,256,24576,1536,7168,cktile,11,0,272.2943,a8w8_blockscale_cktile_192x256x128_4x2x1_16x16x128_intrawave_0x1x0_1,1987.43,964.65,0.0
gfx950,256,30720,1536,7168,cktile,11,0,354.8269,a8w8_blockscale_cktile_192x256x128_4x2x1_16x16x128_intrawave_0x1x0_1,1906.44,917.58,0.0
gfx950,256,32768,1536,7168,cktile,11,0,377.7027,a8w8_blockscale_cktile_192x256x128_4x2x1_16x16x128_intrawave_0x1x0_1,1910.38,917.53,0.0
gfx950,256,40960,1536,7168,cktile,11,0,466.7413,a8w8_blockscale_cktile_192x256x128_4x2x1_16x16x128_intrawave_0x1x0_1,1932.43,922.22,0.0

