aiter/configs/model_configs/qwen3_5_397b_fp4_tuned_fmoe.csv
cu_num,token,model_dim,inter_dim,expert,topk,act_type,dtype,q_dtype_a,q_dtype_w,q_type,use_g1u1,doweight_stage1,block_m,ksplit,us1,kernelName1,err1,us2,kernelName2,err2,us,run_1stage,xbf16,flat,tflops,bw,_tag
256,1,4096,256,512,10,ActivationType.Silu,torch.bfloat16,torch.float4_e2m1fn_x2,torch.float4_e2m1fn_x2,QuantType.per_1x32,1,0,16,0,19.3721,_ZN5aiter50fmoe_bf16_pertokenMXfp4_g1u1_flat_novs_silu_16x128E,0.0%,0.0,,0.0%,19.3721,1,1,1,3.25,0.0,
256,2,4096,256,512,10,ActivationType.Silu,torch.bfloat16,torch.float4_e2m1fn_x2,torch.float4_e2m1fn_x2,QuantType.per_1x32,1,0,16,0,20.3988,_ZN5aiter50fmoe_bf16_pertokenMXfp4_g1u1_flat_novs_silu_16x128E,0.0%,0.0,,0.0%,20.3988,1,1,1,6.17,0.0,
256,4,4096,256,512,10,ActivationType.Silu,torch.bfloat16,torch.float4_e2m1fn_x2,torch.float4_e2m1fn_x2,QuantType.per_1x32,1,0,16,0,20.858,_ZN5aiter50fmoe_bf16_pertokenMXfp4_g1u1_flat_novs_silu_16x128E,0.0%,0.0,,0.0%,20.858,1,1,1,12.07,0.0,
256,8,4096,256,512,10,ActivationType.Silu,torch.bfloat16,torch.float4_e2m1fn_x2,torch.float4_e2m1fn_x2,QuantType.per_1x32,1,0,16,0,26.8949,_ZN5aiter50fmoe_bf16_pertokenMXfp4_g1u1_flat_novs_silu_16x128E,0.0%,0.0,,0.0%,26.8949,1,1,1,18.71,0.0,
256,16,4096,256,512,10,ActivationType.Silu,torch.bfloat16,torch.float4_e2m1fn_x2,torch.float4_e2m1fn_x2,QuantType.per_1x32,1,0,16,0,55.31,_ZN5aiter50fmoe_bf16_pertokenMXfp4_g1u1_flat_novs_silu_16x256E,0.0%,0.0,,0.0%,55.31,1,1,1,18.20,0.0,
256,32,4096,256,512,10,ActivationType.Silu,torch.bfloat16,torch.float4_e2m1fn_x2,torch.float4_e2m1fn_x2,QuantType.per_1x32,1,0,32,0,50.2597,flydsl_moe1_afp4_wfp4_bf16_t32x64x256_w2,0.0%,31.5129,flydsl_moe2_afp4_wfp4_bf16_t16x128x256_atomic_persist_sbm32,0.1%,81.7726,0,0,0,24.62,19701.05,
256,64,4096,256,512,10,ActivationType.Silu,torch.bfloat16,torch.float4_e2m1fn_x2,torch.float4_e2m1fn_x2,QuantType.per_1x32,1,0,32,0,70.71889999999999,flydsl_moe1_afp4_wfp4_bf16_t32x64x256_w3,0.0%,43.8912,flydsl_moe2_afp4_wfp4_bf16_t32x128x256_atomic_bnt2,0.2%,114.6101,0,0,0,35.13,14059.84,
256,128,4096,256,512,10,ActivationType.Silu,torch.bfloat16,torch.float4_e2m1fn_x2,torch.float4_e2m1fn_x2,QuantType.per_1x32,1,0,32,0,87.4931,flydsl_moe1_afp4_wfp4_bf16_t32x32x256_w4,0.0%,53.1125,flydsl_moe2_afp4_wfp4_bf16_t16x256x256_atomic_bnt2_persist_sbm32,0.2%,140.6056,0,0,0,57.27,11466.01,
256,256,4096,256,512,10,ActivationType.Silu,torch.bfloat16,torch.float4_e2m1fn_x2,torch.float4_e2m1fn_x2,QuantType.per_1x32,1,0,32,0,95.837,flydsl_moe1_afp4_wfp4_bf16_t32x32x256_w4,0.0%,57.6025,flydsl_moe2_afp4_wfp4_bf16_t16x128x256_atomic_bnt2_sbm32,0.2%,153.4395,0,0,0,104.97,10517.23,
256,512,4096,256,512,10,ActivationType.Silu,torch.bfloat16,torch.float4_e2m1fn_x2,torch.float4_e2m1fn_x2,QuantType.per_1x32,1,0,32,0,99.6753,flydsl_moe1_afp4_wfp4_bf16_t32x32x256_w4,0.0%,60.7698,flydsl_moe2_afp4_wfp4_bf16_t16x128x256_atomic_bnt2_persist_sbm32,0.2%,160.4451,0,0,0,200.77,10077.62,
256,1024,4096,256,512,10,ActivationType.Silu,torch.bfloat16,torch.float4_e2m1fn_x2,torch.float4_e2m1fn_x2,QuantType.per_1x32,1,0,32,0,110.6725,flydsl_moe1_afp4_wfp4_bf16_t32x64x256_w3,0.0%,81.2088,flydsl_moe2_afp4_wfp4_bf16_t32x128x256_atomic_bnt2,0.2%,191.8813,0,0,0,335.75,8459.37,
256,2048,4096,256,512,10,ActivationType.Silu,torch.bfloat16,torch.float4_e2m1fn_x2,torch.float4_e2m1fn_x2,QuantType.per_1x32,1,0,64,0,119.997,flydsl_moe1_afp4_wfp4_bf16_t64x64x256_w4,0.0%,121.9695,flydsl_moe2_afp4_wfp4_bf16_t64x256x256_reduce_bnt2,0.0%,241.9665,0,0,0,532.51,6760.35,
256,4096,4096,256,512,10,ActivationType.Silu,torch.bfloat16,torch.float4_e2m1fn_x2,torch.float4_e2m1fn_x2,QuantType.per_1x32,1,0,64,0,149.0609,flydsl_moe1_afp4_wfp4_bf16_t64x128x256_w3_bnt0_xcd4,0.0%,201.2182,flydsl_moe2_afp4_wfp4_bf16_t64x256x256_reduce_persist,0.0%,350.2791,0,0,0,735.69,4741.77,
256,8192,4096,256,512,10,ActivationType.Silu,torch.bfloat16,torch.float4_e2m1fn_x2,torch.float4_e2m1fn_x2,QuantType.per_1x32,1,0,64,0,201.6767,flydsl_moe1_afp4_wfp4_bf16_t64x128x256_w2_bnt0_xcd4,0.0%,342.1527,flydsl_moe2_afp4_wfp4_bf16_t64x256x256_reduce_persist,0.0%,543.8294,0,0,0,947.72,3146.71,
256,16384,4096,256,512,10,ActivationType.Silu,torch.bfloat16,torch.float4_e2m1fn_x2,torch.float4_e2m1fn_x2,QuantType.per_1x32,1,0,64,0,321.84610000000004,flydsl_moe1_afp4_wfp4_bf16_t64x128x256_w2_bnt0_xcd4,0.0%,664.9736,flydsl_moe2_afp4_wfp4_bf16_t64x256x256_reduce_persist,0.0%,986.8197,0,0,0,1044.56,1836.14,
256,32768,4096,256,512,10,ActivationType.Silu,torch.bfloat16,torch.float4_e2m1fn_x2,torch.float4_e2m1fn_x2,QuantType.per_1x32,1,0,128,0,568.1335,flydsl_moe1_afp4_wfp4_bf16_t128x128x256_w2_bnt0_xcd4,0.0%,1325.2201,flydsl_moe2_afp4_wfp4_bf16_t64x256x256_reduce_sbm128,0.0%,1893.3536,0,0,0,1088.85,1063.33,
256,1,4096,256,512,10,ActivationType.Silu,torch.bfloat16,torch.float4_e2m1fn_x2,torch.float4_e2m1fn_x2,QuantType.per_1x32,1,0,32,0,16.5743,moe_ck2stages_gemm1_64x32x32x128_1x1_MulABScaleShuffled_v3_Nswizzle0_Quant3_MulRoutedWeight0_silu_FP4X2_FP4X2_B16,0.0,6.4429,moe_ck2stages_gemm2_256x32x128x128_1x4_MulABScaleExpertWeightShuffled_v3_Nswizzle0_Quant3_MulRoutedWeight1_FP4X2_FP4X2_B16,0.0012,23.0172,0,0,0,0.0,0.0,flydsl_fallback
256,2,4096,256,512,10,ActivationType.Silu,torch.bfloat16,torch.float4_e2m1fn_x2,torch.float4_e2m1fn_x2,QuantType.per_1x32,1,0,32,0,17.2652,moe_ck2stages_gemm1_64x32x32x128_1x1_MulABScaleShuffled_v3_Nswizzle0_Quant3_MulRoutedWeight0_silu_FP4X2_FP4X2_B16,0.0,8.4925,moe_ck2stages_gemm2_64x32x32x128_1x1_MulABScaleExpertWeightShuffled_v1_Nswizzle0_Quant3_MulRoutedWeight1_FP4X2_FP4X2_B16,0.0013,25.7577,0,0,0,0.0,0.0,flydsl_fallback
256,4,4096,256,512,10,ActivationType.Silu,torch.bfloat16,torch.float4_e2m1fn_x2,torch.float4_e2m1fn_x2,QuantType.per_1x32,1,0,32,0,19.4205,moe_ck2stages_gemm1_64x32x32x128_1x1_MulABScaleShuffled_v3_Nswizzle0_Quant3_MulRoutedWeight0_silu_FP4X2_FP4X2_B16,0.0,13.2991,moe_ck2stages_gemm2_64x32x32x128_1x1_MulABScaleExpertWeightShuffled_v1_Nswizzle0_Quant3_MulRoutedWeight1_FP4X2_FP4X2_B16,0.0016,32.7196,0,0,0,0.0,0.0,flydsl_fallback
256,8,4096,256,512,10,ActivationType.Silu,torch.bfloat16,torch.float4_e2m1fn_x2,torch.float4_e2m1fn_x2,QuantType.per_1x32,1,0,32,0,23.0803,moe_ck2stages_gemm1_64x32x32x128_1x1_MulABScaleShuffled_v3_Nswizzle0_Quant3_MulRoutedWeight0_silu_FP4X2_FP4X2_B16,0.0,16.2458,moe_ck2stages_gemm2_64x32x32x128_1x1_MulABScaleExpertWeightShuffled_v1_Nswizzle0_Quant3_MulRoutedWeight1_FP4X2_FP4X2_B16,0.0012,39.3261,0,0,0,0.0,0.0,flydsl_fallback
256,16,4096,256,512,10,ActivationType.Silu,torch.bfloat16,torch.float4_e2m1fn_x2,torch.float4_e2m1fn_x2,QuantType.per_1x32,1,0,32,0,34.7981,moe_ck2stages_gemm1_64x32x32x128_1x1_MulABScaleShuffled_v3_Nswizzle0_Quant3_MulRoutedWeight0_silu_FP4X2_FP4X2_B16,0.0,22.7451,moe_ck2stages_gemm2_64x32x32x128_1x1_MulABScaleExpertWeightShuffled_v1_Nswizzle0_Quant3_MulRoutedWeight1_FP4X2_FP4X2_B16,0.0015,57.5432,0,0,0,0.0,0.0,flydsl_fallback
256,32,4096,256,512,10,ActivationType.Silu,torch.bfloat16,torch.float4_e2m1fn_x2,torch.float4_e2m1fn_x2,QuantType.per_1x32,1,0,32,0,55.099,moe_ck2stages_gemm1_64x32x32x128_1x1_MulABScaleShuffled_v3_Nswizzle0_Quant3_MulRoutedWeight0_silu_FP4X2_FP4X2_B16,0.0,32.8657,moe_ck2stages_gemm2_64x32x32x128_1x1_MulABScaleExpertWeightShuffled_v1_Nswizzle0_Quant3_MulRoutedWeight1_FP4X2_FP4X2_B16,0.0014,87.9647,0,0,0,0.0,0.0,flydsl_fallback
256,64,4096,256,512,10,ActivationType.Silu,torch.bfloat16,torch.float4_e2m1fn_x2,torch.float4_e2m1fn_x2,QuantType.per_1x32,1,0,32,0,77.97529999999999,moe_ck2stages_gemm1_64x32x32x128_1x1_MulABScaleShuffled_v3_Nswizzle0_Quant3_MulRoutedWeight0_silu_FP4X2_FP4X2_B16,0.0,43.8912,moe_ck2stages_gemm2_64x32x32x128_1x1_MulABScaleExpertWeightShuffled_v1_Nswizzle0_Quant3_MulRoutedWeight1_FP4X2_FP4X2_B16,0.0017,121.8665,0,0,0,0.0,0.0,flydsl_fallback
256,128,4096,256,512,10,ActivationType.Silu,torch.bfloat16,torch.float4_e2m1fn_x2,torch.float4_e2m1fn_x2,QuantType.per_1x32,1,0,32,0,96.8916,moe_ck2stages_gemm1_64x32x32x128_1x1_MulABScaleShuffled_v3_Nswizzle0_Quant3_MulRoutedWeight0_silu_FP4X2_FP4X2_B16,0.0,56.0101,moe_ck2stages_gemm2_64x32x32x128_1x1_MulABScaleExpertWeightShuffled_v1_Nswizzle0_Quant3_MulRoutedWeight1_FP4X2_FP4X2_B16,0.0017,152.9017,0,0,0,0.0,0.0,flydsl_fallback
256,256,4096,256,512,10,ActivationType.Silu,torch.bfloat16,torch.float4_e2m1fn_x2,torch.float4_e2m1fn_x2,QuantType.per_1x32,1,0,32,0,106.3327,moe_ck2stages_gemm1_64x32x32x128_1x1_MulABScaleShuffled_v3_Nswizzle0_Quant3_MulRoutedWeight0_silu_FP4X2_FP4X2_B16,0.0,61.2544,moe_ck2stages_gemm2_64x32x32x128_1x1_MulABScaleExpertWeightShuffled_v1_Nswizzle0_Quant3_MulRoutedWeight1_FP4X2_FP4X2_B16,0.0017,167.5871,0,0,0,0.0,0.0,flydsl_fallback
256,512,4096,256,512,10,ActivationType.Silu,torch.bfloat16,torch.float4_e2m1fn_x2,torch.float4_e2m1fn_x2,QuantType.per_1x32,1,0,32,0,109.7165,moe_ck2stages_gemm1_64x32x32x128_1x1_MulABScaleShuffled_v3_Nswizzle0_Quant3_MulRoutedWeight0_silu_FP4X2_FP4X2_B16,0.0,67.0832,moe_ck2stages_gemm2_64x32x32x128_1x1_MulABScaleExpertWeightShuffled_v1_Nswizzle0_Quant3_MulRoutedWeight1_FP4X2_FP4X2_B16,0.0017,176.7997,0,0,0,0.0,0.0,flydsl_fallback
256,1024,4096,256,512,10,ActivationType.Silu,torch.bfloat16,torch.float4_e2m1fn_x2,torch.float4_e2m1fn_x2,QuantType.per_1x32,1,0,32,0,116.02,moe_ck2stages_gemm1_64x32x32x128_1x1_MulABScaleShuffled_v3_Nswizzle0_Quant3_MulRoutedWeight0_silu_FP4X2_FP4X2_B16,0.0,84.338,moe_ck2stages_gemm2_64x32x32x128_1x1_MulABScaleExpertWeightShuffled_v1_Nswizzle0_Quant3_MulRoutedWeight1_FP4X2_FP4X2_B16,0.0016,200.358,0,0,0,0.0,0.0,flydsl_fallback
256,2048,4096,256,512,10,ActivationType.Silu,torch.bfloat16,torch.float4_e2m1fn_x2,torch.float4_e2m1fn_x2,QuantType.per_1x32,1,0,32,0,141.96210000000002,moe_ck2stages_gemm1_64x32x32x128_1x1_MulABScaleShuffled_v3_Nswizzle0_Quant3_MulRoutedWeight0_silu_FP4X2_FP4X2_B16,0.0,148.9518,moe_ck2stages_gemm2_64x32x32x128_1x1_MulABScaleExpertWeightShuffled_v1_Nswizzle0_Quant3_MulRoutedWeight1_FP4X2_FP4X2_B16,0.0017,290.9139,0,0,0,0.0,0.0,flydsl_fallback
256,4096,4096,256,512,10,ActivationType.Silu,torch.bfloat16,torch.float4_e2m1fn_x2,torch.float4_e2m1fn_x2,QuantType.per_1x32,1,0,128,0,157.3485,moe_ck2stages_gemm1_256x128x128x128_1x4_MulABScaleShuffled_v3_Nswizzle0_Quant3_MulRoutedWeight0_silu_FP4X2_FP4X2_B16,0.0,295.767,moe_ck2stages_gemm2_64x128x128x128_1x1_MulABScaleExpertWeightShuffled_v3_Nswizzle0_Quant3_MulRoutedWeight1_FP4X2_FP4X2_B16,0.0017,453.1155,0,0,0,0.0,0.0,flydsl_fallback
256,8192,4096,256,512,10,ActivationType.Silu,torch.bfloat16,torch.float4_e2m1fn_x2,torch.float4_e2m1fn_x2,QuantType.per_1x32,1,0,128,0,271.8116,moe_ck2stages_gemm1_256x128x128x128_1x4_MulABScaleShuffled_v3_Nswizzle0_Quant3_MulRoutedWeight0_silu_FP4X2_FP4X2_B16,0.0,548.1027,moe_ck2stages_gemm2_64x128x128x128_1x1_MulABScaleExpertWeightShuffled_v3_Nswizzle0_Quant3_MulRoutedWeight1_FP4X2_FP4X2_B16,0.0016,819.9143,0,0,0,0.0,0.0,flydsl_fallback
256,16384,4096,256,512,10,ActivationType.Silu,torch.bfloat16,torch.float4_e2m1fn_x2,torch.float4_e2m1fn_x2,QuantType.per_1x32,1,0,128,0,424.6578,moe_ck2stages_gemm1_256x128x128x128_1x4_MulABScaleShuffled_v3_Nswizzle0_Quant3_MulRoutedWeight0_silu_FP4X2_FP4X2_B16,0.0,1053.187,moe_ck2stages_gemm2_64x128x128x128_1x1_MulABScaleExpertWeightShuffled_v3_Nswizzle0_Quant3_MulRoutedWeight1_FP4X2_FP4X2_B16,0.0017,1477.8448,0,0,0,0.0,0.0,flydsl_fallback
256,32768,4096,256,512,10,ActivationType.Silu,torch.bfloat16,torch.float4_e2m1fn_x2,torch.float4_e2m1fn_x2,QuantType.per_1x32,1,0,128,0,667.0119,moe_ck2stages_gemm1_256x128x128x128_1x4_MulABScaleShuffled_v3_Nswizzle0_Quant3_MulRoutedWeight0_silu_FP4X2_FP4X2_B16,0.0,2099.58,moe_ck2stages_gemm2_64x128x128x128_1x1_MulABScaleExpertWeightShuffled_v3_Nswizzle0_Quant3_MulRoutedWeight1_FP4X2_FP4X2_B16,0.0017,2766.5919,0,0,0,0.0,0.0,flydsl_fallback
256,1,4096,512,512,10,ActivationType.Silu,torch.bfloat16,torch.float4_e2m1fn_x2,torch.float4_e2m1fn_x2,QuantType.per_1x32,1,0,16,0,21.2804,_ZN5aiter50fmoe_bf16_pertokenMXfp4_g1u1_flat_novs_silu_16x128E,0.0%,0.0,,0.0%,21.2804,1,1,1,5.91,0.0,
256,1,4096,512,512,10,ActivationType.Silu,torch.bfloat16,torch.float4_e2m1fn_x2,torch.float4_e2m1fn_x2,QuantType.per_1x32,1,0,32,0,17.6885,moe_ck2stages_gemm1_64x32x32x128_1x1_MulABScaleShuffled_v3_Nswizzle0_Quant3_MulRoutedWeight0_silu_FP4X2_FP4X2_B16,0.0,8.0203,moe_ck2stages_gemm2_256x32x128x128_1x4_MulABScaleExpertWeightShuffled_v3_Nswizzle0_Quant3_MulRoutedWeight1_FP4X2_FP4X2_B16,0.0088,25.7088,0,0,0,0.0,0.0,flydsl_fallback
256,1,4096,512,513,11,ActivationType.Silu,torch.bfloat16,torch.float4_e2m1fn_x2,torch.float4_e2m1fn_x2,QuantType.per_1x32,1,0,16,0,21.572,_ZN5aiter50fmoe_bf16_pertokenMXfp4_g1u1_flat_novs_silu_16x128E,0.0%,0.0,,0.0%,21.572,1,1,1,6.42,0.0,
256,1,4096,512,513,11,ActivationType.Silu,torch.bfloat16,torch.float4_e2m1fn_x2,torch.float4_e2m1fn_x2,QuantType.per_1x32,1,0,32,0,17.4754,moe_ck2stages_gemm1_64x32x32x128_1x1_MulABScaleShuffled_v3_Nswizzle0_Quant3_MulRoutedWeight0_silu_FP4X2_FP4X2_B16,0.0,8.2569,moe_ck2stages_gemm2_256x32x128x128_1x4_MulABScaleExpertWeightShuffled_v3_Nswizzle0_Quant3_MulRoutedWeight1_FP4X2_FP4X2_B16,0.0083,25.7323,0,0,0,0.0,0.0,flydsl_fallback
256,2,4096,512,512,10,ActivationType.Silu,torch.bfloat16,torch.float4_e2m1fn_x2,torch.float4_e2m1fn_x2,QuantType.per_1x32,1,0,16,0,21.7172,_ZN5aiter50fmoe_bf16_pertokenMXfp4_g1u1_flat_novs_silu_16x128E,0.0%,0.0,,0.0%,21.7172,1,1,1,11.59,0.0,
256,2,4096,512,512,10,ActivationType.Silu,torch.bfloat16,torch.float4_e2m1fn_x2,torch.float4_e2m1fn_x2,QuantType.per_1x32,1,0,32,0,19.3103,moe_ck2stages_gemm1_64x32x32x128_1x1_MulABScaleShuffled_v3_Nswizzle0_Quant3_MulRoutedWeight0_silu_FP4X2_FP4X2_B16,0.0,9.3455,moe_ck2stages_gemm2_256x32x128x128_1x4_MulABScaleExpertWeightShuffled_v3_Nswizzle0_Quant3_MulRoutedWeight1_FP4X2_FP4X2_B16,0.007,28.6558,0,0,0,0.0,0.0,flydsl_fallback
256,2,4096,512,513,11,ActivationType.Silu,torch.bfloat16,torch.float4_e2m1fn_x2,torch.float4_e2m1fn_x2,QuantType.per_1x32,1,0,16,0,22.312,_ZN5aiter50fmoe_bf16_pertokenMXfp4_g1u1_flat_novs_silu_16x128E,0.0%,0.0,,0.0%,22.312,1,1,1,12.41,0.0,
256,2,4096,512,513,11,ActivationType.Silu,torch.bfloat16,torch.float4_e2m1fn_x2,torch.float4_e2m1fn_x2,QuantType.per_1x32,1,0,32,0,18.9735,moe_ck2stages_gemm1_64x32x32x128_1x1_MulABScaleShuffled_v3_Nswizzle0_Quant3_MulRoutedWeight0_silu_FP4X2_FP4X2_B16,0.0,9.8199,moe_ck2stages_gemm2_256x32x128x128_1x4_MulABScaleExpertWeightShuffled_v3_Nswizzle0_Quant3_MulRoutedWeight1_FP4X2_FP4X2_B16,0.0057,28.7934,0,0,0,0.0,0.0,flydsl_fallback
256,4,4096,512,512,10,ActivationType.Silu,torch.bfloat16,torch.float4_e2m1fn_x2,torch.float4_e2m1fn_x2,QuantType.per_1x32,1,0,16,0,26.0233,_ZN5aiter50fmoe_bf16_pertokenMXfp4_g1u1_flat_novs_silu_16x128E,0.0%,0.0,,0.0%,26.0233,1,1,1,19.34,0.0,
256,4,4096,512,512,10,ActivationType.Silu,torch.bfloat16,torch.float4_e2m1fn_x2,torch.float4_e2m1fn_x2,QuantType.per_1x32,1,0,32,0,24.8836,moe_ck2stages_gemm1_64x32x32x128_1x1_MulABScaleShuffled_v3_Nswizzle0_Quant3_MulRoutedWeight0_silu_FP4X2_FP4X2_B16,0.0,17.2134,moe_ck2stages_gemm2_256x32x128x128_1x4_MulABScaleExpertWeightShuffled_v3_Nswizzle0_Quant3_MulRoutedWeight1_FP4X2_FP4X2_B16,0.006,42.097,0,0,0,0.0,0.0,flydsl_fallback
256,4,4096,512,513,11,ActivationType.Silu,torch.bfloat16,torch.float4_e2m1fn_x2,torch.float4_e2m1fn_x2,QuantType.per_1x32,1,0,16,0,27.3593,_ZN5aiter50fmoe_bf16_pertokenMXfp4_g1u1_flat_novs_silu_16x128E,0.0%,0.0,,0.0%,27.3593,1,1,1,20.24,0.0,
256,4,4096,512,513,11,ActivationType.Silu,torch.bfloat16,torch.float4_e2m1fn_x2,torch.float4_e2m1fn_x2,QuantType.per_1x32,1,0,32,0,23.6691,moe_ck2stages_gemm1_64x32x32x128_1x1_MulABScaleShuffled_v3_Nswizzle0_Quant3_MulRoutedWeight0_silu_FP4X2_FP4X2_B16,0.0,17.7236,moe_ck2stages_gemm2_256x32x128x128_1x4_MulABScaleExpertWeightShuffled_v3_Nswizzle0_Quant3_MulRoutedWeight1_FP4X2_FP4X2_B16,0.0075,41.3927,0,0,0,0.0,0.0,flydsl_fallback
256,8,4096,512,512,10,ActivationType.Silu,torch.bfloat16,torch.float4_e2m1fn_x2,torch.float4_e2m1fn_x2,QuantType.per_1x32,1,0,16,0,53.93,_ZN5aiter50fmoe_bf16_pertokenMXfp4_g1u1_flat_novs_silu_16x256E,0.0%,0.0,,0.0%,53.93,1,1,1,18.66,0.0,
256,8,4096,512,512,10,ActivationType.Silu,torch.bfloat16,torch.float4_e2m1fn_x2,torch.float4_e2m1fn_x2,QuantType.per_1x32,1,0,32,0,37.1225,moe_ck2stages_gemm1_64x32x32x128_1x1_MulABScaleShuffled_v3_Nswizzle0_Quant3_MulRoutedWeight0_silu_FP4X2_FP4X2_B16,0.0,23.4969,moe_ck2stages_gemm2_256x32x128x128_1x4_MulABScaleExpertWeightShuffled_v3_Nswizzle0_Quant3_MulRoutedWeight1_FP4X2_FP4X2_B16,0.0062,60.6194,0,0,0,0.0,0.0,flydsl_fallback
256,8,4096,512,513,11,ActivationType.Silu,torch.bfloat16,torch.float4_e2m1fn_x2,torch.float4_e2m1fn_x2,QuantType.per_1x32,1,0,16,0,56.85,_ZN5aiter50fmoe_bf16_pertokenMXfp4_g1u1_flat_novs_silu_16x256E,0.0%,0.0,,0.0%,56.85,1,1,1,19.47,0.0,
256,8,4096,512,513,11,ActivationType.Silu,torch.bfloat16,torch.float4_e2m1fn_x2,torch.float4_e2m1fn_x2,QuantType.per_1x32,1,0,32,0,40.5093,moe_ck2stages_gemm1_64x32x32x128_1x1_MulABScaleShuffled_v3_Nswizzle0_Quant3_MulRoutedWeight0_silu_FP4X2_FP4X2_B16,0.0,25.3297,moe_ck2stages_gemm2_256x32x128x128_1x4_MulABScaleExpertWeightShuffled_v3_Nswizzle0_Quant3_MulRoutedWeight1_FP4X2_FP4X2_B16,0.0077,65.839,0,0,0,0.0,0.0,flydsl_fallback
256,16,4096,512,512,10,ActivationType.Silu,torch.bfloat16,torch.float4_e2m1fn_x2,torch.float4_e2m1fn_x2,QuantType.per_1x32,1,0,16,0,95.2404,_ZN5aiter50fmoe_bf16_pertokenMXfp4_g1u1_flat_novs_silu_16x128E,0.0%,0.0,,0.0%,95.2404,1,1,1,21.14,0.0,
256,16,4096,512,512,10,ActivationType.Silu,torch.bfloat16,torch.float4_e2m1fn_x2,torch.float4_e2m1fn_x2,QuantType.per_1x32,1,0,32,0,63.3791,moe_ck2stages_gemm1_64x32x32x128_1x1_MulABScaleShuffled_v3_Nswizzle0_Quant3_MulRoutedWeight0_silu_FP4X2_FP4X2_B16,0.0,35.6999,moe_ck2stages_gemm2_256x32x128x128_1x4_MulABScaleExpertWeightShuffled_v3_Nswizzle0_Quant3_MulRoutedWeight1_FP4X2_FP4X2_B16,0.0059,99.079,0,0,0,0.0,0.0,flydsl_fallback
256,16,4096,512,513,11,ActivationType.Silu,torch.bfloat16,torch.float4_e2m1fn_x2,torch.float4_e2m1fn_x2,QuantType.per_1x32,1,0,16,0,100.8484,_ZN5aiter50fmoe_bf16_pertokenMXfp4_g1u1_flat_novs_silu_16x128E,0.0%,0.0,,0.0%,100.8484,1,1,1,21.96,0.0,
256,16,4096,512,513,11,ActivationType.Silu,torch.bfloat16,torch.float4_e2m1fn_x2,torch.float4_e2m1fn_x2,QuantType.per_1x32,1,0,32,0,66.8593,moe_ck2stages_gemm1_64x32x32x128_1x1_MulABScaleShuffled_v3_Nswizzle0_Quant3_MulRoutedWeight0_silu_FP4X2_FP4X2_B16,0.0,37.1241,moe_ck2stages_gemm2_256x32x128x128_1x4_MulABScaleExpertWeightShuffled_v3_Nswizzle0_Quant3_MulRoutedWeight1_FP4X2_FP4X2_B16,0.0077,103.9834,0,0,0,0.0,0.0,flydsl_fallback
256,32,4096,512,512,10,ActivationType.Silu,torch.bfloat16,torch.float4_e2m1fn_x2,torch.float4_e2m1fn_x2,QuantType.per_1x32,1,0,32,0,90.7651,flydsl_moe1_afp4_wfp4_bf16_t32x64x256_w4,0.0%,50.0789,flydsl_moe2_afp4_wfp4_bf16_t16x128x256_atomic_bnt2_sbm32,0.7%,140.844,0,0,0,28.59,22873.67,
256,32,4096,512,512,10,ActivationType.Silu,torch.bfloat16,torch.float4_e2m1fn_x2,torch.float4_e2m1fn_x2,QuantType.per_1x32,1,0,32,0,99.84,moe_ck2stages_gemm1_64x32x32x128_1x1_MulABScaleShuffled_v3_Nswizzle0_Quant3_MulRoutedWeight0_silu_FP4X2_FP4X2_B16,0.0,54.2152,moe_ck2stages_gemm2_256x32x128x128_1x4_MulABScaleExpertWeightShuffled_v3_Nswizzle0_Quant3_MulRoutedWeight1_FP4X2_FP4X2_B16,0.0063,154.0552,0,0,0,0.0,0.0,flydsl_fallback
256,32,4096,512,513,11,ActivationType.Silu,torch.bfloat16,torch.float4_e2m1fn_x2,torch.float4_e2m1fn_x2,QuantType.per_1x32,1,0,32,0,95.9892,flydsl_moe1_afp4_wfp4_bf16_t32x64x256_w3,0.0%,54.2338,flydsl_moe2_afp4_wfp4_bf16_t32x128x256_atomic_bnt2,0.7%,150.223,0,0,0,29.48,21487.46,
256,32,4096,512,513,11,ActivationType.Silu,torch.bfloat16,torch.float4_e2m1fn_x2,torch.float4_e2m1fn_x2,QuantType.per_1x32,1,0,32,0,107.847,moe_ck2stages_gemm1_64x32x32x128_1x1_MulABScaleShuffled_v3_Nswizzle0_Quant3_MulRoutedWeight0_silu_FP4X2_FP4X2_B16,0.0,56.9317,moe_ck2stages_gemm2_256x32x128x128_1x4_MulABScaleExpertWeightShuffled_v3_Nswizzle0_Quant3_MulRoutedWeight1_FP4X2_FP4X2_B16,0.0076,164.7787,0,0,0,0.0,0.0,flydsl_fallback
256,64,4096,512,512,10,ActivationType.Silu,torch.bfloat16,torch.float4_e2m1fn_x2,torch.float4_e2m1fn_x2,QuantType.per_1x32,1,0,32,0,131.4967,flydsl_moe1_afp4_wfp4_bf16_t32x64x256_w3,0.0%,72.603,flydsl_moe2_afp4_wfp4_bf16_t32x256x256_reduce_bnt2,0.0%,204.0997,0,0,0,39.46,15786.46,
256,64,4096,512,512,10,ActivationType.Silu,torch.bfloat16,torch.float4_e2m1fn_x2,torch.float4_e2m1fn_x2,QuantType.per_1x32,1,0,32,0,146.20080000000002,moe_ck2stages_gemm1_64x32x32x128_1x1_MulABScaleShuffled_v3_Nswizzle0_Quant3_MulRoutedWeight0_silu_FP4X2_FP4X2_B16,0.0,76.025,moe_ck2stages_gemm2_256x32x128x128_1x4_MulABScaleExpertWeightShuffled_v3_Nswizzle0_Quant3_MulRoutedWeight1_FP4X2_FP4X2_B16,0.0062,222.2258,0,0,0,0.0,0.0,flydsl_fallback
256,64,4096,512,513,11,ActivationType.Silu,torch.bfloat16,torch.float4_e2m1fn_x2,torch.float4_e2m1fn_x2,QuantType.per_1x32,1,0,32,0,142.5468,flydsl_moe1_afp4_wfp4_bf16_t32x64x256_w4,0.0%,76.7286,flydsl_moe2_afp4_wfp4_bf16_t16x256x256_reduce_bnt2_persist_sbm32,0.0%,219.2754,0,0,0,40.4,14722.6,
256,64,4096,512,513,11,ActivationType.Silu,torch.bfloat16,torch.float4_e2m1fn_x2,torch.float4_e2m1fn_x2,QuantType.per_1x32,1,0,32,0,156.3441,moe_ck2stages_gemm1_64x32x32x128_1x1_MulABScaleShuffled_v3_Nswizzle0_Quant3_MulRoutedWeight0_silu_FP4X2_FP4X2_B16,0.0,79.9287,moe_ck2stages_gemm2_256x32x128x128_1x4_MulABScaleExpertWeightShuffled_v3_Nswizzle0_Quant3_MulRoutedWeight1_FP4X2_FP4X2_B16,0.0074,236.2728,0,0,0,0.0,0.0,flydsl_fallback
256,128,4096,512,512,10,ActivationType.Silu,torch.bfloat16,torch.float4_e2m1fn_x2,torch.float4_e2m1fn_x2,QuantType.per_1x32,1,0,32,0,164.50629999999998,flydsl_moe1_afp4_wfp4_bf16_t32x64x256_w3,0.0%,88.5413,flydsl_moe2_afp4_wfp4_bf16_t16x128x256_atomic_bnt2_persist_sbm32,0.6%,253.0476,0,0,0,63.65,12735.94,
256,128,4096,512,512,10,ActivationType.Silu,torch.bfloat16,torch.float4_e2m1fn_x2,torch.float4_e2m1fn_x2,QuantType.per_1x32,1,0,32,0,186.4223,moe_ck2stages_gemm1_64x32x32x128_1x1_MulABScaleShuffled_v3_Nswizzle0_Quant3_MulRoutedWeight0_silu_FP4X2_FP4X2_B16,0.0,94.9764,moe_ck2stages_gemm2_256x32x128x128_1x4_MulABScaleExpertWeightShuffled_v3_Nswizzle0_Quant3_MulRoutedWeight1_FP4X2_FP4X2_B16,0.0062,281.3987,0,0,0,0.0,0.0,flydsl_fallback
256,128,4096,512,513,11,ActivationType.Silu,torch.bfloat16,torch.float4_e2m1fn_x2,torch.float4_e2m1fn_x2,QuantType.per_1x32,1,0,32,0,170.497,flydsl_moe1_afp4_wfp4_bf16_t32x64x256_w2,0.0%,88.8792,flydsl_moe2_afp4_wfp4_bf16_t16x128x256_atomic_bnt2_sbm32,0.7%,259.3762,0,0,0,68.31,12449.45,
256,128,4096,512,513,11,ActivationType.Silu,torch.bfloat16,torch.float4_e2m1fn_x2,torch.float4_e2m1fn_x2,QuantType.per_1x32,1,0,32,0,188.4135,moe_ck2stages_gemm1_64x32x32x128_1x1_MulABScaleShuffled_v3_Nswizzle0_Quant3_MulRoutedWeight0_silu_FP4X2_FP4X2_B16,0.0,95.9313,moe_ck2stages_gemm2_256x32x128x128_1x4_MulABScaleExpertWeightShuffled_v3_Nswizzle0_Quant3_MulRoutedWeight1_FP4X2_FP4X2_B16,0.007,284.3448,0,0,0,0.0,0.0,flydsl_fallback
256,256,4096,512,512,10,ActivationType.Silu,torch.bfloat16,torch.float4_e2m1fn_x2,torch.float4_e2m1fn_x2,QuantType.per_1x32,1,0,32,0,180.07840000000002,flydsl_moe1_afp4_wfp4_bf16_t32x32x256_w4,0.0%,98.1332,flydsl_moe2_afp4_wfp4_bf16_t16x128x256_atomic_bnt2_persist_sbm32,0.6%,278.2116,0,0,0,115.78,11589.64,
256,256,4096,512,512,10,ActivationType.Silu,torch.bfloat16,torch.float4_e2m1fn_x2,torch.float4_e2m1fn_x2,QuantType.per_1x32,1,0,32,0,200.5651,moe_ck2stages_gemm1_64x32x32x128_1x1_MulABScaleShuffled_v3_Nswizzle0_Quant3_MulRoutedWeight0_silu_FP4X2_FP4X2_B16,0.0,106.5029,moe_ck2stages_gemm2_256x32x128x128_1x4_MulABScaleExpertWeightShuffled_v3_Nswizzle0_Quant3_MulRoutedWeight1_FP4X2_FP4X2_B16,0.0063,307.068,0,0,0,0.0,0.0,flydsl_fallback
256,256,4096,512,513,11,ActivationType.Silu,torch.bfloat16,torch.float4_e2m1fn_x2,torch.float4_e2m1fn_x2,QuantType.per_1x32,1,0,32,0,180.6247,flydsl_moe1_afp4_wfp4_bf16_t32x64x256_w2,0.0%,97.6837,flydsl_moe2_afp4_wfp4_bf16_t16x128x256_atomic_bnt2_sbm32,0.7%,278.3084,0,0,0,127.32,11608.21,
256,256,4096,512,513,11,ActivationType.Silu,torch.bfloat16,torch.float4_e2m1fn_x2,torch.float4_e2m1fn_x2,QuantType.per_1x32,1,0,32,0,199.7229,moe_ck2stages_gemm1_64x32x32x128_1x1_MulABScaleShuffled_v3_Nswizzle0_Quant3_MulRoutedWeight0_silu_FP4X2_FP4X2_B16,0.0,106.8223,moe_ck2stages_gemm2_256x32x128x128_1x4_MulABScaleExpertWeightShuffled_v3_Nswizzle0_Quant3_MulRoutedWeight1_FP4X2_FP4X2_B16,0.007,306.5452,0,0,0,0.0,0.0,flydsl_fallback
256,512,4096,512,512,10,ActivationType.Silu,torch.bfloat16,torch.float4_e2m1fn_x2,torch.float4_e2m1fn_x2,QuantType.per_1x32,1,0,32,0,185.0039,flydsl_moe1_afp4_wfp4_bf16_t32x64x256_w2,0.0%,102.9661,flydsl_moe2_afp4_wfp4_bf16_t32x256x256_atomic_bnt2_xcd4,0.7%,287.97,0,0,0,223.72,11207.82,
256,512,4096,512,512,10,ActivationType.Silu,torch.bfloat16,torch.float4_e2m1fn_x2,torch.float4_e2m1fn_x2,QuantType.per_1x32,1,0,32,0,204.9995,moe_ck2stages_gemm1_64x32x32x128_1x1_MulABScaleShuffled_v3_Nswizzle0_Quant3_MulRoutedWeight0_silu_FP4X2_FP4X2_B16,0.0,116.2286,moe_ck2stages_gemm2_256x32x128x128_1x4_MulABScaleExpertWeightShuffled_v3_Nswizzle0_Quant3_MulRoutedWeight1_FP4X2_FP4X2_B16,0.0065,321.2281,0,0,0,0.0,0.0,flydsl_fallback
256,512,4096,512,513,11,ActivationType.Silu,torch.bfloat16,torch.float4_e2m1fn_x2,torch.float4_e2m1fn_x2,QuantType.per_1x32,1,0,32,0,185.9697,flydsl_moe1_afp4_wfp4_bf16_t32x64x256_w4,0.0%,104.3151,flydsl_moe2_afp4_wfp4_bf16_t32x256x256_atomic_bnt2_xcd4_persist,0.7%,290.2848,0,0,0,244.13,11140.12,
256,512,4096,512,513,11,ActivationType.Silu,torch.bfloat16,torch.float4_e2m1fn_x2,torch.float4_e2m1fn_x2,QuantType.per_1x32,1,0,32,0,206.1466,moe_ck2stages_gemm1_64x32x32x128_1x1_MulABScaleShuffled_v3_Nswizzle0_Quant3_MulRoutedWeight0_silu_FP4X2_FP4X2_B16,0.0,118.4606,moe_ck2stages_gemm2_256x32x128x128_1x4_MulABScaleExpertWeightShuffled_v3_Nswizzle0_Quant3_MulRoutedWeight1_FP4X2_FP4X2_B16,0.0069,324.6072,0,0,0,0.0,0.0,flydsl_fallback
256,1024,4096,512,512,10,ActivationType.Silu,torch.bfloat16,torch.float4_e2m1fn_x2,torch.float4_e2m1fn_x2,QuantType.per_1x32,1,0,32,0,193.4192,flydsl_moe1_afp4_wfp4_bf16_t32x64x256_w2,0.0%,113.4442,flydsl_moe2_afp4_wfp4_bf16_t32x256x256_atomic_bnt2_xcd4_persist,0.6%,306.8634,0,0,0,419.89,10538.27,
256,1024,4096,512,512,10,ActivationType.Silu,torch.bfloat16,torch.float4_e2m1fn_x2,torch.float4_e2m1fn_x2,QuantType.per_1x32,1,0,32,0,214.0805,moe_ck2stages_gemm1_64x32x32x128_1x1_MulABScaleShuffled_v3_Nswizzle0_Quant3_MulRoutedWeight0_silu_FP4X2_FP4X2_B16,0.0,154.8544,moe_ck2stages_gemm2_256x32x128x128_1x4_MulABScaleExpertWeightShuffled_v3_Nswizzle0_Quant3_MulRoutedWeight1_FP4X2_FP4X2_B16,0.0065,368.9349,0,0,0,0.0,0.0,flydsl_fallback
256,1024,4096,512,513,11,ActivationType.Silu,torch.bfloat16,torch.float4_e2m1fn_x2,torch.float4_e2m1fn_x2,QuantType.per_1x32,1,0,32,0,199.1801,flydsl_moe1_afp4_wfp4_bf16_t32x64x256_w4,0.0%,116.705,flydsl_moe2_afp4_wfp4_bf16_t32x256x256_atomic_bnt2_persist,0.7%,315.8851,0,0,0,448.69,10257.21,
256,1024,4096,512,513,11,ActivationType.Silu,torch.bfloat16,torch.float4_e2m1fn_x2,torch.float4_e2m1fn_x2,QuantType.per_1x32,1,0,32,0,218.4614,moe_ck2stages_gemm1_64x32x32x128_1x1_MulABScaleShuffled_v3_Nswizzle0_Quant3_MulRoutedWeight0_silu_FP4X2_FP4X2_B16,0.0,167.5578,moe_ck2stages_gemm2_256x32x128x128_1x4_MulABScaleExpertWeightShuffled_v3_Nswizzle0_Quant3_MulRoutedWeight1_FP4X2_FP4X2_B16,0.0067,386.0192,0,0,0,0.0,0.0,flydsl_fallback
256,2048,4096,512,512,10,ActivationType.Silu,torch.bfloat16,torch.float4_e2m1fn_x2,torch.float4_e2m1fn_x2,QuantType.per_1x32,1,0,64,0,213.9,flydsl_moe1_afp4_wfp4_bf16_t64x64x256_w4,0.0%,164.8452,flydsl_moe2_afp4_wfp4_bf16_t64x128x128_atomic_bnt2,0.6%,378.7452,0,0,0,680.4,8571.44,
256,2048,4096,512,512,10,ActivationType.Silu,torch.bfloat16,torch.float4_e2m1fn_x2,torch.float4_e2m1fn_x2,QuantType.per_1x32,1,0,64,0,245.7346,moe_ck2stages_gemm1_256x64x128x128_1x4_MulABScaleShuffled_v3_Nswizzle0_Quant3_MulRoutedWeight0_silu_FP4X2_FP4X2_B16,0.0,261.9522,moe_ck2stages_gemm2_64x64x128x128_1x1_MulABScaleExpertWeightShuffled_v3_Nswizzle0_Quant3_MulRoutedWeight1_FP4X2_FP4X2_B16,0.0064,507.6868,0,0,0,0.0,0.0,flydsl_fallback
256,2048,4096,512,513,11,ActivationType.Silu,torch.bfloat16,torch.float4_e2m1fn_x2,torch.float4_e2m1fn_x2,QuantType.per_1x32,1,0,64,0,217.5108,flydsl_moe1_afp4_wfp4_bf16_t64x64x256_w3,0.0%,177.0295,flydsl_moe2_afp4_wfp4_bf16_t64x128x256_reduce,0.0%,394.5403,0,0,0,718.48,8244.23,
256,2048,4096,512,513,11,ActivationType.Silu,torch.bfloat16,torch.float4_e2m1fn_x2,torch.float4_e2m1fn_x2,QuantType.per_1x32,1,0,64,0,253.9093,moe_ck2stages_gemm1_256x64x128x128_1x4_MulABScaleShuffled_v3_Nswizzle0_Quant3_MulRoutedWeight0_silu_FP4X2_FP4X2_B16,0.0,270.1086,moe_ck2stages_gemm2_64x64x128x128_1x1_MulABScaleExpertWeightShuffled_v3_Nswizzle0_Quant3_MulRoutedWeight1_FP4X2_FP4X2_B16,0.0067,524.0179,0,0,0,0.0,0.0,flydsl_fallback
256,4096,4096,512,512,10,ActivationType.Silu,torch.bfloat16,torch.float4_e2m1fn_x2,torch.float4_e2m1fn_x2,QuantType.per_1x32,1,0,64,0,276.2867,flydsl_moe1_afp4_wfp4_bf16_t64x128x256_w4_bnt0_xcd4,0.0%,281.6496,flydsl_moe2_afp4_wfp4_bf16_t64x128x256_reduce_persist,0.0%,557.9363,0,0,0,923.75,5863.67,
256,4096,4096,512,512,10,ActivationType.Silu,torch.bfloat16,torch.float4_e2m1fn_x2,torch.float4_e2m1fn_x2,QuantType.per_1x32,1,0,64,0,403.7181,moe_ck2stages_gemm1_256x64x128x128_1x4_MulABScaleShuffled_v3_Nswizzle0_Quant3_MulRoutedWeight0_silu_FP4X2_FP4X2_B16,0.0,421.6375,moe_ck2stages_gemm2_64x64x128x128_1x1_MulABScaleExpertWeightShuffled_v3_Nswizzle0_Quant3_MulRoutedWeight1_FP4X2_FP4X2_B16,0.0064,825.3556,0,0,0,0.0,0.0,flydsl_fallback
256,4096,4096,512,513,11,ActivationType.Silu,torch.bfloat16,torch.float4_e2m1fn_x2,torch.float4_e2m1fn_x2,QuantType.per_1x32,1,0,64,0,292.0433,flydsl_moe1_afp4_wfp4_bf16_t64x128x256_w2_bnt0_xcd4,0.0%,295.6777,flydsl_moe2_afp4_wfp4_bf16_t64x128x256_reduce,0.0%,587.721,0,0,0,964.63,5577.22,
256,4096,4096,512,513,11,ActivationType.Silu,torch.bfloat16,torch.float4_e2m1fn_x2,torch.float4_e2m1fn_x2,QuantType.per_1x32,1,0,64,0,412.7354,moe_ck2stages_gemm1_256x64x128x128_1x4_MulABScaleShuffled_v3_Nswizzle0_Quant3_MulRoutedWeight0_silu_FP4X2_FP4X2_B16,0.0,438.9221,moe_ck2stages_gemm2_64x64x128x128_1x1_MulABScaleExpertWeightShuffled_v3_Nswizzle0_Quant3_MulRoutedWeight1_FP4X2_FP4X2_B16,0.0068,851.6575,0,0,0,0.0,0.0,flydsl_fallback
256,8192,4096,512,512,10,ActivationType.Silu,torch.bfloat16,torch.float4_e2m1fn_x2,torch.float4_e2m1fn_x2,QuantType.per_1x32,1,0,64,0,388.5361,flydsl_moe1_afp4_wfp4_bf16_t64x128x256_w3_bnt0_xcd4,0.0%,470.4931,flydsl_moe2_afp4_wfp4_bf16_t64x128x256_reduce,0.0%,859.0292,0,0,0,1199.95,3867.03,
256,8192,4096,512,512,10,ActivationType.Silu,torch.bfloat16,torch.float4_e2m1fn_x2,torch.float4_e2m1fn_x2,QuantType.per_1x32,1,0,64,0,480.2875,moe_ck2stages_gemm1_256x64x128x128_1x4_MulABScaleShuffled_v3_Nswizzle0_Quant3_MulRoutedWeight0_silu_FP4X2_FP4X2_B16,0.0,709.5527,moe_ck2stages_gemm2_64x64x128x128_1x1_MulABScaleExpertWeightShuffled_v3_Nswizzle0_Quant3_MulRoutedWeight1_FP4X2_FP4X2_B16,0.0064,1189.8402,0,0,0,0.0,0.0,flydsl_fallback
256,8192,4096,512,513,11,ActivationType.Silu,torch.bfloat16,torch.float4_e2m1fn_x2,torch.float4_e2m1fn_x2,QuantType.per_1x32,1,0,64,0,409.8435,flydsl_moe1_afp4_wfp4_bf16_t64x128x256_w4_bnt0_xcd4,0.0%,503.9596,flydsl_moe2_afp4_wfp4_bf16_t64x128x256_reduce,0.0%,913.8031,0,0,0,1240.83,3642.12,
256,8192,4096,512,513,11,ActivationType.Silu,torch.bfloat16,torch.float4_e2m1fn_x2,torch.float4_e2m1fn_x2,QuantType.per_1x32,1,0,64,0,488.6319,moe_ck2stages_gemm1_256x64x128x128_1x4_MulABScaleShuffled_v3_Nswizzle0_Quant3_MulRoutedWeight0_silu_FP4X2_FP4X2_B16,0.0,747.6891,moe_ck2stages_gemm2_64x64x128x128_1x1_MulABScaleExpertWeightShuffled_v3_Nswizzle0_Quant3_MulRoutedWeight1_FP4X2_FP4X2_B16,0.0068,1236.321,0,0,0,0.0,0.0,flydsl_fallback
256,16384,4096,512,512,10,ActivationType.Silu,torch.bfloat16,torch.float4_e2m1fn_x2,torch.float4_e2m1fn_x2,QuantType.per_1x32,1,0,64,0,614.1016999999999,flydsl_moe1_afp4_wfp4_bf16_t64x128x256_w4_bnt0_xcd4,0.0%,893.0302,flydsl_moe2_afp4_wfp4_bf16_t64x128x256_reduce_persist,0.0%,1507.1319,0,0,0,1367.89,2270.9,
256,16384,4096,512,512,10,ActivationType.Silu,torch.bfloat16,torch.float4_e2m1fn_x2,torch.float4_e2m1fn_x2,QuantType.per_1x32,1,0,64,0,686.0074999999999,moe_ck2stages_gemm1_256x64x128x128_1x4_MulABScaleShuffled_v3_Nswizzle0_Quant3_MulRoutedWeight0_silu_FP4X2_FP4X2_B16,0.0,1324.9633,moe_ck2stages_gemm2_64x64x128x128_1x1_MulABScaleExpertWeightShuffled_v3_Nswizzle0_Quant3_MulRoutedWeight1_FP4X2_FP4X2_B16,0.0065,2010.9708,0,0,0,0.0,0.0,flydsl_fallback
256,16384,4096,512,513,11,ActivationType.Silu,torch.bfloat16,torch.float4_e2m1fn_x2,torch.float4_e2m1fn_x2,QuantType.per_1x32,1,0,64,0,660.4435000000001,flydsl_moe1_afp4_wfp4_bf16_t64x128x256_w4_bnt0_xcd4,0.0%,979.0905,flydsl_moe2_afp4_wfp4_bf16_t64x128x256_reduce_persist,0.0%,1639.534,0,0,0,1383.16,2091.35,
256,16384,4096,512,513,11,ActivationType.Silu,torch.bfloat16,torch.float4_e2m1fn_x2,torch.float4_e2m1fn_x2,QuantType.per_1x32,1,0,64,0,730.5108,moe_ck2stages_gemm1_256x64x128x128_1x4_MulABScaleShuffled_v3_Nswizzle0_Quant3_MulRoutedWeight0_silu_FP4X2_FP4X2_B16,0.0,1446.0972,moe_ck2stages_gemm2_64x64x128x128_1x1_MulABScaleExpertWeightShuffled_v3_Nswizzle0_Quant3_MulRoutedWeight1_FP4X2_FP4X2_B16,0.0068,2176.608,0,0,0,0.0,0.0,flydsl_fallback
256,32768,4096,512,512,10,ActivationType.Silu,torch.bfloat16,torch.float4_e2m1fn_x2,torch.float4_e2m1fn_x2,QuantType.per_1x32,1,0,128,0,1086.6719,moe_ck2stages_gemm1_256x128x128x128_1x4_MulABScaleShuffled_v3_Nswizzle0_Quant3_MulRoutedWeight0_silu_FP4X2_FP4X2_B16,0.0%,1683.8059,flydsl_moe2_afp4_wfp4_bf16_t128x128x256_reduce_xcd4_persist,0.0%,2770.4778,0,0,0,1488.25,1308.03,
256,32768,4096,512,512,10,ActivationType.Silu,torch.bfloat16,torch.float4_e2m1fn_x2,torch.float4_e2m1fn_x2,QuantType.per_1x32,1,0,64,0,1205.3797,moe_ck2stages_gemm1_256x64x128x128_1x4_MulABScaleShuffled_v3_Nswizzle0_Quant3_MulRoutedWeight0_silu_FP4X2_FP4X2_B16,0.0,2625.7322,moe_ck2stages_gemm2_64x64x128x128_1x1_MulABScaleExpertWeightShuffled_v3_Nswizzle0_Quant3_MulRoutedWeight1_FP4X2_FP4X2_B16,0.0064,3831.1119,0,0,0,0.0,0.0,flydsl_fallback
256,32768,4096,512,513,11,ActivationType.Silu,torch.bfloat16,torch.float4_e2m1fn_x2,torch.float4_e2m1fn_x2,QuantType.per_1x32,1,0,128,0,1172.434,moe_ck2stages_gemm1_256x128x128x128_1x4_MulABScaleShuffled_v3_Nswizzle0_Quant3_MulRoutedWeight0_silu_FP4X2_FP4X2_B16,0.0%,1917.3507,flydsl_moe2_afp4_wfp4_bf16_t128x128x256_reduce_xcd4_persist,0.0%,3089.7847,0,0,0,1467.9,1174.89,
256,32768,4096,512,513,11,ActivationType.Silu,torch.bfloat16,torch.float4_e2m1fn_x2,torch.float4_e2m1fn_x2,QuantType.per_1x32,1,0,64,0,1312.2085,moe_ck2stages_gemm1_256x64x128x128_1x4_MulABScaleShuffled_v3_Nswizzle0_Quant3_MulRoutedWeight0_silu_FP4X2_FP4X2_B16,0.0,2909.0249,moe_ck2stages_gemm2_64x64x128x128_1x1_MulABScaleExpertWeightShuffled_v3_Nswizzle0_Quant3_MulRoutedWeight1_FP4X2_FP4X2_B16,0.0068,4221.2334,0,0,0,0.0,0.0,flydsl_fallback
